,price,address,logitude,latitude,zipcode,rent,sale,size,year built,bed,bath,Neighborhood,page_url,description
65,450000.00,"319 W 18th St APT 5F, New York, NY 10011",-74.001648,40.742886,10011,0,1,--,1928,0,1,Chelsea and Clinton,https://www.zillow.com:443/homedetails/319-W-18th-St-APT-5F-New-York-NY-10011/72538170_zpid/,"For sale: $450,000. Charming, Bright & Beautiful Pre-war studio in the Heart of Chelsea!

Quiet and serene, this apartment allows for the peace and tranquility you desire in a new home. An open entryway welcomes you to the light filled studio with open sky, and lush treetop garden views. The spacious living area gives the flexibility of multiple layouts to fit your lifestyle. The separate windowed kitchen has been modernized with custom cabinetry, stainless steel appliances and granite countertops to provide the perfect work space for your culinary needs. Sunlight continues through the windowed nook in the bathroom shower where the blooming trees sway outside. Prewar details have been maintained throughout including original hardwood floors, as well as the original plaster crown and wall moldings.

The Chelsea Arms cooperative is a very well maintained elevatory building with recently renovated entrance lobby and common space. Flexible board allows for Co purchasing, and subletting allowed for two years, after two years of ownership. The building also has a live-in superintendent, new laundry room, extra storage facilities, bicycle room and intercom security. Just steps away to many subways, Chelsea Piers, Meatpacking District and The High Line Park ~The charming apartment 5F at The Chelsea Arms would be the perfect new home in Chelsea!"
66,1450000.00,"468 W 23rd St APT 5F, New York, NY 10011",-74.004096,40.747299,10011,0,1,885,1900,2,2,Chelsea and Clinton,https://www.zillow.com:443/homedetails/468-W-23rd-St-APT-5F-New-York-NY-10011/2097920346_zpid/,"For sale: $1,450,000. Calling all outdoor lovers!
Located on the top floor of a boutique prewar condominium townhouse in the heart of Chelsea, this unique two bedroom/two bathroom duplex condo with EXCLUSIVE ROOF TERRACE is truly one of a kind! This bright home features an open kitchen with granite counters, Fisher Paykel dishwasher and refrigerator and cherry cabinets. Easy dining with a kitchen island and large dining area. A skylight floods the living room with natural light; enjoy high ceilings, newly refinished hardwood floors and your own washer/dryer. The master bedroom has floor to ceiling built-in maple cabinets and en-suite bathroom. The second level bedroom has a full bath and access to the large outdoor deck. Entertain on your own 400 sq. ft. roof deck with Hudson River and open city views. Great West Chelsea location with easy access to High Line, Chelsea Piers, Hudson River Park, shopping and A,C,E Trains. Pet friendly and low fees. Please note this wonderful space is a walk up."
67,425000.00,"451 W 22nd St APT 3F, New York, NY 10011",-74.003268,40.746696,10011,0,1,--,1900,0,1,Chelsea and Clinton,https://www.zillow.com:443/homedetails/451-W-22nd-St-APT-3F-New-York-NY-10011/244698626_zpid/,"For sale: $425,000. W. CHELSEA BROWNSTONE CHARMER
This SOUTH FACING SUNNY STUDIO apartment on one of Chelsea's most charming tree lined streets with its' floor to ceiling arched windows, beautiful hardwood floors and very LOW maintenance is the perfect place to call home. Built in approximately 1900, this historic Chelsea brownstone on one of the most beautiful blocks in Manhattan in the center of the art gallery district, just two blocks from the nearest subway and only 1/2 a block from the renowned High Line Park -is surrounded by the best cafes, bars and restaurants NYC has to offer. 

 The well managed coop permits parents purchasing for children, pied-a-terr purchases and pets."
68,5695000.00,"117 W 21st St # 4THFLR, New York, NY 10011",-73.994462,40.742168,10011,0,1,2878,No Data,4,4,Chelsea and Clinton,https://www.zillow.com:443/homedetails/117-W-21st-St-4THFLR-New-York-NY-10011/2085478474_zpid/,"For sale: $5,695,000. The extraordinary embodiment of sleek, innovative contemporary design, The Twenty 1 condominium is a brand new boutique residence setting a premium standard of luxury at the crossroads of prime Chelsea/West Flatiron.The Twenty 1, is a PRIVATE FULL-FLOOR HOME with 4 bedrooms and 3 and a half baths boasts an expansive 2,878 sq ft of chic living space with your OWN PRIVATE PARKING SPOT.  Step from your direct keyed elevator into a private vestibule with honed Supai limestone flooring, beyond which awaits a grand light-filled ambiance graced by exquisite details of the highest caliber. Massive floor-to-ceiling windows, rift cut custom stained oak millwork, wide plank white oak wood flooring in a Chevron pattern, along with the finest finishes, fixtures, stones and marbles are among many superior refinements.Entertaining is seamless and stylish in the window-walled great room that comfortably accommodates spacious living and dining areas. The impeccably- equipped chefs kitchen is a masterful work of art with custom stained eucalyptus cabinetry, soft white glass cabinets with champagne bronze frames, Madre Perola quartzite stone countertops and backsplashes, a Supai limestone tiled floor, Dornbracht Platinum matte fixtures, The stellar Miele appliance package comprised of 2 integrated 30 refrigerators, a 5-burner gas range and hood, stainless steel convection and speed ovens and integrated dishwasher will surely thrill the chef.The epitome of elegance, the generously-sized master bedroom suite is positioned on the opposite side of the home from the other 3 large bedrooms. The sophisticated master spa bath indulges you with a stained oak vanity with double integrated sinks, slab quartzite counters and flooring, Dornbracht polished chrome fixtures, a Vivo soaking tub and Toto toilet. Huge walk-in closets grace all the bedrooms. A full laundry room houses a top-of-the-line LG Steamwasher and Ultra-Large dryer for your convenience.Idyllically situated on prime West 21st Street between Avenue of the Americas and Seventh Avenue, The Twenty 1 offers 9 bespoke residences in downtowns most coveted locale with a part-time doorman, a private garage, private storage and breathtaking rooftop terrace."
69,695000.00,"460 W 23rd St #GB, New York, NY 10011",-74.00379,40.74723,10011,0,1,650,1900,1,1,Chelsea and Clinton,https://www.zillow.com:443/homedetails/460-W-23rd-St-GB-New-York-NY-10011/2099681103_zpid/,"For sale: $695,000. Patio, Jacuzzi Tub and Pre-war Charm!
Enter this perfect South facing garden apartment located in Chelsea's Historic District; embrace the spacious 1 bedroom complete with a wood-burning fireplace and enclosed 300 square foot landscaped patio complete with your very own jacuzzi tub! 

The chef's kitchen has been renovated with Stainless Steel appliances including a Bertazzoni range and microwave, Bosch refrigerator and dishwasher, Hansgrohe faucet, black Kraus sink, granite countertop and wood soft close cabinets. The living room, bedroom and study area have FLOR carpet tiles with original stone floors beneath. The bathroom has been updated with a Hansgrohe rain shower system, sink faucet and Daltile tile. The garden includes its own hose system, electrical, and custom lighting.

There is recessed lighting throughout controlled by Lutron lighting system. One custom closet is in the bedroom and one in the study giving ample storage. Washer/dryer allowed with Board approval.

 Located on one of the most sought after blocks on the High Line Contemporary Art District, home to the Gagosian, the Pace and the Whitney Museum. Dine at many of Manhattans most chic restaurants, shop at the Chelsea market and work out at Chelsea Piers. Close to Major Transportation"
70,3195000.00,"300 W 23rd St # 4E/D, New York, NY 10011",-73.999,40.745201,10011,0,1,1800,1931,3,3,Chelsea and Clinton,https://www.zillow.com:443/homedetails/300-W-23rd-St-4E-D-New-York-NY-10011/2084960804_zpid/,"For sale: $3,195,000. Welcome to your new home! This completely renovated 3 bedroom / 3 bathroom prewar gem experienced a complete transformation, implementing the highest-grade finishes and design. The owners beautifully combined classic and modern design elements incorporating the original prewar details complemented with modern day finishes. 

Very rarely will you find a 3 bedroom / 3 bathroom renovated to this exacting standards. With close to 1,800 SF of living space in prime Chelsea, this home is the result of a yearlong transformation of three separate apts. One cannot express the difficulties associated with combining and redesigning three apartments into one.


The full service prewar building is a beautiful Emory Roth designed coop with condominium like rules. This co-op allows co-purchasing, pied-a-terre, subletting and pets.

Amenities include 24-hour door attendant and staff, live-in resident manager, package room, laundry room, storage available for lease, and a bike room. The building has a private gym avail for scheduled workouts at an additional cost in addition to numerous gyms in the area. 

Electricity is also included in the maintenance charge.

Upon entering the foyer, original beamed ceilings and crown molding welcome guests. Custom milled doors and hardware are by Baldwin. All living and bedrooms face east, receiving beautiful morning light and views of the Empire State Building. Each room is equipped with custom shades and hand-crafted custom-built cabinetry. The master bedroom offers an in-suite bathroom, walk in closet, as well as an office space convertible to an additional walk in closet as needed

The 21' x 13' living room provides ample room for entertaining friends and family. The built-in entertainment center easily accommodates an 82 television.

The kitchen and dining area are located in a separate wing of the home ideal for family gatherings. Appliances include Subzero refrigerator and wine cooler, Dynasty 8 burner range with professional grade vented hood, Miele built in microwave, and Viking dishwasher. The kitchen cabinetry is handcrafted by Rutt cabinetry of Pennsylvania. 
Each bathroom has been outfitted with honed Carrara marble, custom hardware fixtures by Restoration Hardware, toilets by Toto, and 55 soaking tub by Lumina round out the niceties. 

Additionally, the home features central air conditioning with two zones for your comfort.

This home is centrally located in prime Chelsea walking distance to all major cultural and food destinations such as Chelsea market, the Highline, Hudson Yards, Eataly, Madison Sq Park, etc 

Transportation is accessible with the C, E, 1, F, V, N, R, W, Path Trains all within 5 minute walking distance."
71,NaN,NaN,-73.998703,40.736598,NaN,NaN,NaN,5600,1930,NaN,NaN,Chelsea and Clinton,https://www.zillow.com:443/homedetails/127-W-12th-St-New-York-NY-10011/2101165707_zpid/,NaN
72,2290000.00,"161 W 15th St APT 6C, New York, NY 10011",-73.997825,40.738828,10011,0,1,1400,1938,2,2,Chelsea and Clinton,https://www.zillow.com:443/homedetails/161-W-15th-St-APT-6C-New-York-NY-10011/124864668_zpid/,"For sale: $2,290,000. Residence 6C is a masterfully renovated loft, located in one of Chelsea's most unique and historic pre-war buildings. Built in 1919 as the publishing factory for Street and Smith, 161 West 15th is most popularly known as the Jensen Lewis Building. This home features stunning 12-foot beamed ceilings with an abundance of sunlight throughout the day thanks to its southern exposure. 

The main sleeping area fitted with a walk-in closet, leads to a tastefully done en-suite bathroom, which boasts beautiful spa-like finishes. The large sun drenched living room is welcoming and opens to a dining area that is perfect for entertaining. The open modern kitchen has a large island equipped with stainless steel appliances from a Wolf oven range, Miele dishwasher, Liebherr refrigerator and Avanti wine refrigerator. The apartment has a Bosch washer/dryer, ample closet space, and a second sleeping area perfect for guests. 

Located on one of Chelsea's beautiful tree-lined streets and just minutes from transportation, it is truly in the perfect location. The building has a live-in superintendent and a full-time porter."
73,2199000.00,"447 W 18th St # GD2, New York, NY 10011",-74.005401,40.744499,10011,0,1,2277,2009,3,3,Chelsea and Clinton,https://www.zillow.com:443/homedetails/447-W-18th-St-GD2-New-York-NY-10011/2089368178_zpid/,"For sale: $2,199,000. Discreetly located in a full-service building on one of West Chelsea's best blocks, this well-designed, duplex residence offers superb light, 2,277 square feet of sprawling living space, great ceiling heights, and a phenomenal private outdoor terrace. Expansive living areas on both levels may be accessed via the doorman through the building lobby, or directly from 18th Street via its own private entrance. This amazing property boasts a kitchen with a 15-foot island flanked by beautiful custom cabinetry, built-ins, and stainless steel appliances. In addition, the living room and dining area both open up to the kitchen, creating a loft experience that is both livable and well-proportioned.The spacious dining area is large enough to seat 8 to 10 comfortably, while the master bedroom en-suite is located adjacent to the entertaining area and is complemented by an exceptional private terrace. The bathroom features spa-level finishes, including a deep soaking tub and glass shower, which are accentuated by superb hand cut stone and top-of-the-line fixtures. The second level of this loft offers outstanding space, skylights that flood the area with light, and a home office with a full bathroom. The visual feel of this property is dramatic, sophisticated, and well appointed. The beautiful design of this home also features central air conditioning, pre-wiring for surround sound throughout, and European laundry.The Chelsea Modern is an immaculately maintained boutique, high-end residential condominium, offering a 24-hour doorman, a package room with cold storage, outdoor lounge space, and a landscaped, barbecue-equipped roof deck which provides gorgeous city views."
74,21000000.00,"503 W 24th St # 7THFL, New York, NY 10011",-74.00383,40.748574,10011,0,1,3854,No Data,4,4.5,Chelsea and Clinton,https://www.zillow.com:443/homedetails/503-W-24th-St-7THFL-New-York-NY-10011/2087110902_zpid/,"For sale: $21,000,000. Residence 7 at The Getty is a full-floor 3,854 square foot, 4 Bedroom, 4.5 Bathroom residence complete with a 159 square foot balcony with open city views overlooking The High Line and Hudson River. PeterMarino's exquisite craftsmanship and use of unique materials is truly evident with the residence's Espresso Oak Flooring, Dark Walnut Paneling, and Portuguese Aviana Limestone surround for the Gas Fireplace in the living room.The residence features direct elevator access and unparalleled level of finish including floor-to-ceiling customized, clear-cut, clear glass ranging up to 112 SF for a single pane. The gracious open-flowing living room boasts 12 foot ceilings, beautifully open south/west views, and direct access onto the balcony. Elegant walnut doors lead to a separate dining room that is conveniently located off the spacious Daniel Boulud designed kitchen finished with Kinon cabinetry, Italian Fior Di Melo Marble countertops and a suite of Gaggenau appliances.  The master bedroom suite includes dark-walnut paneling throughout the walk-in closet and a luxurious five-fixture bath with hand-selected fully book matched White Lasa marble on the walls, floors and ceilings and elegantly finished with a Kinon vanity and Gessi fixtures in brushed nickel. Three spacious and elegantly proportioned additional bedrooms face east enjoying open views across historic Chelsea. Each en-suite bath showcases custom made Turkish Mirage Marble, Ugandan Zebrino Marble, and Iranian Amber Stratio respectively. Residence 7 includes a multi-zone climate control system complemented by hydronic radiant underfloor heating, dedicated reinforced art walls, and adjustable lighting throughout the home controlled via Lutron Homework's system. Storage room is included.The complete offering terms are in an offering plan available from the sponsor, file number CD15-0212."
75,2150000.00,"50 W 9th St APT 2A, New York, NY 10011",-73.997553,40.733475,10011,0,1,--,1800,2,1,Chelsea and Clinton,https://www.zillow.com:443/homedetails/50-W-9th-St-APT-2A-New-York-NY-10011/82582114_zpid/,"For sale: $2,150,000. Welcome to 50 West 9th Street #2A - This stunning two bedroom / one bath home is located on the Gold Coast of Greenwich Village, and features exquisite original details, and gorgeous custom finishes throughout.

Enter into a gracious foyer leading to a magnificent living room with soaring 10' ceilings, beautiful parquet floors with period millwork, a wood burning fireplace, and over-sized windows with treetop views of one of the most charming blocks in the Village. The striking master bedroom features ample built in shelving, masterfully crafted face nailed oak strip flooring, and a second wood burning fireplace. The luxurious windowed bath is wrapped in Calacatta marble, and fitted with the finest fixtures, and the kitchen has top of the line appliances, abundant counter and cabinet space, and features a tiered bay window to inspire you to create the perfect herb and flower garden.

Considered one of the finest apartment buildings in the Village, the Portsmouth features a full time doorman, a beautifully restored Art Deco lobby, and is convenient to such shopping and dining destinations as Citarella, Blue Hill, and Morandi, and iconic entertainment options such as the Village Vanguard, Blue Note, and the Comedy Cellar. Life at 50 West 9th Street apartment 2A will put you in the center of it all in one of New York City's most exciting, and picturesque neighborhoods."
76,799000.00,"118 Waverly Pl APT 4A, New York, NY 10011",-73.99955,40.732408,10011,0,1,--,1900,1,1,Chelsea and Clinton,https://www.zillow.com:443/homedetails/118-Waverly-Pl-APT-4A-New-York-NY-10011/72512708_zpid/,"For sale: $799,000. *The Heart of Greenwich Village...*



Walk up to this lovely home with a large open living room/dining area with exposed brick, a wood burning fireplace and large windows overlooking the quiet tree-lined block. This one bedroom home has high ceilings with an updated kitchen featuring modern stainless steel appliances and a newly renovated bathroom. The windows overlooking the scenic street are large and allow great sun exposure."
77,19995000.00,"140 W 12th St PENTHOUSE 6B, New York, NY 10011",-73.998978,40.736372,10011,0,1,5304,2013,5,10,Chelsea and Clinton,https://www.zillow.com:443/homedetails/140-W-12th-St-PENTHOUSE-6B-New-York-NY-10011/219646237_zpid/,"For sale: $19,995,000. This spectacular one-of-a-kind 5,307 sf - 5 bedroom - 5.5 bathroom penthouse residence at The Greenwich Lane on West 12th Street is located in the heart of Greenwich Village.  A private parking spot in the building is included.  This apartment was transformed into a stunning home by the renown Studio Shamshiri, who opened the apartment up and pared things down to create a clean, but warm and modern space.  This penthouse is among the largest and best in the entire building.  This home, which has one of the best laid floor plans, is a rare and very special offering that is up for sale for the first time.  It's a must-see for those with a rather discerning and elevated taste level.Inspiration for the home was pulled from British architect William Smalley, specifically seen in the wood paneling and baseboards. The millwork throughout was inspired by Shaker designs and the playroom was inspired by Inezand Vinoodh's Manhattan loft. Other references were pulled from contemporaries including Vincent Van Duysen, Plain English, and the Rivertown Lodge in upstate New York, designed by the firm Workstead.Design highlights include 16' Dinesen Douglas Fir flooring, 30' sofa by Commune for George Smith, the yellow kitchen with hand-painted BBDW tiles, lighting by Apparatus, and the custom Donald Judd inspired bookshelves.  The home is impeccable to the eye, yet very comfortable to live in.  There are many quiet details to enjoy from the custom Nanz hardware to the bespoke BDDW tiles in the kitchen.  There is plenty of custom millwork throughout starting with a very powerful wall-to-wall-statement in the entry foyer that acts as a modern day Manhattan mudroom. The home is delivered with in-wall speakers and a Lutron lighting system. The large eat-in and windowed kitchen would make a chef quite happy.  It comes complete with a 2.5"" end grain butcher block counter at the kitchen island.  The yellow painted, custom shaker style cabinets add a sense of warmth to the home. There are two dishwashers, a 48"" Wolfe range, a high speed in wall Wolfe oven and a subzero refrigerator.  The backsplash is a beautiful, hand-made BDDW tile.  Adjacent to the kitchen is a large walk-through pantry made of custom millwork.  The master suite has two walk-in-closets and an en-suite master bathroom, which is elegantly appointed with a custom millwork vanity with pale marble countertop, under-mounted soaking tub, glass enclosed shower, and marble mosaic floor.  In addition there is a large sitting area that rounds off the suite.Additional bedrooms feature large windows, en-suite bathrooms, and highly-crafted details, including custom millwork beds. Other features include a powder room, washer/dryer, and four-pipe HVAC system with multiple zoned climate controls for maximum year-round flexibility.In addition, the building offers a staggering array of state-of-the-art amenities never before available in the West Village, including a full fitness and wellness level with professionally designed facilities, yoga and treatment rooms, 25-meter swimming pool with hot tub, and high-end golf simulator; spacious residents' lounge, dining room with guest chef's kitchen and separate catering kitchen; a 21-seat screening room; a light-filled children's playroom; bicycle and private storage; and 24-hour attended lobbies. The Greenwich Lane is a collection of five unique addresses and five townhouses nestled together in the West Village, New York's most intimate and desirable neighborhood. Revitalizing nearly a full city block between Twelfth and Eleventh Streets off Seventh Avenue, the development is groundbreaking for its LEED-certified architecture by FXFOWLE, and for world-renowned designer Thomas O'Brien's visionary interiors and dramatic public spaces. A rare mix of historical restoration and innovative new construction, each building carries the grace of its own era: from stately pre-war elegance to modern contemporary sophistication. Every home represents handcrafted luxury, bridging the glamour of Old New York with the ease and individuality of modern living through airy, light- and view-filled residences. All surround a lush central garden, designed by M. Paul Friedberg & Partners, in the spirit of classic village greens."
78,1165000.00,"30 5th Ave APT 7C, New York, NY 10011",-73.995785,40.733312,10011,0,1,--,1923,1,1,Chelsea and Clinton,https://www.zillow.com:443/homedetails/30-5th-Ave-APT-7C-New-York-NY-10011/72513337_zpid/,"For sale: $1,165,000. The perfect Greenwich Village Jewel Box - with a VIEW!

Located in a full service, pre-war Neo Federal style building constructed in 1923, apartment 7C is a beautiful example of the gracious and elegant architecture offered at this coveted gold coast address. 

The C line, which is an oversized one bedroom features a spectacular picture window with an open west exposure, boasting unobstructed city and landmarked, sunset views. 

A proper entrance foyer welcomes you into the home and hosts a large coat and storage closet. A bright, clean and renovated kitchen is open to the living space and features a Bertazonni gas range, dishwasher and stainless refrigerator. 

The generously sized bedroom allows for a California King Bed with plenty of space for en suite home office. In addition, there is a large walk in closet and big window also with open west, sunset views. 

The windowed bathroom is classic NY with white subway tiles, a porcelain sink and a deep soaking tub. 

Apartment 7C features 9.5' beamed ceilings, tiger oak parquet floors and a footprint perfect for entertaining. 

30 5th Avenue is a 16 story full service building with a 24 hour doorman, resident superintendent, bike room, laundry room and a landscaped roof deck with unparalleled views of Greenwich Village. The building is both pet and pied a terre friendly. 

This an exceptional offering, not to be missed! 

Please call or email to schedule a private viewing."
79,899000.00,"365 W 20th St APT 11E, New York, NY 10011",-74.001734,40.744377,10011,0,1,--,1928,2,1,Chelsea and Clinton,https://www.zillow.com:443/homedetails/365-W-20th-St-APT-11E-New-York-NY-10011/72515212_zpid/,"For sale: $899,000. Rarely available high floor 2 bedroom apartment in Chelsea Court Tower! Apartment 11E has great light and open views to the south and west. Charming pre-war details are found through-out, including hardwood flooring, crown moldings and transoms. 11 windows in all including in the bathroom and efficiently designed kitchen. Spectacular location in a well maintained co-op. Chelsea Court Tower is a boutique, prewar co-op in the heart of Chelsea. There is a part-time doorman, live-in Super, central laundry room, planted roof deck with amazing city and Hudson River views, bicycle room, and storage conveys with the apartment. With the Highline a block away, restaurants too numerous to mention, and easy access to subways and buses, the location can't be better. Subletting is allowed after two years, with board approval. Pets are welcome, and pieds-a-terre, gifting, and co-purchasing are permitted on a case by case basis."
