,price,address,logitude,latitude,zipcode,rent,sale,size,year built,bed,bath,Neighborhood,page_url,description
25,5550000.00,"635 W 42nd St APT 21N, New York, NY 10036",-73.999224,40.761362,10036,0,1,2300,2007,4,4,Chelsea and Clinton,https://www.zillow.com:443/homedetails/635-W-42nd-St-APT-21N-New-York-NY-10036/79974823_zpid/,"For sale: $5,550,000. Our Atelier Sales Office is showing 7 days a week. Call us today for an immediate appointment to see our newest availability. Feel free to walk in Monday- Friday 10am-530pm without an appointment. A We are located just blocks away from the Hudson Rail Yards and the Hi Line Park. The Atelier has become a Manhattan luxury landmark. Many stars call Atelier their home and Atelier will now take you to the stars with 2 seats offered on on a outerspace flight with any units over $10M. All of our units are one of a kind. each has breathtaking unobstructed double exposure city and river views from floor to ceiling windows. The apartments feature stainless steel Bosch (dish washer, W/D, stove and microwave) and Sub Zero ( Fridge) appliances, white oak flooring , granite countertops in kitchen , marble bathrooms , washer/dryer in the unit , walk-in closets with white oak and glass pantries. The building amenities are 24-hour concierge/valet, tennis court, golf driving range , large lap swimming pool , sauna, residents' multi-media lounge and billiards room on the 47th floor, valet services ( laundry and dry cleaning on site) , state-of-the-art fitness center , yoga/pilates studio , fully-landscaped terraces/sundeck , building-wide wireless Internet system , on-site storage available , bike storage , pet friendly , valet parking available , basketball courts, bocci ball , free bicycle Usage , BBQ Grills , free daily breakfast and a cross town shuttle bus. Pictures are of our model unit stock photos. Square Footage is approximate along with common charges/ Taxes, actual amounts may vary. THIS UNIT IS A COMBINATION OF MULTIPLE INDIVIDUAL UNITS THAT CAN BE COMBINED INTO 1."
26,NaN,NaN,-73.999801,40.762001,NaN,NaN,NaN,1070,2007,NaN,NaN,Chelsea and Clinton,https://www.zillow.com:443/homedetails/635-W-42nd-Street-39b-39B-New-York-NY-10036/2129887760_zpid/,NaN
27,3980000.00,"505 W 43rd St # 10H, New York, NY 10036",-73.995498,40.761001,10036,0,1,1900,2017,3,3,Chelsea and Clinton,https://www.zillow.com:443/homedetails/505-W-43rd-St-10H-New-York-NY-10036/2085533318_zpid/,"For sale: $3,980,000. "
28,1680000.00,"460 W 42nd St APT 54L, New York, NY 10036",-73.9953,40.7593,10036,0,1,701,2017,1,1,Chelsea and Clinton,https://www.zillow.com:443/homedetails/460-W-42nd-St-APT-54L-New-York-NY-10036/2117518810_zpid/,"For sale: $1,680,000. Immediate occupancy and 421A Tax Abatement: This glamourous One bedroom has beautiful northern views which include Hudson River, George Washington Bridge, Time Warner Center, Intrepid Museum and cruise ships. A formal Foyer leads to a spacious Living/Dining Room with an open kitchen and plenty of storage. The sleek contemporary Kitchen boasts custom designed white lacquer cabinets, waterfall-edge counter tops and back splash crafted from richly veined white Calacatta marble. Undermount sinks have Dornbracht faucets and premium appliances all by Gaggenau. The Master Bedroom offers plenty of light and views from triple-glazed floor to ceiling windows and a Walk-In Closet. Bathroom features custom Jamie Drake 4-fixture signature faucets and hardware. Additional features include mobile device-controlled smart home systems, and a Bosch washer/dryer."
29,NaN,NaN,-73.999224,40.761362,NaN,NaN,NaN,546,2007,NaN,NaN,Chelsea and Clinton,https://www.zillow.com:443/homedetails/635-W-42nd-St-APT-16J-New-York-NY-10036/80007529_zpid/,NaN
30,875000.00,"635 W 42nd Street 11e # 11E, New York, NY 10036",-73.999801,40.762001,10036,0,1,700,2007,1,1,Chelsea and Clinton,https://www.zillow.com:443/homedetails/635-W-42nd-Street-11e-11E-New-York-NY-10036/2129887779_zpid/,"For sale: $875,000. Our Atelier Sales Office is showing 7 days a week. Call us today for an immediate appointment to see our newest availability. Feel free to walk in Monday- Friday 10am-530pm without an appointment. A We are located just blocks away from the Hudson Rail Yards and the Hi Line Park. The Atelier has become a Manhattan luxury landmark. Many stars call Atelier their home and Atelier will now take you to the stars with 2 seats offered on on a outerspace flight with any units over $10M. All of our units are one of a kind. each has breathtaking unobstructed double exposure city and river views from floor to ceiling windows. The apartments feature stainless steel Bosch (dish washer, W/D, stove and microwave) and Sub Zero ( Fridge) appliances, white oak flooring , granite countertops in kitchen , marble bathrooms , washer/dryer in the unit , walk-in closets with white oak and glass pantries. The building amenities are 24-hour concierge/valet, tennis court, golf driving range , large lap swimming pool , sauna, residents' multi-media lounge and billiards room on the 47th floor, valet services ( laundry and dry cleaning on site) , state-of-the-art fitness center , yoga/pilates studio , fully-landscaped terraces/sundeck , building-wide wireless Internet system , on-site storage available , bike storage , pet friendly , valet parking available , basketball courts, bocci ball , free bicycle Usage , BBQ Grills , free daily breakfast and a cross town shuttle bus. Pictures are of our model unit stock photos. Square Footage is approximate along with common charges/ Taxes, actual amounts may vary."
31,1795000.00,"635 W 42nd St # 22E1, New York, NY 10036",-73.999801,40.762001,10036,0,1,1300,2007,2,2,Chelsea and Clinton,https://www.zillow.com:443/homedetails/635-W-42nd-St-22E1-New-York-NY-10036/2085874272_zpid/,"For sale: $1,795,000. SPECIAL WRAP AROUND TERRACE UNIT. Our Atelier Sales Office is showing 7 days a week. Call us today for an immediate appointment to see our newest availability. Feel free to walk in Monday- Friday 10am-530pm without an appointment. A We are located just blocks away from the Hudson Rail Yards and the Hi Line Park. The Atelier has become a Manhattan luxury landmark. Many stars call Atelier their home and Atelier will now take you to the stars with 2 seats offered on on a outerspace flight with any units over $10M. All of our units are one of a kind. each has breathtaking unobstructed double exposure city and river views from floor to ceiling windows. The apartments feature stainless steel Bosch (dish washer, W/D, stove and microwave) and Sub Zero ( Fridge) appliances, white oak flooring , granite countertops in kitchen , marble bathrooms , washer/dryer in the unit , walk-in closets with white oak and glass pantries. The building amenities are 24-hour concierge/valet, tennis court, golf driving range , large lap swimming pool , sauna, residents' multi-media lounge and billiards room on the 47th floor, valet services ( laundry and dry cleaning on site) , state-of-the-art fitness center , yoga/pilates studio , fully-landscaped terraces/sundeck , building-wide wireless Internet system , on-site storage available , bike storage , pet friendly , valet parking available , basketball courts, bocci ball , free bicycle Usage , BBQ Grills , free daily breakfast and a cross town shuttle bus. Pictures are of our model unit stock photos. Square Footage is approximate along with common charges/ Taxes, actual amounts may vary. Terrace is included in overall Sq feet."
32,NaN,NaN,-73.995498,40.761001,NaN,NaN,NaN,2120,2017,NaN,NaN,Chelsea and Clinton,https://www.zillow.com:443/homedetails/505-W-43rd-St-PHG-New-York-NY-10036/2085533314_zpid/,NaN
33,945000.00,"635 W 42nd Street 15e # 15E, New York, NY 10036",-73.999801,40.762001,10036,0,1,700,2007,1,1,Chelsea and Clinton,https://www.zillow.com:443/homedetails/635-W-42nd-Street-15e-15E-New-York-NY-10036/2129887771_zpid/,"For sale: $945,000. Our Atelier Sales Office is showing 7 days a week. Call us today for an immediate appointment to see our newest availability. Feel free to walk in Monday- Friday 10am-530pm without an appointment. A We are located just blocks away from the Hudson Rail Yards and the Hi Line Park. The Atelier has become a Manhattan luxury landmark. Many stars call Atelier their home and Atelier will now take you to the stars with 2 seats offered on on a outerspace flight with any units over $10M. All of our units are one of a kind. each has breathtaking unobstructed double exposure city and river views from floor to ceiling windows. The apartments feature stainless steel Bosch (dish washer, W/D, stove and microwave) and Sub Zero ( Fridge) appliances, white oak flooring , granite countertops in kitchen , marble bathrooms , washer/dryer in the unit , walk-in closets with white oak and glass pantries. The building amenities are 24-hour concierge/valet, tennis court, golf driving range , large lap swimming pool , sauna, residents' multi-media lounge and billiards room on the 47th floor, valet services ( laundry and dry cleaning on site) , state-of-the-art fitness center , yoga/pilates studio , fully-landscaped terraces/sundeck , building-wide wireless Internet system , on-site storage available , bike storage , pet friendly , valet parking available , basketball courts, bocci ball , free bicycle Usage , BBQ Grills , free daily breakfast and a cross town shuttle bus. Pictures are of our model unit stock photos. Square Footage is approximate along with common charges/ Taxes, actual amounts may vary."
34,1500000.00,"635 W 42nd Street 19a # 19A, New York, NY 10036",-73.999801,40.762001,10036,0,1,800,2007,2,1,Chelsea and Clinton,https://www.zillow.com:443/homedetails/635-W-42nd-Street-19a-19A-New-York-NY-10036/2129887785_zpid/,"For sale: $1,500,000. Our Atelier Sales Office is showing 7 days a week. Call us today for an immediate appointment to see our newest availability. Feel free to walk in Monday- Friday 10am-530pm without an appointment. A We are located just blocks away from the Hudson Rail Yards and the Hi Line Park. The Atelier has become a Manhattan luxury landmark. Many stars call Atelier their home and Atelier will now take you to the stars with 2 seats offered on on a outerspace flight with any units over $10M. All of our units are one of a kind. each has breathtaking unobstructed double exposure city and river views from floor to ceiling windows. The apartments feature stainless steel Bosch (dish washer, W/D, stove and microwave) and Sub Zero ( Fridge) appliances, white oak flooring , granite countertops in kitchen , marble bathrooms , washer/dryer in the unit , walk-in closets with white oak and glass pantries. The building amenities are 24-hour concierge/valet, tennis court, golf driving range , large lap swimming pool , sauna, residents' multi-media lounge and billiards room on the 47th floor, valet services ( laundry and dry cleaning on site) , state-of-the-art fitness center , yoga/pilates studio , fully-landscaped terraces/sundeck , building-wide wireless Internet system , on-site storage available , bike storage , pet friendly , valet parking available , basketball courts, bocci ball , free bicycle Usage , BBQ Grills , free daily breakfast and a cross town shuttle bus. Pictures are of our model unit stock photos. Square Footage is approximate along with common charges/ Taxes, actual amounts may vary."
35,975000.00,"464 W 44th St APT 6C, New York, NY 10036",-73.994354,40.760605,10036,0,1,724,2007,1,1,Chelsea and Clinton,https://www.zillow.com:443/homedetails/464-W-44th-St-APT-6C-New-York-NY-10036/83935688_zpid/,"For sale: $975,000. Welcome to this beautifully finished 1BR in the boutique condominium, Chatham 44. Chatham 44 is located in the prime Hell's Kitchen area with lots of great restaurants, bars and easy transportation access to anywhere in the city, as well as out of the city. Although boutique in building size, it still has all the amenities of a large condo building, yet with more intimacy. The building features 24-hour doorman, gym, bike storage, Fresh Direct cold storage, and an outdoor courtyard and roof. The apartment itself has kitchen, bath and floors finished with the finest of materials and high-end appliances. The apartment also has lots of closet space with California Closet systems, a Bosch washer /dryer, as well as a Balcony that allows you to experience the orange glow of West facing sunsets. In addition, this apt. also comes with one of the largest storage units offered. Come see this heavenly home in Hell's Kitchen."
36,1300000.00,"635 W 42nd Street 38h # 38H, New York, NY 10036",-73.999801,40.762001,10036,0,1,800,2007,2,1,Chelsea and Clinton,https://www.zillow.com:443/homedetails/635-W-42nd-Street-38h-38H-New-York-NY-10036/2129887750_zpid/,"For sale: $1,300,000. Our Atelier Sales Office is showing 7 days a week. Call us today for an immediate appointment to see our newest availability. Feel free to walk in Monday- Friday 10am-530pm without an appointment. A We are located just blocks away from the Hudson Rail Yards and the Hi Line Park. The Atelier has become a Manhattan luxury landmark. Many stars call Atelier their home and Atelier will now take you to the stars with 2 seats offered on on a outerspace flight with any units over $10M. All of our units are one of a kind. each has breathtaking unobstructed double exposure city and river views from floor to ceiling windows. The apartments feature stainless steel Bosch (dish washer, W/D, stove and microwave) and Sub Zero ( Fridge) appliances, white oak flooring , granite countertops in kitchen , marble bathrooms , washer/dryer in the unit , walk-in closets with white oak and glass pantries. The building amenities are 24-hour concierge/valet, tennis court, golf driving range , large lap swimming pool , sauna, residents' multi-media lounge and billiards room on the 47th floor, valet services ( laundry and dry cleaning on site) , state-of-the-art fitness center , yoga/pilates studio , fully-landscaped terraces/sundeck , building-wide wireless Internet system , on-site storage available , bike storage , pet friendly , valet parking available , basketball courts, bocci ball , free bicycle Usage , BBQ Grills , free daily breakfast and a cross town shuttle bus. Pictures are of our model unit stock photos. Square Footage is approximate along with common charges/ Taxes, actual amounts may vary."
37,2299000.00,"350 W 42nd St APT 44G, New York, NY 10036",-73.99227,40.757874,10036,0,1,1349,2007,2,2,Chelsea and Clinton,https://www.zillow.com:443/homedetails/350-W-42nd-St-APT-44G-New-York-NY-10036/80010307_zpid/,"For sale: $2,299,000. Spacious sunny two-bedroom, two-bathroom home with breathtaking views including many landmarks. comfortable, well-planned, and so easy to love, this trophy space has been further improved from its already impeccable original state with custom Brazilian hardwood floors and much, much more. Plentiful in granite composed counter-space and a lengthy pass-thru island, this open, designer kitchen comes fully equipped with a stunning stainless steel Bosch Stove, and Kitchen Aid Refrigerator. The living room is robust in size electronic multi-setting shades . The Master Suite comes equipped and upgraded from its original with a custom ceiling-fan. The en-suite Master Bathroom comes with a double vanity, limestone finish, and a soaking tub. Versatile in usage, the second bedroom is spacious. The second bathroom is fully equipped with limestone, a Mr. Steam steam-room within the shower, as well as an improved rainfall shower head. The unit also boasts floor-to-ceiling windows throughout, multi-zone central heating and air conditioning, impressive closet and storage space, a welcoming foyer, and an LG Washer/Dryer. The Orion condominium offers its residents excellent service and amenities, health club, terrace, fitness facility, spa, whirlpool and lap pool on the 30th floor, club lounge, 24 hour doorman and concierge service, and access to a parking garage below. The Orion is conveniently located on 42nd Street, with proximity to an abundance of restaurants, shops and transportation options; Port Authority, A C E 1 2 3 N Q R Lines, Penn Station, and easy access to the Lincoln Tunnel."
38,1050000.00,"350 W 42nd St APT 25D, New York, NY 10036",-73.99227,40.757874,10036,0,1,729,2007,1,1,Chelsea and Clinton,https://www.zillow.com:443/homedetails/350-W-42nd-St-APT-25D-New-York-NY-10036/80004388_zpid/,"For sale: $1,050,000. Stunning views can be yours from this fantastic unit located on the 25th floor of the Orion, this is one of the best condo buildings on the west side! The open, eat-in kitchen by Valcucine features granite counters, top-of-the-line stainless steel appliances and beautiful oak cabinetry that perfectly complement the dark wood floors. The bath fixtures are by Waterworks featuring Ann Sacks tiles. Building amenities include full-time doormen, private concierge services, gym, pool, spa salon, billiards room, residents' lounge, business center, 3 sun decks and more! This is a great apartment to live in, investor/pet and pied-a-terre friendly."
39,4682000.00,"460 W 42nd St APT 52B, New York, NY 10036",-73.9953,40.7593,10036,0,1,1824,2017,3,3,Chelsea and Clinton,https://www.zillow.com:443/homedetails/460-W-42nd-St-APT-52B-New-York-NY-10036/2105364080_zpid/,"For sale: $4,682,000. Immediate occupancy and 421A Tax Abatement: This spacious 1824 SF corner 3 bedroom 3 bathroom has panoramic Northern and Eastern views overlooking the Hudson River, GW Bridge, Midtown Manhattan all the way to Downtown Manhattan and the Long Island Sound. A formal entry foyer leads into a generous living room with and dining alcove and open gourmet kitchen including a Calacatta marble counter topped island. Great for entertaining. The master and secondary bedroom come with en suite bathrooms and all bedrooms have endless views. 

The interiors and hardware of all residences are custom designed by Jamie Drake and feature: gourmet kitchens with Gaggenau appliances, white lacquer cabinetry and Calacatta marble backsplash & waterfall edge countertops; 5 fixture Calacatta marble master bathrooms, marble and tiled second & third bathrooms and Nero Marquina marble powder rooms. All bathrooms feature Kohler bath tubs and Toto supreme waterclosets. All residences come with wide plank premium brushed oak wood floors & triple glazed floor-to-ceiling windows throughout."
40,1495000.00,"350 W 42nd St APT 55F, New York, NY 10036",-73.99227,40.757874,10036,0,1,768,2007,1,1,Chelsea and Clinton,https://www.zillow.com:443/homedetails/350-W-42nd-St-APT-55F-New-York-NY-10036/79978788_zpid/,"For sale: $1,495,000. - Perched high above the Manhattan skyline, this 768 sf one bedroom one bath condo is a show stopper. 
- Mint condition apartment with 10'' floor to ceiling windows is bright and sun filled with a Southern exposure. 
- Spectacular views of the World towers, Empire state, statue of liberty, Hudson yards, sprawling Manhattan views and the Hudson river- as far as the eye can see.
- Hardwood floors, washer dryer, ample closet space, a fully equipped kitchen make this apartment highly desirable. 
- The Orion is a full-service luxury building with world-class amenities: 24-hour doorman, concierge services (dry cleaning, maid services and cold grocery storage etc.), an 8,200 sq. ft. fitness center with a pool, steam and sauna, multi-floor sun decks, entertaining terrace and lounge, business center, bike storage, and on-site garage. The Orion is centrally located with short distance to multiple public transportation options.
- The Orion is a pet, investment, and pied-a-terre friendly building."
41,1288950.00,"70 W 45th St # 30D, New York, NY 10036",-73.982299,40.756301,10036,0,1,661,2009,1,1,Chelsea and Clinton,https://www.zillow.com:443/homedetails/70-W-45th-St-30D-New-York-NY-10036/2119543963_zpid/,"For sale: $1,288,950. Welcome to Cassa Hotel & Residences, setting a new standard for impeccable Manhattan living that's totally flexible and unfailingly stylish. Considered the most Investor-Friendly building in NYC with low carrying costs and only 30-day rental minimums, you can have it all or pay a la carte for just the perks and services you require. The perfect pied-a-terre!



This luxe one-bedroom on the 30th-floor benefits from South, West exposures flooding the home with sunlight, and iconic city views. The thoughtful interior features an elegant palette of pale wood, limestone, and stainless steel. The designer chef kitchen sports white lacquer cabinetry, stone countertops, and top of the line appliances and the spa-like bathroom boasts travertine, frosted glass and, modern fixtures.



Cassa residents enjoy access to an impressive list of five-star hotel amenities, such as concierge service, housekeeping, room service, a world-class restaurant, business center, fitness room and, storage. And Cassa's sizeable list of a la carte extras makes daily living a joy, including valet, childcare, fresh flower delivery, restaurant and ticket reservations, pet grooming, in-room spa treatments, and so much more.



Conceived by TEN Arquitectos and CetraRuddy, this iconic structure dazzles with distinctive cascading windows decorating its chic white façade. Enter the dramatic lobby to take in Italian lacquer and glass accents, international artwork and a spectacular glass bridge leading to the private garden courtyard with a full bar and dining area. Buzzy celebrity hangout Butter restaurant helmed by renowned Chef Alex Guarnaschelli rounds out this fantastic offering.



Located on 45th Street near Fifth Avenue, you don't get more ""middle of it all"" than this with half a dozen Michelin-starred restaurants within minutes, including Gabriel Kreuther, Aureole, Satsuki and Ai Fiori. Bryant Park, with its year-round schedule of events and attractions, is situated just three blocks south and Rockefeller Center is only four blocks north. Transportation is effortless from this central district with B/D/F/M, 7, N/Q/R/W, S, 1/2/3 and A/C/E trains at your disposal."
42,NaN,NaN,-73.995498,40.761001,NaN,NaN,NaN,970,2017,NaN,NaN,Chelsea and Clinton,https://www.zillow.com:443/homedetails/505-W-43rd-St-7H-New-York-NY-10036/2089603521_zpid/,NaN
43,NaN,NaN,-73.999647,40.761781,NaN,NaN,NaN,1100,2007,NaN,NaN,Chelsea and Clinton,https://www.zillow.com:443/homedetails/635-W-42nd-St-APT-28F-New-York-NY-10036/80006386_zpid/,NaN
44,1150000.00,"635 W 42nd St APT 3H, New York, NY 10036",-73.999224,40.761362,10036,0,1,1000,2007,1,1,Chelsea and Clinton,https://www.zillow.com:443/homedetails/635-W-42nd-St-APT-3H-New-York-NY-10036/80006240_zpid/,"For sale: $1,150,000. THIS UNIT INCLUDES A LARGE 300 SQFT PRIVATE OUTDOOR TERRACE WHICH IS INCLUDED IN THE SQFT OF THE APARTMENT AND IS FACING SOUTH. Unit has a tenant in place and cannot get into in daily. Schedule a specific appoint. The Atelier Sales Office is showing 7 days a week. Call us today for an immediate appointment to see our newest availability. Feel free to walk in Monday- Friday 10am-630pm without an appointment. We are located just blocks away from the Hudson Rail Yards and the Hi Line Park. The Atelier has become a Manhattan luxury landmark. Many celebrities call Atelier their home. All of our units are one of a kind. each has breathtaking unobstructed double exposure city and river views from floor to ceiling windows. The apartments feature stainless steel Bosch (dish washer, W/D, stove and microwave) and Sub Zero ( Fridge) appliances, white oak flooring , granite countertops in kitchen , marble bathrooms , washer/dryer in the unit , walk-in closets with white oak and glass pantries. The building amenities are 24-hour concierge/valet, tennis court, golf driving range , large lap swimming pool , sauna, residents' multi-media lounge and billiards room on the 47th floor, valet services ( laundry and dry cleaning on site) , state-of-the-art fitness center , yoga/pilates studio , fully-landscaped terraces/sundeck , building-wide wireless Internet system , on-site storage available , bike storage , pet friendly , valet parking available , basketball courts, bocci ball , free bicycle Usage , BBQ Grills , free daily breakfast and a cross town shuttle bus. Pictures are of our model unit stock photos."
45,830000.00,"18 W 48th St APT 5C, New York, NY 10036",-73.979315,40.757541,10036,0,1,591,2005,0,1,Chelsea and Clinton,https://www.zillow.com:443/homedetails/18-W-48th-St-APT-5C-New-York-NY-10036/80014260_zpid/,"For sale: $830,000. Perfect Investment at Rockefeller Center! 

Large corner unit in the heart of midtown with southern exposures and excellent storage space.
Apartment features 10 foot ceilings, sleek Italian Kitchen with elegant stainless steel finishes and state-of-the-art appliances, Bosch Axxis Washer/Dryer, Luxurious Marble Bath with Double Vanity, Deep Soaking Tub and Mosaic tiled shower. 

The Centria offers 24 hour doorman, concierge and live in resident manager. Amenities include a large fitness room, state-of-the-art conference rooms, living room with flat screens and fully equipped professional catering kitchen and bar."
46,NaN,NaN,-73.996902,40.7607,NaN,NaN,NaN,1100,1912,NaN,NaN,Chelsea and Clinton,https://www.zillow.com:443/homedetails/529-W-42nd-St-APT-8N-New-York-NY-10036/2086323893_zpid/,NaN
