,price,address,logitude,latitude,zipcode,rent,sale,size,year built,bed,bath,Neighborhood,page_url,description
16,NaN,"252 7th Ave APT 16G, New York, NY 10001",NaN,NaN,10001,NaN,NaN,NaN,NaN,2,2,Chelsea and Clinton,https://www.zillow.com:443/homedetails/252-7th-Ave-APT-16G-New-York-NY-10001/55501650_zpid/,"Zestimate® Home Value: $3,984,226. Loft 16G is part of an exclusive group of lofts at the Chelsea Mercantile that has been completely redesigned and transformed into a modern masterpiece. What has been achieved is perfection on every level in all rooms. The style is modern yet restrained and its refinement is in the details. Here the selection of materials and technology culminates in architectural perfection. This loft certainly benefits from its high floor position and it prewar designation. Ceilings are 11 feet so all rooms feel voluminous. There are eight oversized windows through which sunlight is evenly distributed and through which beautiful northern views can be enjoyed. The use of wide plank floors by LV Woods and custom-built doors that have been raised to ceiling height appear to accentuate the scale of all rooms . Sliding pocket doors were incorporated into the design to maximize usable space in each room. One of the architectural objectives was to substantially increase storage capacity and this was achieved by excavating unused space in the ceilings and walls, and cleverly repositioning existing closets. Storage is consistently abundant.The foyer, with its floating niche, elegantly conceals the open kitchen from the entrance and sets the right tone for the living and dinning spaces. The well planned open kitchen is well appointed and visually stunning. The kitchen cabinets are by the Brazilian house Florense and are double hung to the ceiling. Appliances are top-of-the-line Miele, Wolf and Subzero. There is also a walk-in pantry/ laundry conveniently located next to the kitchen. The luxe guest bathroom is clad in Pietra Piasentina Italian limestone and beautifully presents as an elegant powder room. There is a floating vanity, concealed storage, deep soaking bathtub and fixtures are Toto and Axor.The master bathroom features Haisa Marble and porcelain floors, an automated Toto Neorest toilet, Dornbracht fixtures, oversized shower with sliding glass panels, a custom made vanity with integrated sinks and a linen closet that is substantial.The master suite seamlessly combines practicality without sacrificing beautiful design. The walk-in closet has been reconfigured to include a dressing room and a separate shoe closet. Closet doors are floor-to-ceiling wood panels that create an stunning architectural statement.The second bedroom is large enough for a king sized bed. There are custom built-in book cases and storage units that conceal as well punctuate the architectural narrative"
17,NaN,NaN,-73.996002,40.746498,NaN,NaN,NaN,--,1925,NaN,NaN,Chelsea and Clinton,https://www.zillow.com:443/homedetails/236-W-26th-St-6SE-New-York-NY-10001/2085402263_zpid/,NaN
18,3595000.00,"252 7th Ave # PHJ, New York, NY 10001",-73.995498,40.7453,10001,0,1,1628,1910,2,2,Chelsea and Clinton,https://www.zillow.com:443/homedetails/252-7th-Ave-PHJ-New-York-NY-10001/2087250218_zpid/,"For sale: $3,595,000. Penthouse perfection at the freshly remodeled Chelsea Mercantile.

PHJ is brand new to the market, and one of the most jaw dropping two bedrooms to hit the market in the last several years. Renovated and designed to absolute perfection, this home is not to be missed.

Upon entering the home, the grand scale of the living room is the first thing you will notice. The ceiling height soars to 12 ft, and the entire room is drenched in natural light from the three north facing windows. The room has been upgraded with brand new beautiful hardwood floors, custom lighting features, a working fireplace, and unobstructed views of the Manhattan skyline.

The kitchen was fully remodeled just a year ago. With custom cabinetry, marble counters, miele, wolfe, and subzero appliances, no expense was spared in this thoughtful upgrade. Additionally, the kitchen features a beautiful banquet, wine fridge, and a custom wine and bar cabinet to make entertaining a breeze.

The bedrooms at Chelsea Mercantile are notoriously gigantic, and the rooms in PHJ will not disappoint. The secondary bedroom is larger than most masters, and the king size master suite has custom built-ins, a large walk-in closet, and a 5 fixture master bathroom.

With one of the most incredible lobby renovations freshly complete, the Chelsea Mercantile is one of the most impressive condominiums in Chelsea. It features the conveniences of a full-time doorman, gym, children's playroom, storage, and a beautiful roofdeck with 360 degree views of Manhattan and all of it's iconic buildings.

Call today to schedule your viewing!"
19,1795000.00,"420 W 25th St APT 6D, New York, NY 10001",-74.001715,40.748087,10001,0,1,1339,1912,1,2,Chelsea and Clinton,https://www.zillow.com:443/homedetails/420-W-25th-St-APT-6D-New-York-NY-10001/83937622_zpid/,"For sale: $1,795,000. Located amid the gallery district and The High Line in West Chelsea, this voluminous prewar corner loft has it all: luxurious finishes, soaring ceilings, open city views, fantastic entertaining space, and more. Formerly a printing house, this home offers the quality of a prewar building with the conveniences of a modern full service condominium -- the loft has one bedroom with a separate home office, two full baths, multiple zone climate control, in-unit washer & dyer, generous closets and Nordic Ash hardwood floors throughout.



Upon entry, one is immediately struck by the abundance of light and space with 12-foot ceilings and gorgeous natural light pouring in from the 8-foot windows with North and East exposures. The combination living and dining room is a fabulous entertaining space with open concept chef's kitchen and breakfast bar. The Schiffini kitchen has generous storage and is outfitted with dual Liebherr refrigerators and freezers, true vented Bosch 4 burner gas cooktop, Bosch oven and garbage disposal. An elegant and oversized corner bedroom has two exposures, a Cyclone Home Systems outfitted dressing room, and a luxurious en-suite bathroom with rain shower and multiple sprays, Teknobili fixtures, teak vanity and Porcelanosa ceramic tiles. Just off the entry hall is the second full bath and home office that could just as well serve as a guest room or nursery. Additionally private storage is included with the purchase.



At approximately 1,339 square feet, this condominium loft conversion is a rare find in Chelsea offering volume, light and space with modern finishes in a prewar building.



Loft 25 is an established 24-hour full service luxury condominium with live-in super. Building highlights include gym, private screening room, rear garden courtyard and magnificent common roof deck of approximately 5,000 square feet with gas grills, an outdoor shower and bathroom. This pet friendly condominium is located in the heart of West Chelsea's gallery district and close to The High Line and Hudson River Parks. Convenient to the city's best restaurants and shopping, nearby specialty food stores include Whole Foods, Hudson Market, Gristedes, Foragers Market, Chelsea Market, Trader Joe's, Fairway and Eataly. Nearby transportation: C, E & 1 Subways and 23rd Street Crosstown Bus."
20,NaN,NaN,NaN,NaN,NaN,NaN,NaN,NaN,NaN,NaN,NaN,Chelsea and Clinton,https://www.zillow.com:443/homedetail/AuthRequired.htm?r=pfc&zpid=248832844,NaN
21,NaN,NaN,NaN,NaN,NaN,NaN,NaN,NaN,NaN,NaN,NaN,Chelsea and Clinton,https://www.zillow.com:443/homedetail/AuthRequired.htm?r=pfc&zpid=295023844,NaN
22,25000000.00,"357 W 17th St, New York, NY 10011",-74.003331,40.742829,10011,0,1,11000,1920,5,12,Chelsea and Clinton,https://www.zillow.com:443/homedetails/357-W-17th-St-New-York-NY-10011/143095430_zpid/,"For sale: $25,000,000. A design-centered mansion setting a new standard of luxury and refinement in the West Chelsea Arts District.

An exceptional mansion in one of Manhattan's most exciting neighborhoods, 357 West 17th Street raises the bar for exquisite living in vibrant West Chelsea. Featuring 11,000 square feet of living space flowing unimpeded to 2,000 square feet of outdoor space, the atmosphere is airy, unfettered and incredibly inviting. Here, five luxurious bedroom suites, 11 bathrooms and powder rooms, an immense restaurant-quality kitchen and sumptuous interiors provide a superb backdrop for supremely elegant living.

The muted, luxurious design scheme is infused with Italian brands and aesthetics and punctuated by unexpected details like Swarovski crystals and leather-like accents, while meticulous attention to details and creature comforts abounds.

A stunning showplace made for luxe entertaining, the home boasts an impressive double-height mirror image kitchen with two massive islands, two ovens and two pairs of refrigerator-freezers. In the expansive 26-foot by 23-foot living room, a DaVinci gas fireplace acts as the warm focal point, and glassed-in terrace views surround the mezzanine formal dining area that seats more than a dozen guests in utter comfort. Wine lovers will rejoice in the 400-bottle capacity, temperature-controlled wine cellar and additional wine refrigerators in the home's primary kitchen and two wet bars.

Four remarkable bedroom suites attend to guests and family while the full-floor master suite with twin bathrooms, a powder room, kitchenette, two flex/sitting rooms, endless wardrobes and chic custom cabinetry provides a decadent and serene escape.

For relaxation and rejuvenation, head to the cellar-level outfitted with a swimming pool, combination steam/sauna cabinet and state-of-the-art fitness center. Or perhaps the latest action flick is what you crave. The soundproof home theater with stadium seating, 3D HD projection and THX Dolby surround sound provides a full cinema experience in your own home. And the home's top-notch electronics and technology are customizable to your needs including integrated sound, CCTV and intercom. 

Ample outdoor spaces are found throughout the home, from the small garden to the two oversized rear terraces to the massive roof deck surrounded by iconic New York City views."
23,52500000.00,"11-13 W 10th St # TH, Manhattan, NY 10011",-73.9962,40.733898,10011,0,1,16560,1900,8,9,Chelsea and Clinton,https://www.zillow.com:443/homedetails/11-13-W-10th-St-TH-Manhattan-NY-10011/2086865460_zpid/,"For sale: $52,500,000. 55-Ft. Wide Single-Family Mansion



11 - 13 West 10th Street is a magnificent 55-foot wide renovated single-family mansion, wonderfully located just off Fifth Avenue on the ""Gold Coast"" of Greenwich Village. This exceptional residence affords approximately 16,560 square feet indoors, with soaring ceilings reaching 21 feet high, a commercial-grade elevator which swiftly serves all levels from the cellar to the top floor, and a Crestron smart home system that controls all aspects of the home on a room by room basis.



The home also boasts an additional approximately 5,690 square feet of amazing outdoor space throughout the expansive and well-manicured garden, terrace and sunny roof deck. There are townhouse gardens surrounding the property on all sides and landmarked townhouses across the street, allowing for unusually open light and air.



With stunning light and proportions throughout the magnificent living and entertaining spaces, this grand mansion is a rare opportunity to own a truly unmatched residence on one of the absolute best blocks in Greenwich Village.



HISTORY 



Built in 1847 in Greek Revival style, the westernmost section of 11 - 13 West 10th Street was erected for Richard H. Winslow, a Wall Street financier, renowned for his role as the originator of the railroad bond system. The eastern half of the property remained vacant until 1888, when noted architect Ernest Flagg added an extension to the property. This portion of the home reached completion in 1919 when it was raised to align with the western segment, and joined with a single cornice.



From 1919 until the mid nineties, 11 - 13 West 10th Street was home to the Ladies Christian Union, and operated as a residence hall for young businesswomen. The property became known as the ""Milbank House,"" in recognition of Jeremiah Milbank, an investment banker, manufacturer and railroad investor, who significantly enlarged the home and donated it to the Ladies Christian Union in memory of his mother and wife, both of whom had served as presidents of the charity.



The New York University Law School purchased 11 - 13 West 10th Street from the Ladies Christian Union in 1994. It was used to house the Global Law School Program, which functioned as a base for visiting professors to lecture on campus. The home was later purchased by private owners, who created the magnificent single-family residence present today."
24,2400000.00,"141 W 13th St APT 302, New York, NY 10011",-73.998929,40.737591,10011,0,1,28200,1910,2,2,Chelsea and Clinton,https://www.zillow.com:443/homedetails/141-W-13th-St-APT-302-New-York-NY-10011/244742287_zpid/,"For sale: $2,400,000. AIRY CENTRAL VILLAGE LOFT Bright and uplifting loft in historic former church in the heart of Greenwich Village.  A charming tree-lined street is the home to this newly renovated two-bedroom, two-bath co-op. High ceilings, dramatic wooden beams, 5 skylights and a wood-burning fireplace add character and charm to this peaceful top-floor home. Top-of-the-line finishes include white oak floors, white marble kitchen with Thermador oven and stovetop and Fisher and Paykel refrigerator, and white marble baths.Through-wall air conditioning and ample storage.  Pet-friendly building with bike storage and virtual doorman security."
25,1995000.00,"145 W 13th St APT 103, New York, NY 10011",-73.998901,40.737598,10011,0,1,--,1910,2,3,Chelsea and Clinton,https://www.zillow.com:443/homedetails/145-W-13th-St-APT-103-New-York-NY-10011/2084937226_zpid/,"For sale: $1,995,000. Behind the 1846 facade of this Greek revival church is a truly charming two bedroom two and a half baths home with a large private patio. Warm and inviting, bright and sunny, it feels more like a quintessential Greenwich Village house than an apartment.The soaring ceilings on the first floor, the three sided fireplace and the full length steel casement glass doors leading to the bluestone patio define this very unique home.The spacious open chef's kitchen with its large island and attractive dining area is truly inviting. There is also ample storage and a laundry closet with vented washer dryer.The architectural staircase leads to the second floor with two delightful bedrooms, two full baths and great closet space. 145 West 13th was built in 1846 as Greek Revival Church that managed to maintain the completely original faade when converted to a coop which at present has 11 units. This wonderfully unique building has a virtual doorman, is pet friendly and is located in the middle of one of the best blocks in Greenwich Village. Subways, shopping and some of the New York's best eateries are steps away from the front door. Pied a terres, co purchase and gifting are case by case. This is a very special offering and will not last. There is an assessment for capital improvements of $500 a month through January 2021."
26,NaN,NaN,-73.998808,40.740078,NaN,NaN,NaN,101221,1930,NaN,NaN,Chelsea and Clinton,https://www.zillow.com:443/homedetails/201-W-16th-St-APT-4A-New-York-NY-10011/244704461_zpid/,NaN
27,5995000.00,"177 9th Ave PH C, New York, NY 10011",-74.002863,40.745043,10011,0,1,2365,2008,4,4,Chelsea and Clinton,https://www.zillow.com:443/homedetails/177-9th-Ave-PH-C-New-York-NY-10011/2086429088_zpid/,"For sale: $5,995,000. Sun-bathed breathtaking 2300 SF corner penthouse in the cherished Chelsea Enclave with amazing wrap around planted terrace, 950 SF, and open city views to the east and south.A generous foyer leads to a well-proportioned living room that adjoins an open chef's kitchen on one end and a den that can be the fourth bedroom, on the other.  The beautifully planted terrace with Bamboo and Japanese Maple can be viewed from all floor to ceiling windows and doors.  Also, there is a full bathroom on this floor.Three well proportioned bedrooms and bathrooms are on the second floor with floor to ceiling windows as well.The Chelsea Enclave is a full service doorman residence with a gym, kids' playroom, two stunning landscaped roof decks with grill, and parking garage underneath with direct access into the building and private access to the Seminary's amazing close.  177 Ninth Avenue is a block to the new Highline Park and minutes to the Chelsea art galleries, Chelsea Piers, Chelsea Food Market, Whitney Museum and the much anticipated Hudson Yards.A/C throughout."
28,NaN,NaN,-73.99629,40.735139,NaN,NaN,NaN,8113,1900,NaN,NaN,Chelsea and Clinton,https://www.zillow.com:443/homedetails/42-W-12th-St-New-York-NY-10011/143089057_zpid/,NaN
29,11500000.00,"60 W 9th St, New York, NY 10011",-73.998667,40.733773,10011,0,1,5750,1839,5,9,Chelsea and Clinton,https://www.zillow.com:443/homedetails/60-W-9th-St-New-York-NY-10011/143088932_zpid/,"For sale: $11,500,000. JUST REDUCED 60 West 9th street, Best Townhouse Value in Greenwich Village! This Stunning and rare 25-foot-wide Single-Family fully renovated townhouse with an Elevator offers you an extraordinary sun-flooded home located mid-block in Prime Greenwich Village Gold Coast location between Fifth & Sixth Avenues.
The approximately 5,750 square foot historic home offers fantastic proportions with 1,150 Square feet on each of the 5 floors in addition to a fully finished Cellar.
A spacious new Elevator takes you from the Garden Level to all other floors above or stroll up the comfortable grand staircase.
The Open Eat-in Kitchen with fireside dining and an additional large windowed Butler's pantry offers easy access through French doors into the lush green Zen garden.
A large Blue stone terrace leads to a fully Landscaped Garden completely adorned with beautiful Southern light.
The Splendid Parlor level boasts 12' high ceilings in this immense entertaining room, flooded front to back with natural light. Two Juliet balconies as well as a windowed powder room all overlooking the garden and two wood-burning fireplaces complete the parlor.
Massive full floor Master Bedroom Suite on the third floor offers you every luxury possible with the windowed Study, Spa Bath with deep soaking tub next to the fireplace, double vanity, separate over-sized glass shower and large master closet. 
Soaring 15-foot-ceilings and vaulted skylights will take your breath away as you enter the top floor media room and the fifth bedroom. 
This Land-marked circa 1839 Townhouse, built in the Greek Revival style, has been completely renovated to transform the home into the modern home you've dreamed of, in the heart of the Village, one of Manhattan's finest neighborhoods. Washington Square Park, Jefferson Market Garden, Union Square, best shops and cafes of Greenwich Village are all at your doorstep."
30,9999999.00,"447 W 18th St, New York, NY 10011",-74.005517,40.744515,10011,0,1,3950,2008,5,5,Chelsea and Clinton,https://www.zillow.com:443/homedetails/447-W-18th-St-New-York-NY-10011/97538641_zpid/,"For sale: $9,999,999. The rarest of downtown Penthouse offerings has finally become available with every imaginable checklist requirement in place: an impressively-scaled 3950sqft, this turn-key newly-renovated 5 bed, 5.5 bath duplex is flanked by two large sun-filled terraces to the north and south side of the Great Room. In an architecturally significant West Chelsea condo by award-winning architect Audrey Matlock, this home embodies the trophy aspects of Penthouse living with two living rooms, a den, an outdoor BBQ grill, and 2 master suites, located on separate levels. Entering graciously into the first level from the foyer is a massive Chef's kitchen designed for entertaining, there is walk-in pantry space, a stunning over-sized slab marble countertop, six-burner Viking Range, couble Viking ovens, 2 diswashers and a wine refrigerator. stainless steels and wood-framed Italian cabinetry and vented hood. On this level, there is also a master suite tucked away separately with an en-suite 5-fixture bath and heated floors. The dining and Great Room open onto the larger south-facing terrace, measuring a massive 53 x 17 ft wide. The northern terrace has sweeping city views, an intimate seating area and an outdoor kitchen for added entertainment ease. Upstairs, there are 4 bedrooms including the second Master Suite with exquisite skyline views and en-suite Master bath. The walk-in Master Closet is exceptionally spacious and customized. The 3 secondary bedrooms have south-facing floor-to-ceiling windows, bathing in all-day sunlight. 3 newly renovated full baths have been upgraded with luxurious Toto toilets. There is a media room/library and a fully vented laundry room as well on this level. The entire home is powered by a multi-zone HVAC system, a Crestron system that controls motorized shades, lights and and a sound system throughout. Located on the most prime West Chelsea block, only moments from the Meatpacking District, Highline, the West Village, Chelsea Market and the Avenues School. The $25B Hudson Yards development at the northern end of West Chelsea is poised to be a massive boon to the neighborhood with 5-star dining and shopping only a short stroll away."
31,NaN,NaN,-73.999572,40.740401,NaN,NaN,NaN,--,No Data,NaN,NaN,Chelsea and Clinton,https://www.zillow.com:443/homedetails/231-W-16th-St-APT-5E-New-York-NY-10011/72515422_zpid/,NaN
