,price,address,logitude,latitude,zipcode,rent,sale,size,year built,bed,bath,Neighborhood,page_url,description
0,4000000.00,"635 W 42nd St # 2B, New York, NY 10036",-73.999801,40.762001,10036,0,1,1500,2007,4,4,Chelsea and Clinton,https://www.zillow.com:443/homedetails/635-W-42nd-St-2B-New-York-NY-10036/2099588967_zpid/,"For sale: $4,000,000. The ATELIER SALES OFFICE - Call us at for an immediate appointment. This unit has 1500 sqft of interior space ( with the chance to build a 2nd floor and add 1500 sqft) and 1750 sqft of outdoor private space that has the potential to be enclosed. There is a GUARANTEED tenant with 15 year lease at a current rent of $13,700/month with escalations. Can come with or without tenant. . The Atelier has become a Manhattan luxury landmark. Many celebrities call Atelier their home. All of our units are one of a kind. each has breathtaking unobstructed double exposure city and river views from floor to ceiling windows. The apartments feature stainless steel Bosch (dish washer, W/D, stove and microwave) and Sub Zero ( Fridge) appliances, white oak flooring , granite countertops in kitchen , marble bathrooms , washer/dryer in the unit , walk-in closets with white oak and glass pantries. The building amenities are 24-hour concierge/valet, tennis court, golf driving range , large lap swimming pool , sauna, residents' multi-media lounge and billiards room on the 47th floor, valet services ( laundry and dry cleaning on site) , state-of-the-art fitness center , yoga/pilates studio , fully-landscaped terraces/sundeck , building-wide wireless Internet system , on-site storage available , bike storage , pet friendly , valet parking available , basketball courts, bocci ball , free bicycle Usage , BBQ Grills , free daily breakfast and a cross town shuttle bus."
1,NaN,NaN,-73.98963,40.759931,NaN,NaN,NaN,--,1924,NaN,NaN,Chelsea and Clinton,https://www.zillow.com:443/homedetails/325-W-45th-St-APT-511-New-York-NY-10036/82581108_zpid/,NaN
2,1625000.00,"635 W 42nd St APT 24F, New York, NY 10036",-73.999224,40.761362,10036,0,1,1024,2007,2,2,Chelsea and Clinton,https://www.zillow.com:443/homedetails/635-W-42nd-St-APT-24F-New-York-NY-10036/80012679_zpid/,"For sale: $1,625,000. Rarely available, ""F"" line has just hit the market at the best price per square foot. This unit facing three directions, east, west and south and open city views beam an abundance of natural light into the floor to ceiling windows of the unit. Furthermore, the details to this unit does not lack anything shy of a true luxury property. The high ceilings creates a loft feel, but with all modern touches, including a Bosch Washer Dryer in the unit. The windowed open chef""s kitchen comes with top-of-the line appliances and elegant white cabinetry. Beautiful oak flooring, abundant closet space, and a washer/dryer only add to your quality life style. Perfect for all use; Investor or End User. This is the best deal! The Atelier is an ultra-luxury 45 story modern condo building. Amenities include 24-hours concierge/valet, tennis court, multi-media lounge and billiards room on the 47th floor, state-of-the-art fitness center, fully landscaped terraces/sundeck, building-wide wireless Internet system, bike storage, dog park, basketball courts, BBQ grills and on-site garage access."
3,1550000.00,"350 W 42nd St APT 11L, New York, NY 10036",-73.99227,40.757874,10036,0,1,957,2007,2,2,Chelsea and Clinton,https://www.zillow.com:443/homedetails/350-W-42nd-St-APT-11L-New-York-NY-10036/80014279_zpid/,"For sale: $1,550,000. What a Location!
Midtown West.
A mint condition, rare, corner 2 bedroom, 2 bath on 42nd St., close to Ninth Ave. (8th-9th.) Steps from the Theater District, and Times Square. In the luxurious Orion Condominiums, this unit is on the 11th floor of a beautiful glass curtain building. 
This is the ""L"" line facing Southwest with split bedrooms, floor-to-ceiling windows, and central air and heat. This is an exciting opportunity and the ONLY L line available for sale in the entire building. Light is everywhere. The afternoon sun streams in and the sunsets are glorious. The night views of the iconic skyline and Hudson River are breath-taking.The Kitchen... 
 A luxurious Valcucine design. Counter tops are black-honed granite, lacquer cabinets, stainless steel appliances, and a western facing floor-to-ceiling window. The Baths...
The Master bathroom features a deep soaking tub...... both have Waterworks polished nickel hardware. Countertops and flooring are limestone.Building Amenities...
24 Hour Doorman and Concierge
8000 square foot gym by La PalestraClasses availableTwo-lane lap poolHot TubTwo sundecks There is free breakfast every morning. An on-site garage Two residents' lounges"
4,1195000.00,"505 W 47th Street 6hs # 6HS, New York, NY 10036",-73.993698,40.763401,10036,0,1,825,2008,1,1,Chelsea and Clinton,https://www.zillow.com:443/homedetails/505-W-47th-Street-6hs-6HS-New-York-NY-10036/2128031232_zpid/,"For sale: $1,195,000. Immaculate Junior 4 (convertible 2 bedroom) apt available at The 505 in Hell's Kitchen. As soon as you walk into this extra wide living room  you are immediately captured by the open layout with floor to ceiling windows and an open kitchen with premium appliances and finishes. The spacious  bedroom can fit a king size bed, has a walk-in closet, and overlooks the tranquil and green courtyard. A personal washer/dryer with an additional large closet is located in the foyer. The 505 is a full-service building with a doorman, roof deck with BBQ grill, live-in super, bike room, gym, storage (at cost) and courtyard. Midtown West is quickly becoming one of the best neighborhoods in Manhattan with some of the finest restaurants, bakeries, cafes, and bars/lounges in the city. Close to the Hudson River Park and subway lines A, C, E, N, Q, R, 1, 2, 3, & S. Please note there is a $91 ongoing assessment for the reserve contribution, and the taxes are abated till 2020. Call or Email to view this beautiful apartment."
5,975000.00,"350 W 42nd St APT 7A, New York, NY 10036",-73.99227,40.757874,10036,0,1,741,2007,1,1,Chelsea and Clinton,https://www.zillow.com:443/homedetails/350-W-42nd-St-APT-7A-New-York-NY-10036/80006356_zpid/,"For sale: $975,000. Brand New Exclusive * Prime Midtown Manhattan / Hudson Yards meets the Theater District / Times Square!

This gorgeous Corner 1 Bedroom / 1 Bath home in the Orion Condominium sits at the crossroads of Manhattan's most exciting neighborhoods. Bright and sunny with South and West exposures, the home features walls of floor-to-ceiling windows, extra-high 9 foot (2.75m) ceilings, a windowed Valcucine designer kitchen with granite counters, and a honed limestone bath, complete with a Duravit soaking tub and Ann Sacks tiles. 

Extremely quiet inside, but located at the center of so much to see and do, you'll love being just 1/2 block from hip Ninth Avenues shops and restaurants, only 2 blocks to Times Square (with its more than 60 Broadway and Off-Broadway theatres and 14 Subway lines/Express stops), and so close by to the parks, shopping, and entertainment complexes of Hudson Yards, the High Line, and Hudson River Park, not to mention Central Park and Lincoln Center just a few blocks farther. 

The sleek glass Orion building itself also boasts a large, world-class fitness club with pool, 24-hour doorman/concierge services, and an on-site parking garage with direct access to the building (available for a monthly fee). Pets welcomed."
6,NaN,NaN,NaN,NaN,NaN,NaN,NaN,NaN,NaN,NaN,NaN,Chelsea and Clinton,https://www.zillow.com:443/homedetail/AuthRequired.htm?r=pfc&zpid=294875984,NaN
7,2295000.00,"454 W 46th St APT 6ES, New York, NY 10036",-73.993407,40.761668,10036,0,1,60000,1888,2,2,Chelsea and Clinton,https://www.zillow.com:443/homedetails/454-W-46th-St-APT-6ES-New-York-NY-10036/244741608_zpid/,"For sale: $2,295,000. If you've never been to the historic Piano Factory, you owe it to yourself to come see this enchanting place. Circa 1874, it features some of the most unique lofts in Manhattan. This loft, located on the top floor, is a spacious 2 bedroom plus sleep loft, 2 full bath loft and features ceilings that approach 14 feet. Seven tall windows run its 43 feet of south facing frontage, providing great light and open city views in every room, something rarely found in lofts. 



THE LOFT:

Arguably the most coveted loft in the Piano Factory, the sponsor kept this unit for himself for years after the loft conversion before selling it. It was subsequently designed and renovated by the two principals of Rietveld Architects, who brought it to its current Architectural Digest level.



An entry foyer leads to the living/dining area, nearly 20 feet wide and nearly 36 feet in length. The ceiling rises from 12 1/2 feet in the dining area and to nearly 14 feet at the windowed wall. 



The open and spacious chef's kitchen will impress the most discerning cook. It features: a 48"" Thermador range with a double oven, 4 burners, a charcoal grill and a griddle; a Thermador hood that vents to the outside; an oversized Sub-Zero frig; a Bosche dishwasher; a double sink and ample granite counter prep space that extends into an eating bar that seats 4.



The dining area can easily fit a table to seat up to 12 people. The living area features custom built-in bookshelves and easily accommodates several large pieces of furniture for ample seating, yet still provides ample room for either additional seating or mix & mingle room for large gatherings. 



Off the living area is the hallway leading to the bedrooms. The first bedroom features tall ceilings, plentiful closets and two tall windows. A full marble bath with a shower off the entry foyer serves this first bedroom.



At the end of the hallway is the entrance to the master bedroom suite. This room features ceiling heights that approach 14 feet, two tall windows and a en-suite marble bath. A laundry area with a full-sized washer and dryer and storage is also located outside of the master en-suite bathroom.



This loft also has an attic loft space of nearly 140 SF and height of 3 feet with a pull-down stairway, and an additional 10SF of storage in the sleep loft area.  



THE BUILDING:

Dating back to the late 1800s, The Piano Factory building is a loft-conversion on the site of the former Wessell, Nickel & Gross Company, a piano works and soundboard factory. Today, the building is a well-established, self-managed co-op with very low monthlies, allowing pets, pied-à-terres and subletting. And yes, even pianos! 

At the entry, a Romanesque Revival archway leads you to the building's iconic European style landscaped courtyard, at once leafy yet beautifully industrial. Originally serving as the factory's storage yard, today the brick-lined outdoor spaces are punctuated by striking original steel catwalks and inviting seating areas. The Piano Factory has frequently been used for movie and television filming because of its photogenic beauty.



THE NEIGHBORHOOD:

Located in the heart of vibrant Hell's Kitchen, this home is at the center of quintessential New York living, just 2 blocks from the Theater District and the heart of Midtown. The amazing Hudson Yards and Brookfield Manhattan West developments to the south, and the Time Warner shops and Whole Foods to the north provide premier shopping, dining and entertainment, while the High Line, the Hudson River Greenway and nearby Central Park provide glorious outdoor Park space. The eclectic restaurant scene of 9th Avenue is just around the corner and legendary Restaurant Row is a block away. Transportation is unbeatable with Port Authority and Times Square providing immediate access to A/C/E, 1/2/3, N/Q/R, S and 7 trains."
8,15000000.00,"635 W 42nd St # 2524KA, New York, NY 10036",-73.999801,40.762001,10036,0,1,4000,2007,5,5,Chelsea and Clinton,https://www.zillow.com:443/homedetails/635-W-42nd-St-2524KA-New-York-NY-10036/2099588973_zpid/,"For sale: $15,000,000. Our Atelier Sales Office is showing 7 days a week. Call us today for an immediate appointment to see our newest availability. Feel free to walk in Monday- Friday 10am-530pm without an appointment. A We are located just blocks away from the Hudson Rail Yards and the Hi Line Park. The Atelier has become a Manhattan luxury landmark. Many stars call Atelier their home and Atelier will now take you to the stars with 2 seats offered on on a outerspace flight with any units over $10M. All of our units are one of a kind. each has breathtaking unobstructed double exposure city and river views from floor to ceiling windows. The apartments feature stainless steel Bosch (dish washer, W/D, stove and microwave) and Sub Zero ( Fridge) appliances, white oak flooring , granite countertops in kitchen , marble bathrooms , washer/dryer in the unit , walk-in closets with white oak and glass pantries. The building amenities are 24-hour concierge/valet, tennis court, golf driving range , large lap swimming pool , sauna, residents' multi-media lounge and billiards room on the 47th floor, valet services ( laundry and dry cleaning on site) , state-of-the-art fitness center , yoga/pilates studio , fully-landscaped terraces/sundeck , building-wide wireless Internet system , on-site storage available , bike storage , pet friendly , valet parking available , basketball courts, bocci ball , free bicycle Usage , BBQ Grills , free daily breakfast and a cross town shuttle bus. Pictures are of our model unit stock photos. Square Footage is approximate along with common charges/ Taxes, actual amounts may vary.THIS UNIT IS A COMBINATION OF MULTIPLE INDIVIDUAL UNITS THAT CAN BE COMBINED INTO 1."
9,NaN,NaN,-73.993202,40.761798,NaN,NaN,NaN,1900,1888,NaN,NaN,Chelsea and Clinton,https://www.zillow.com:443/homedetails/454-W-46th-St-6AES-New-York-NY-10036/2085064373_zpid/,NaN
10,NaN,NaN,-73.999801,40.762001,NaN,NaN,NaN,1675,2007,NaN,NaN,Chelsea and Clinton,https://www.zillow.com:443/homedetails/635-W-42nd-St-21AN1-New-York-NY-10036/2088170572_zpid/,NaN
11,3000000.00,"635 W 42nd St # 9AB, New York, NY 10036",-73.999801,40.762001,10036,0,1,1450,2007,3,3,Chelsea and Clinton,https://www.zillow.com:443/homedetails/635-W-42nd-St-9AB-New-York-NY-10036/2092424790_zpid/,"For sale: $3,000,000. Our Atelier Sales Office is showing 7 days a week. Call us today for an immediate appointment to see our newest availability. Feel free to walk in Monday- Friday 10am-530pm without an appointment. A We are located just blocks away from the Hudson Rail Yards and the Hi Line Park. The Atelier has become a Manhattan luxury landmark. Many stars call Atelier their home and Atelier will now take you to the stars with 2 seats offered on on a outerspace flight with any units over $10M. All of our units are one of a kind. each has breathtaking unobstructed double exposure city and river views from floor to ceiling windows. The apartments feature stainless steel Bosch (dish washer, W/D, stove and microwave) and Sub Zero ( Fridge) appliances, white oak flooring , granite countertops in kitchen , marble bathrooms , washer/dryer in the unit , walk-in closets with white oak and glass pantries. The building amenities are 24-hour concierge/valet, tennis court, golf driving range , large lap swimming pool , sauna, residents' multi-media lounge and billiards room on the 47th floor, valet services ( laundry and dry cleaning on site) , state-of-the-art fitness center , yoga/pilates studio , fully-landscaped terraces/sundeck , building-wide wireless Internet system , on-site storage available , bike storage , pet friendly , valet parking available , basketball courts, bocci ball , free bicycle Usage , BBQ Grills , free daily breakfast and a cross town shuttle bus. Pictures are of our model unit stock photos. Square Footage is approximate along with common charges/ Taxes, actual amounts may vary.THIS UNIT IS A COMBINATION OF MULTIPLE INDIVIDUAL UNITS THAT CAN BE COMBINED INTO 1."
12,NaN,NaN,-73.99227,40.757874,NaN,NaN,NaN,1463,2007,NaN,NaN,Chelsea and Clinton,https://www.zillow.com:443/homedetails/350-W-42nd-St-APT-32D-New-York-NY-10036/80004208_zpid/,NaN
13,1325000.00,"350 W 42nd St APT 33H, New York, NY 10036",-73.991299,40.757715,10036,0,1,794,2007,1,1,Chelsea and Clinton,https://www.zillow.com:443/homedetails/350-W-42nd-St-APT-33H-New-York-NY-10036/143115087_zpid/,"For sale: $1,325,000. The best price per square foot in the most desirable one bedroom H-line in the building. This spectacular one bedroom pristine corner unit offers elegant modern living in the center of the city. It boasts sun drenched southern and western light and open breathtaking views of the New York skyline, Freedom Tower, Empire State Building, Hudson Yards and the Hudson River. Bright and airy with floor- to-ceiling windows and 9 foot ceilings, a welcoming foyer leads to an open plan living room and a windowed open Valcucine kitchen with granite countertops, stainless steel appliances and breakfast bar. The spacious bedroom has plenty of room for a California king sized bed. Relax in your bathroom has been designed in a gorgeous earth toned stone finish with a spa-like deep limestone soaking tub and Waterworks fixtures. Nicely proportioned rooms with open views, well-appointed bathroom, perfectly equipped kitchen, gleaming elegant oak hardwood floors, in-unit Bosch washer/dryer and generous closets round out the perfection.

Great for investors or primary residence and pied a terre buyers. 

The world class Orion Condominium provides superb services and amenities to its residents. A 24 hour doorman, concierge services, on-site garage, three stories of free amenities which include a sophisticated 8,200 sf fitness center by La Palestra, lap pool, spa, billiards room, residents lounge, business center, 3 sun decks and more. 

The Orion is conveniently located in Times Square near Lincoln Center, Broadway and movie theaters, restaurants, nightlife, shopping as well as the extensive Hudson River Waterfront Park. Transportation options abound: Port Authority, A C E 1 2 3 N Q R S Lines, Penn Station, and easy access to the Lincoln Tunnel."
14,NaN,NaN,-73.992401,40.762199,NaN,NaN,NaN,1189,1900,NaN,NaN,Chelsea and Clinton,https://www.zillow.com:443/homedetails/446-W-47th-St-APT-1E-New-York-NY-10036/2085937658_zpid/,NaN
15,NaN,NaN,-73.987439,40.759848,NaN,NaN,NaN,999,2007,NaN,NaN,Chelsea and Clinton,https://www.zillow.com:443/homedetails/247-W-46th-St-APT-1502-New-York-NY-10036/97546097_zpid/,NaN
16,970000.00,"635 W 42nd St APT 5N, New York, NY 10036",-73.999647,40.761781,10036,0,1,800,2007,1,1,Chelsea and Clinton,https://www.zillow.com:443/homedetails/635-W-42nd-St-APT-5N-New-York-NY-10036/79976928_zpid/,"For sale: $970,000. DIRECT WATER FACING CORNER UNIT. Our Atelier Sales Office is showing 7 days a week. Call us today for an immediate appointment to see our newest availability. Feel free to walk in Monday- Friday 10am-530pm without an appointment. A We are located just blocks away from the Hudson Rail Yards and the Hi Line Park. The Atelier has become a Manhattan luxury landmark. Many stars call Atelier their home and Atelier will now take you to the stars with 2 seats offered on on a outerspace flight with any units over $10M. All of our units are one of a kind. each has breathtaking unobstructed double exposure city and river views from floor to ceiling windows. The apartments feature stainless steel Bosch (dish washer, W/D, stove and microwave) and Sub Zero ( Fridge) appliances, white oak flooring , granite countertops in kitchen , marble bathrooms , washer/dryer in the unit , walk-in closets with white oak and glass pantries. The building amenities are 24-hour concierge/valet, tennis court, golf driving range , large lap swimming pool , sauna, residents' multi-media lounge and billiards room on the 47th floor, valet services ( laundry and dry cleaning on site) , state-of-the-art fitness center , yoga/pilates studio , fully-landscaped terraces/sundeck , building-wide wireless Internet system , on-site storage available , bike storage , pet friendly , valet parking available , basketball courts, bocci ball , free bicycle Usage , BBQ Grills , free daily breakfast and a cross town shuttle bus. Pictures are of our model unit stock photos. Square Footage is approximate along with common charges/ Taxes, actual amounts may vary."
17,NaN,NaN,-73.99227,40.757874,NaN,NaN,NaN,741,2007,NaN,NaN,Chelsea and Clinton,https://www.zillow.com:443/homedetails/350-W-42nd-St-APT-4A-New-York-NY-10036/80008775_zpid/,NaN
18,1499000.00,"505 W 47th Street 6gs # 6GS, New York, NY 10036",-73.993698,40.763401,10036,0,1,967,2008,2,2,Chelsea and Clinton,https://www.zillow.com:443/homedetails/505-W-47th-Street-6gs-6GS-New-York-NY-10036/2129053148_zpid/,"For sale: $1,499,000. Welcome to this gorgeously designed mint condition two-bedroom two-bathroom home at The 505 Condominium. Floor-to-ceiling windows let in glorious amounts of sunlight and all windows face the tranquil courtyard, offering you the most precious amenity in today's hectic world - peace and quiet. 



The generous open layout of this home, paved in bamboo flooring throughout, is ideal for both living and entertaining. Your modern chef's kitchen is fully stocked with custom Italian cabinetry, marble countertops and top-of-the-line appliances from Miele, Bosch and Fisher Paykel. The king-sized master bedroom is perfectly appointed with a beautiful en-suite bath and spacious walk-in closet, and there is a stackable washer-dryer in unit. This sale also includes a deeded storage space.



The 505 Condominium is a pet-friendly boutique luxury building in the vibrant neighborhood of Hell's Kitchen. Serviced by a full-time staff which includes 24-hour doorman and live-in super, this intimate building includes two fully-landscaped roof decks (with grills and sweeping skyline views), a state-of-the art fitness center, bike storage, and a relaxing landscaped courtyard. You are also surrounded by some of the city's best restaurants, nightlife, parks and transportation. Additionally, the neighborhood is experiencing higher-than-average property growth, which makes this unit both an ideal home and a wise investment."
19,1999900.00,"350 W 42nd St APT 58C, New York, NY 10036",-73.99227,40.757874,10036,0,1,1067,2007,2,2,Chelsea and Clinton,https://www.zillow.com:443/homedetails/350-W-42nd-St-APT-58C-New-York-NY-10036/80003413_zpid/,"For sale: $1,999,900. One of the highest 2 bedroom apartments at 350 West 42nd for less than $2M. Nest above it all with panoramic views of Manhattan from the banks of the Palisades to the George Washington Bridge. Breath taking vistas the length of the Hudson River all the way to the Chrysler Building in this perfectly balanced two bedroom, two bathroom serene city refuge. Gentle northern light, gorgeous sunsets and even a view of the East River - there is no end to what you will see from your floor-to-ceiling windows. Custom kitchens designed by Valcuccine of Italy and baths adorned by Waterworks.

Soaring 60 stories in the heart of Midtown's Theater District, ORION is a magnificent tower sheathed in a glass-curtain wall design by award-winning architects Cetra/Ruddy. Services and amenities abound, including full-time doorman, on-site garage, award-winning concierge services by Abigail Michaels, and an amazing three-story amenity suite including a 8,200 sf fitness center by La Palaestra, lap pool, whirlpool, club and screening room, business center, residents' cafe, multiple sundecks and more! Enjoy the night life at 350 W 42nd."
20,749999.00,"247 W 46th St APT 202, New York, NY 10036",-73.987439,40.759848,10036,0,1,609,2007,0,1,Chelsea and Clinton,https://www.zillow.com:443/homedetails/247-W-46th-St-APT-202-New-York-NY-10036/97520571_zpid/,"For sale: $749,999. This home features 12 feet ceiling, west exposure, white oak floors, walk in closet, top of the line stainless steel appliances, garbage disposal, wine cooler, full size Bosch Washer/Dryer. Full service building with 24hr concierge, doorman and valet parking. Take advantage of Platinum's exclusive 6,000 square feet of resort style amenities, which includes, health club and fitness center, spa and yoga room, virtual golf, wrap-around sun deck, lounge and juice bar."
21,NaN,NaN,-73.9953,40.7593,NaN,NaN,NaN,701,2017,NaN,NaN,Chelsea and Clinton,https://www.zillow.com:443/homedetails/460-W-42nd-St-APT-58L-New-York-NY-10036/2118273534_zpid/,NaN
22,NaN,NaN,-73.999647,40.761781,NaN,NaN,NaN,1050,2007,NaN,NaN,Chelsea and Clinton,https://www.zillow.com:443/homedetails/635-W-42nd-St-APT-41F-New-York-NY-10036/80003263_zpid/,NaN
23,NaN,NaN,-73.99227,40.757874,NaN,NaN,NaN,729,2007,NaN,NaN,Chelsea and Clinton,https://www.zillow.com:443/homedetails/350-W-42nd-St-APT-23D-New-York-NY-10036/80010153_zpid/,NaN
24,885000.00,"500 W 43rd St APT 19H, New York, NY 10036",-73.995516,40.760262,10036,0,1,679,1988,1,1,Chelsea and Clinton,https://www.zillow.com:443/homedetails/500-W-43rd-St-APT-19H-New-York-NY-10036/31516679_zpid/,"For sale: $885,000. Prime midtown,bright  one bedroom with magnificent north facing exposure with river views!

The great room features a balcony and space for living and dining with bamboo floors. Open kitchen with ample storage , three closets can be found in the bedroom , the entry as well as hallway outside the marble bathroom. Residence 19H benefits for laundry on the floor and access to the top floor pool and gym of The Strand. 

Full service luxury building with  concierge and doorman!

Gas water and heat included in common charges of only $775.

$81 Assessment until April 2020  and $66 until January 2028."
