,price,address,logitude,latitude,zipcode,rent,sale,size,year built,bed,bath,Neighborhood,page_url,description
47,1900000.00,"635 W 42nd St APT 41E, New York, NY 10036",-73.999647,40.761781,10036,0,1,1050,2007,2,2,Chelsea and Clinton,https://www.zillow.com:443/homedetails/635-W-42nd-St-APT-41E-New-York-NY-10036/80009864_zpid/,"For sale: $1,900,000. Our Atelier Sales Office is showing 7 days a week. Call us today for an immediate appointment to see our newest availability. Feel free to walk in Monday- Friday 10am-530pm without an appointment. A We are located just blocks away from the Hudson Rail Yards and the Hi Line Park. The Atelier has become a Manhattan luxury landmark. Many stars call Atelier their home and Atelier will now take you to the stars with 2 seats offered on on a outerspace flight with any units over $10M. All of our units are one of a kind. each has breathtaking unobstructed double exposure city and river views from floor to ceiling windows. The apartments feature stainless steel Bosch (dish washer, W/D, stove and microwave) and Sub Zero ( Fridge) appliances, white oak flooring , granite countertops in kitchen , marble bathrooms , washer/dryer in the unit , walk-in closets with white oak and glass pantries. The building amenities are 24-hour concierge/valet, tennis court, golf driving range , large lap swimming pool , sauna, residents' multi-media lounge and billiards room on the 47th floor, valet services ( laundry and dry cleaning on site) , state-of-the-art fitness center , yoga/pilates studio , fully-landscaped terraces/sundeck , building-wide wireless Internet system , on-site storage available , bike storage , pet friendly , valet parking available , basketball courts, bocci ball , free bicycle Usage , BBQ Grills , free daily breakfast and a cross town shuttle bus. Pictures are of our model unit stock photos. Square Footage is approximate along with common charges/ Taxes, actual amounts may vary."
48,3035000.00,"505 W 43rd St # 3B, New York, NY 10036",-73.995498,40.761001,10036,0,1,1542,2017,3,3,Chelsea and Clinton,https://www.zillow.com:443/homedetails/505-W-43rd-St-3B-New-York-NY-10036/2092141989_zpid/,"For sale: $3,035,000. "
49,900000.00,"635 W 42nd St APT 9D, New York, NY 10036",-73.999224,40.761362,10036,0,1,700,2007,1,1,Chelsea and Clinton,https://www.zillow.com:443/homedetails/635-W-42nd-St-APT-9D-New-York-NY-10036/80010182_zpid/,"For sale: $900,000. Our Atelier Sales Office is showing 7 days a week. Call us today for an immediate appointment to see our newest availability. Feel free to walk in Monday- Friday 10am-530pm without an appointment. A We are located just blocks away from the Hudson Rail Yards and the Hi Line Park. The Atelier has become a Manhattan luxury landmark. Many stars call Atelier their home and Atelier will now take you to the stars with 2 seats offered on on a outerspace flight with any units over $10M. All of our units are one of a kind. each has breathtaking unobstructed double exposure city and river views from floor to ceiling windows. The apartments feature stainless steel Bosch (dish washer, W/D, stove and microwave) and Sub Zero ( Fridge) appliances, white oak flooring , granite countertops in kitchen , marble bathrooms , washer/dryer in the unit , walk-in closets with white oak and glass pantries. The building amenities are 24-hour concierge/valet, tennis court, golf driving range , large lap swimming pool , sauna, residents' multi-media lounge and billiards room on the 47th floor, valet services ( laundry and dry cleaning on site) , state-of-the-art fitness center , yoga/pilates studio , fully-landscaped terraces/sundeck , building-wide wireless Internet system , on-site storage available , bike storage , pet friendly , valet parking available , basketball courts, bocci ball , free bicycle Usage , BBQ Grills , free daily breakfast and a cross town shuttle bus. Pictures are of our model unit stock photos. Square Footage is approximate along with common charges/ Taxes, actual amounts may vary."
50,1550000.00,"350 W 42nd St APT 42A, New York, NY 10036",-73.99227,40.757874,10036,0,1,885,2007,1,1,Chelsea and Clinton,https://www.zillow.com:443/homedetails/350-W-42nd-St-APT-42A-New-York-NY-10036/80007547_zpid/,"For sale: $1,550,000. INVESTOR UNIT, TENANT IN PLACE UNTIL SEPTEMBER 2020 WITH ABOVE AVERAGE RENT!!

Spacious, triple-mint 1-bedroom, 1.5-bathroom apartment available in the Orion Condominium, a full-service building that boasts three floors of spectacular amenities. Inside, you'll find hardwood floors throughout, central air conditioning, and oversized floor-to-ceiling windows that offer Southwest exposure and amazing open city and Hudson River views. The California-style kitchen offers best-in-class stainless steel appliances, while the marble-clad bathroom comes complete with a deep-soaking tub. 

The Orion is a coveted Manhattan building that features a full-time doorman, on-site garage, concierge services and access to a fitness center by La Palestra, an 8,000 sf gym that features a two-lane 60-foot lap pool, jacuzzi, sauna, and exercise classes. There are also two outdoor sundecks, two residents' lounges, and a conference room."
51,2889000.00,"505 W 43rd St # 9C, New York, NY 10036",-73.995498,40.761001,10036,0,1,1319,2017,3,2,Chelsea and Clinton,https://www.zillow.com:443/homedetails/505-W-43rd-St-9C-New-York-NY-10036/2085533316_zpid/,"For sale: $2,889,000. "
52,799000.00,"350 W 42nd St APT 24I, New York, NY 10036",-73.99227,40.757874,10036,0,1,520,2007,0,1,Chelsea and Clinton,https://www.zillow.com:443/homedetails/350-W-42nd-St-APT-24I-New-York-NY-10036/80004310_zpid/,"For sale: $799,000. Brand New Exclusive * Midtown Manhattan & Hudson Yards meets the Theater District 

Gorgeous, Oversized (approx. 520 SF) L-Shaped Alcove Studio with Empire State Building Views in the Full-Service Luxury Orion Condominium. Located at the nexus of Manhattan's most exciting neighborhoods, this quiet home features bright Floor-to-Ceiling Windows, extra-high 9 foot (2.75m) ceilings, a windowed Valcucine Designer Kitchen with Stainless Steel appliances and Granite Counters, and a honed Limestone Bath, complete with a Duravit Soaking Tub and Ann Sacks tiles. 

Youll love being just 1/2 block from hip Ninth Avenues shops and restaurants, only 2 blocks to Times Square (with its more than 60 Broadway and Off-Broadway theatres and 14 Subway lines/Express stops), and so close by to the parks, shopping, and entertainment complexes of Hudson Yards, the High Line, and Hudson River Park -- not to mention Central Park and Lincoln Center just a few blocks farther!

The sleek Orion building itself also boasts a large, World-Class Fitness Club with Pool, 24-hour Doorman/Concierge Services, multiple Sun Decks, and an On-Site Parking Garage with direct access to the building (available for monthly fee). 

Also makes a wonderful Weekend Residence (pied-a-terre). Pets welcome."
53,NaN,NaN,-73.9953,40.7593,NaN,NaN,NaN,1198,2017,NaN,NaN,Chelsea and Clinton,https://www.zillow.com:443/homedetails/460-W-42nd-St-APT-55J-New-York-NY-10036/2117041341_zpid/,NaN
54,6500000.00,"635 W 42nd St APT 25K, New York, NY 10036",-73.999647,40.761781,10036,0,1,2000,2007,3,3,Chelsea and Clinton,https://www.zillow.com:443/homedetails/635-W-42nd-St-APT-25K-New-York-NY-10036/80006164_zpid/,"For sale: $6,500,000. Our Atelier Sales Office is showing 7 days a week. Call us today for an immediate appointment to see our newest availability. Feel free to walk in Monday- Friday 10am-530pm without an appointment. A We are located just blocks away from the Hudson Rail Yards and the Hi Line Park. The Atelier has become a Manhattan luxury landmark. Many stars call Atelier their home and Atelier will now take you to the stars with 2 seats offered on on a outerspace flight with any units over $10M. All of our units are one of a kind. each has breathtaking unobstructed double exposure city and river views from floor to ceiling windows. The apartments feature stainless steel Bosch (dish washer, W/D, stove and microwave) and Sub Zero ( Fridge) appliances, white oak flooring , granite countertops in kitchen , marble bathrooms , washer/dryer in the unit , walk-in closets with white oak and glass pantries. The building amenities are 24-hour concierge/valet, tennis court, golf driving range , large lap swimming pool , sauna, residents' multi-media lounge and billiards room on the 47th floor, valet services ( laundry and dry cleaning on site) , state-of-the-art fitness center , yoga/pilates studio , fully-landscaped terraces/sundeck , building-wide wireless Internet system , on-site storage available , bike storage , pet friendly , valet parking available , basketball courts, bocci ball , free bicycle Usage , BBQ Grills , free daily breakfast and a cross town shuttle bus. Pictures are of our model unit stock photos. Square Footage is approximate along with common charges/ Taxes, actual amounts may vary."
55,6500000.00,"635 W 42nd St APT 24K, New York, NY 10036",-73.999224,40.761362,10036,0,1,2000,2007,3,3,Chelsea and Clinton,https://www.zillow.com:443/homedetails/635-W-42nd-St-APT-24K-New-York-NY-10036/80011116_zpid/,"For sale: $6,500,000. Our Atelier Sales Office is showing 7 days a week. Call us today for an immediate appointment to see our newest availability. Feel free to walk in Monday- Friday 10am-530pm without an appointment. A We are located just blocks away from the Hudson Rail Yards and the Hi Line Park. The Atelier has become a Manhattan luxury landmark. Many stars call Atelier their home and Atelier will now take you to the stars with 2 seats offered on on a outerspace flight with any units over $10M. All of our units are one of a kind. each has breathtaking unobstructed double exposure city and river views from floor to ceiling windows. The apartments feature stainless steel Bosch (dish washer, W/D, stove and microwave) and Sub Zero ( Fridge) appliances, white oak flooring , granite countertops in kitchen , marble bathrooms , washer/dryer in the unit , walk-in closets with white oak and glass pantries. The building amenities are 24-hour concierge/valet, tennis court, golf driving range , large lap swimming pool , sauna, residents' multi-media lounge and billiards room on the 47th floor, valet services ( laundry and dry cleaning on site) , state-of-the-art fitness center , yoga/pilates studio , fully-landscaped terraces/sundeck , building-wide wireless Internet system , on-site storage available , bike storage , pet friendly , valet parking available , basketball courts, bocci ball , free bicycle Usage , BBQ Grills , free daily breakfast and a cross town shuttle bus. Pictures are of our model unit stock photos. Square Footage is approximate along with common charges/ Taxes, actual amounts may vary."
56,2299000.00,"350 W 42nd St APT 47D, New York, NY 10036",-73.99227,40.757874,10036,0,1,1207,2007,2,3,Chelsea and Clinton,https://www.zillow.com:443/homedetails/350-W-42nd-St-APT-47D-New-York-NY-10036/80011219_zpid/,"For sale: $2,299,000. Sweeping city views, sun-drenched, two-bedroom, two-bathroom home in the renowned Orion condominium, designed by award-winning architects Cetra/Ruddy. Perched high atop the 47th floor, in the heart of Midtown's Theater District, this split bedroom apartment is flooded with sunlight and panoramic views of the Hudson River, George Washing Bridge, Chrysler and Empire State Buildings. 

The open Valcucine kitchen features a large island, stainless steel appliances and wenge wood cabinetry. The designer bathrooms have limestone, Waterworks fixtures and ample storage space. 

The Orion is a full-service condominium offering residents full-time doorman and concierge services, an on-site garage, bike storage, and a three-story amenity suite featuring a top-tier fitness center, lap pool, whirlpool, sundeck, playroom, screening room, and business center."
57,NaN,NaN,-73.999647,40.761781,NaN,NaN,NaN,700,2007,NaN,NaN,Chelsea and Clinton,https://www.zillow.com:443/homedetails/635-W-42nd-St-APT-10E-New-York-NY-10036/80013408_zpid/,NaN
58,1600000.00,"247 W 46th St APT 2004, New York, NY 10036",-73.987439,40.759848,10036,0,1,954,2007,1,2,Chelsea and Clinton,https://www.zillow.com:443/homedetails/247-W-46th-St-APT-2004-New-York-NY-10036/97532780_zpid/,"For sale: $1,600,000. Welcome to the high floor junior 4, 1 bedroom/convertible 2 bedroom, 2 bath condo in the luxurious, state-of-the-art Platinum Condominium. The home offers sunny, southeast exposures, and floor-to-ceiling windows through which you will enjoy picture perfect city views. The formal entry foyer leads to a large, open chef's kitchen, featuring white quartzite countertops, an oversized refrigerator, and stainless steel appliances. Additional features include a Bosch washer and dryer, and large walk-in closets. The building's amenities are unparalleled, and include a fitness center, a relaxing room for massages, a lounge, yoga studio, golf simulator, outdoor terrace and much more. Note: there is a STORAGE UNIT included in the purchase of the apartment."
59,929000.00,"635 W 42nd St APT 14L, New York, NY 10036",-73.999224,40.761362,10036,0,1,633,2007,1,1,Chelsea and Clinton,https://www.zillow.com:443/homedetails/635-W-42nd-St-APT-14L-New-York-NY-10036/143120821_zpid/,"For sale: $929,000. Opportunity knocks: This spacious, South facing  apartment features an open chef's kitchen, white oak hardwood flooring, ample storage space, and an in-unit washer/dryer. The unit boasts wonderful city views overlooking Manhattan's West Side and Hudson Yards, with partial views of the Hudson River. Light cosmetic TLC is needed, leaving endless possibilities for a new owner.



The Atelier Condominium provides unparalleled resident services including a 24-hour doorman and valet parking, a 24 hour sky lounge with an entertainment center and landscaped tanning deck, tennis and basketball court, a state-of-the-art fitness center, communal office and multimedia center, private storage spaces, bike rentals and storage, building-wide wireless internet, and a cross-town shuttle bus."
60,1980000.00,"635 W 42nd St APT 43F, New York, NY 10036",-73.999224,40.761362,10036,0,1,1100,2007,2,2,Chelsea and Clinton,https://www.zillow.com:443/homedetails/635-W-42nd-St-APT-43F-New-York-NY-10036/80012178_zpid/,"For sale: $1,980,000. Meticulously kept high floor 2-bed 2-bath/ flex 3-bed condominium corner unit for all your live, work and play needs under $2M. And you are in good company surrounded by the most coveted neighborhoods in the city: Hudson Yards and Chelsea to the south; Hudson River Park and Greenway to the west; and Theater District to the east. Sitting atop the 43th floor, this bright spacious home provides an intimate sense of escape against the vibrant surroundings. Triple exposure (east, south and west). Sweeping river and city view. Floor to ceiling wraparound windows let in natural sunlight all day. Timeless materials such as Italian oak flooring and polished marble baths, stainless steel appliances by Borsch and Sub-Zero in the open chef's kitchen create comfort and elegance. Both bedrooms are generously sized with abundant closet space and views of New York City skyline too. The in-unit washer/ dryer adds to your quality living. The well-managed condominium amenities include 24-hour concierge/ valet, sky roof lounge with billiards room, gym, tennis court, children's playroom, movie theater, landscaped terraces/ sundeck, bike storage, dog park, BBQ grills and on-site garage access. Your future home is well served by a morning complimentary shuttle bus, 12 train lines, crosstown buses, Citi Bike with Port Authority Bus Terminal and Penn Station within a short walk. Be it shopping or dining, art galleries or fitness gyms, schools or recreation, not only would you have access to everything but also best in class. Email today for immediate viewing."
61,2950000.00,"460 W 42nd St APT 53B, New York, NY 10036",-73.9953,40.7593,10036,0,1,1199,2017,2,2,Chelsea and Clinton,https://www.zillow.com:443/homedetails/460-W-42nd-St-APT-53B-New-York-NY-10036/2117947072_zpid/,"For sale: $2,950,000. Immediate occupancy and 421A Tax Abatement: Corner Two Bedroom with stunning Northeastern views of Empire State Building and other iconic midtown buildings, and all the way to George Washington Bridge and beyond. Windowed Kitchen boasts custom-designed white lacquer cabinets, waterfall-edge countertops and backsplash crafted from richly veined white Calacatta marble. Undermount sinks have Dornbracht faucets and premium appliances all by Gaggenau. En suite Master Bathroom features 5-fixture custom Jamie Drake signature faucets and hardware. Additional features include mobile device-controlled smart home systems, and a Bosch washer/dryer."
62,785000.00,"350 W 42nd St APT 24H, New York, NY 10036",-73.99227,40.757874,10036,0,1,522,2007,0,1,Chelsea and Clinton,https://www.zillow.com:443/homedetails/350-W-42nd-St-APT-24H-New-York-NY-10036/80008489_zpid/,"For sale: $785,000. Brand New Exclusive * Midtown Manhattan & Hudson Yards meets the Theater District 

Gorgeous, Oversized (approx. 522 SF) L-Shaped Alcove Studio with Empire State Building Views in the Full-Service Luxury Orion Condominium. Located at the nexus of Manhattan's most exciting neighborhoods, this quiet home features bright Floor-to-Ceiling Windows, extra-high 9 foot (2.75m) ceilings, a windowed Valcucine Designer Kitchen with Stainless Steel appliances and Granite Counters, and a honed Limestone Bath, complete with a Duravit Soaking Tub and Ann Sacks tiles. 

Youll love being just 1/2 block from hip Ninth Avenues shops and restaurants, only 2 blocks to Times Square (with its more than 60 Broadway and Off-Broadway theatres and 14 Subway lines/Express stops), and so close by to the parks, shopping, and entertainment complexes of Hudson Yards, the High Line, and Hudson River Park -- not to mention Central Park and Lincoln Center just a few blocks farther!

The sleek Orion building itself also boasts a large, World-Class Fitness Club with Pool, 24-hour Doorman/Concierge Services, multiple Sun Decks, and an On-Site Parking Garage with direct access to the building (available for monthly fee). 

Also makes a wonderful Weekend Residence (pied-a-terre). Pets welcome."
63,3280000.00,"460 W 42nd St APT 52K, New York, NY 10036",-73.9953,40.7593,10036,0,1,1266,2017,2,3,Chelsea and Clinton,https://www.zillow.com:443/homedetails/460-W-42nd-St-APT-52K-New-York-NY-10036/2087221378_zpid/,"For sale: $3,280,000. Immediate occupancy and 421A Tax Abatement: Corner split Two Bedroom Two and a Half Bath with stunning views spanning North beyond the George Washington Bridge, and West to Hudson River, Intrepid Museum, and cruise ships. Windowed Kitchen boasts custom-designed white lacquer cabinets, waterfall-edge countertops and backsplash crafted from richly veined white Calacatta marble. Undermount sinks have Dornbracht faucets and premium appliances all by Gaggenau. Master Bedroom features a Walk-In Closet and en suite 5-fixture custom Bathroom by Jamie Drake. Additional features include mobile device-controlled smart home systems, and a Bosch washer/dryer."
64,1395000.00,"247 W 46th St APT 1602, New York, NY 10036",-73.987439,40.759848,10036,0,1,999,2007,1,2,Chelsea and Clinton,https://www.zillow.com:443/homedetails/247-W-46th-St-APT-1602-New-York-NY-10036/89334338_zpid/,"For sale: $1,395,000. 1602 is a MINT condition condo that blends an array of deluxe finishes with stunning south and west skyline views. This luminous 1-bedroom, 1.5-bathroom condo is an exemplar of contemporary city living. Features include gorgeous hardwood floors, high ceilings, central heating and cooling, huge floor-to- ceiling windows with western exposure, a Bosch washer/dryer, and a best-in- the-building layout that gives the apartment that feeling of being a true home.

 Beyond a tasteful foyer and entry hall adorned with a large coat closet and a powder room, the home flows into an expansive, open-concept living room, dining room, and kitchen. The living and dining rooms possess incredible city views, while the kitchen is equipped with an eat-in peninsula, sleek white countertops, a stone tile backsplash, and a suite of high-end stainless steel appliances from Thermador. The spacious master bedroom boasts a massive walk- in closet as well as spa-like en-suite bathroom with limestone walls and floors, a floating vanity with a vessel sink, a walk-in shower, and a free- standing soaking tub.

 The Platinum is a luxury condominium located in the heart of Midtown. Residents have access to a host of world-class amenities including a 24-hour doorman and concierge, an elegant lobby with a fireplace and water features, a state-of-the-art fitness center, a recovery room with massage chairs, indoor/outdoor yoga studios, a spa lounge, a sauna, a golf simulation room, and a landscaped terrace with commanding views and a built-in fireplace. The building is surrounded by restaurants, cafes, bars, and shops, and is close to the Theater District, Hells Kitchen, and Times Square. Nearby subway lines include the 1/A/C/E/B/D/F/M/N/R/W. Tax abatement through June 2020.
 
 OPEN HOUSE: Sunday 14th Apr 2:45 p.m. till 3:45 p.m."
65,1975000.00,"635 W 42nd St # 44FF, New York, NY 10036",-73.999801,40.762001,10036,0,1,1100,2007,2,2,Chelsea and Clinton,https://www.zillow.com:443/homedetails/635-W-42nd-St-44FF-New-York-NY-10036/2086264391_zpid/,"For sale: $1,975,000. Our Atelier Sales Office is showing 7 days a week. Call us today for an immediate appointment to see our newest availability. Feel free to walk in Monday- Friday 10am-530pm without an appointment. A We are located just blocks away from the Hudson Rail Yards and the Hi Line Park. The Atelier has become a Manhattan luxury landmark. Many stars call Atelier their home and Atelier will now take you to the stars with 2 seats offered on on a outerspace flight with any units over $10M. All of our units are one of a kind. each has breathtaking unobstructed double exposure city and river views from floor to ceiling windows. The apartments feature stainless steel Bosch (dish washer, W/D, stove and microwave) and Sub Zero ( Fridge) appliances, white oak flooring , granite countertops in kitchen , marble bathrooms , washer/dryer in the unit , walk-in closets with white oak and glass pantries. The building amenities are 24-hour concierge/valet, tennis court, golf driving range , large lap swimming pool , sauna, residents' multi-media lounge and billiards room on the 47th floor, valet services ( laundry and dry cleaning on site) , state-of-the-art fitness center , yoga/pilates studio , fully-landscaped terraces/sundeck , building-wide wireless Internet system , on-site storage available , bike storage , pet friendly , valet parking available , basketball courts, bocci ball , free bicycle Usage , BBQ Grills , free daily breakfast and a cross town shuttle bus. Pictures are of our model unit stock photos. Square Footage is approximate along with common charges/ Taxes, actual amounts may vary."
66,2100000.00,"635 W 42nd St # PHF, New York, NY 10036",-73.999801,40.762001,10036,0,1,1050,2007,2,2,Chelsea and Clinton,https://www.zillow.com:443/homedetails/635-W-42nd-St-PHF-New-York-NY-10036/2086564154_zpid/,"For sale: $2,100,000. Our Atelier Sales Office is showing 7 days a week. Call us today for an immediate appointment to see our newest availability. Feel free to walk in Monday- Friday 10am-530pm without an appointment. A We are located just blocks away from the Hudson Rail Yards and the Hi Line Park. The Atelier has become a Manhattan luxury landmark. Many stars call Atelier their home and Atelier will now take you to the stars with 2 seats offered on on a outerspace flight with any units over $10M. All of our units are one of a kind. each has breathtaking unobstructed double exposure city and river views from floor to ceiling windows. The apartments feature stainless steel Bosch (dish washer, W/D, stove and microwave) and Sub Zero ( Fridge) appliances, white oak flooring , granite countertops in kitchen , marble bathrooms , washer/dryer in the unit , walk-in closets with white oak and glass pantries. The building amenities are 24-hour concierge/valet, tennis court, golf driving range , large lap swimming pool , sauna, residents' multi-media lounge and billiards room on the 47th floor, valet services ( laundry and dry cleaning on site) , state-of-the-art fitness center , yoga/pilates studio , fully-landscaped terraces/sundeck , building-wide wireless Internet system , on-site storage available , bike storage , pet friendly , valet parking available , basketball courts, bocci ball , free bicycle Usage , BBQ Grills , free daily breakfast and a cross town shuttle bus. Pictures are of our model unit stock photos. Square Footage is approximate along with common charges/ Taxes, actual amounts may vary."
