,price,address,logitude,latitude,zipcode,rent,sale,size,year built,bed,bath,Neighborhood,page_url,description
147,1995000.00,"930 5th Ave APT 14E, New York, NY 10021",-73.965564,40.773811,10021,0,1,--,1940,2,2,Upper East Side,https://www.zillow.com:443/homedetails/930-5th-Ave-APT-14E-New-York-NY-10021/72527449_zpid/,"For sale: $1,995,000. HUGE PRICE REDUCTION - FOR IMMEDIATE SALE

Apartment 14E is a perfectly proportioned five room -- two bedroom, two bath -- home in one of Fifth Avenue's best buildings at 74th Street. This apartment features a very large open-plan living and dining room, which is perfect for entertaining. The entry hallway has two sizable closets and leads into a large foyer, separating the living room and dining room. Both bedrooms are large with en-suite baths and walk-in closets. There is a windowed kitchen. Sunlight floods through the south-facing windows in the living room and master bedroom, which provide partial views of Central Park. 

You will enjoy the very best white glove service as a resident of 930 Fifth Avenue. The building was designed by famed architect Emory Roth and has full-time doormen and elevator operators, a gym (with fee), central laundry room, and private storage. The building allows pied a terres and international purchasers and the maintenance includes utilities. However, pets are not permitted. Financing allowed is 33.3%. This very special home awaits your updates and personal touches!"
148,720000.00,"212 E 70th St APT 2D, New York, NY 10021",-73.960828,40.767877,10021,0,1,599,1900,1,1,Upper East Side,https://www.zillow.com:443/homedetails/212-E-70th-St-APT-2D-New-York-NY-10021/83932284_zpid/,"For sale: $720,000. Get the warmth of a brownstone and the convenience of modern living.

 This one bedroom residence has seamlessly blended pre-war details with modern finishes . With exposed brick and a vintage decorative fireplace in the living room , this welcoming condominium boasts a tastefully redesigned kitchen with sleek stainless-steel appliances , granite counter-tops and maple cabinetry .The bathroom features Kohler fixtures accented by crisp white subway title and black granite floors .

Through the tall windows, enjoy excellent light as well as south and west exposures . Located in the heart of the Upper East Side the Q subway train offers easy access to other parts of Manhattan.

Apartment Features :

South & West exposure , Decorative fireplace , Full Garden view , Prewar detail , Exposed brick, Floors - hardwood , Good Light , Modern Kitchen , Renovated Bathroom , Dishwasher."
149,995000.00,"422 E 72nd St APT 27B, New York, NY 10021",-73.955025,40.766854,10021,0,1,750,1990,1,1,Upper East Side,https://www.zillow.com:443/homedetails/422-E-72nd-St-APT-27B-New-York-NY-10021/31539121_zpid/,"For sale: $995,000. SUNNY AND SPACIOUS 1-BED/1-BATH WITH SWEEPING RIVER VIEWS IN LUXURIOUS UES OXFORD CONDOMINIUM



Awake to glorious morning sunlight in this 750-square-foot, one-bedroom home. The gracious living room has three oversized thermal pane windows, providing excellent light from an Eastern exposure with unparalleled views of the East River. The open, airy kitchen has granite countertops, brand new stainless steel fridge, stove, dishwasher and microwave, and a pass-through bar with a dining counter. The roomy master bedroom has three large closets and shares the same stunning River views as the living room. The bathroom has floor-to-ceiling marble tile and there is ample closet space and gleaming Herringbone hardwood floors throughout. Equipped with an in-unit washing machine and vented dryer, this apartment is not to be missed! 



The Oxford is an award winning full service, white glove Emery Roth building with world-class amenities, including a stunning lobby that just underwent a complete $1.8M high-end renovation. In addition to the lush English garden and massive 9500 sq. ft. wrap-around sundeck, the condo offers a renovated state-of-the-art fitness center with a large indoor sky-lit swimming pool, full-size outdoor basketball court and a children's playground with a jungle gym and swings. There is also an on-site parking garage, a residents' lounge with catering kitchen and so much more! Rest easy with a 24-hour doorman and concierge, video surveillance throughout and an electronic package tracking and alerts system. Close proximity to public transit including the the new Second Ave. ""Q"" train. Pets are welcome (weight restrictions apply). Indulge yourself in the Oxford's unrivaled luxury and conveniences.



*Some of the rooms in this apartment have been virtually staged. Photos shown are for representation only."
150,9800000.00,"150 E 72nd St APT 9N, New York, NY 10021",-73.962097,40.770099,10021,0,1,3543,1914,4,7,Upper East Side,https://www.zillow.com:443/homedetails/150-E-72nd-St-APT-9N-New-York-NY-10021/2085147569_zpid/,"For sale: $9,800,000. As you enter this Luxury Boutique, White Glove Pre-War Condominium you arrive on your own 9th Floor oasis located at 150 East 72nd Street. Designer decorated, stunning XXX MINT condition 5/6 bedrooms plus a Home Office or Maid's Room / beautiful 6.5 bathrooms. This corner Apartment has great natural light facing West, North, South and East with City Views and Blue Skies. The Apartment also has ceiling heights up to 10 feet throughout and oversized windows. 

You enter onto a Private Entrance Gallery, which leads to an oversized loft-like Living Room and Dining Room that faces west with a wall of four large windows and fantastic light. The unique large Eat-In Kitchen boasts Miele appliances, marble countertops and limestone floors. There are Franke sinks and faucets, custom white lacquered cabinetry, a Butler's Pantry with a wine refrigerator and large windows facing west. Banquette seating for 7 fits comfortably in the Kitchen as well as 3 additional stools that pull up to the large Marble Center Island. 

The Master Bedroom is set up as a suite with a Home Office/Study (or 6th Bedroom), abundant walk-in and custom closets and two luxurious marble Bathrooms. Both have step-in stall showers, one has a Deep Soaking Tub, and Heated Floors.

There are three additional Bedrooms each with En-Suite Marble Bathrooms and ample closets. Two of the three Bedrooms are corner rooms exposing them to wonderful light throughout the day. 

There is also a large Staff Room (Guest Room or Home Office) with laundry and a Full Bath with Shower. A Storage Cage transfers with the sale of this Apartment.

The building was originally built in 1914 and converted to luxury, modern Condominium Apartments in 2014, this building has what buyers are looking for todayPre-war bones with contemporary, top of the line design and light. This Apartment was bought from a Sponsor and used as a Pied-a-Terre.

Amenities include a 24-hour Doorman, Porter, Live-In Resident Manager, Fitness Center, Children's Playroom, Residents Lounge with Catering Kitchen as well as Private Storage and Bike Storage."
151,4950000.00,"23 E 74th St # 8CDEG, New York, NY 10021",-73.964698,40.773498,10021,0,1,--,1929,4,4,Upper East Side,https://www.zillow.com:443/homedetails/23-E-74th-St-8CDEG-New-York-NY-10021/2086541960_zpid/,"For sale: $4,950,000. Located on 74th Street between Fifth and Madison Avenues this elegant home is perfect as either your primary Manhattan residence or Pied-a-Terre. The apartment is meticulously designed and in triple mint condition. The spacious corner living room is blasted with sunlight throughout the day, and the formal dining room off the kitchen is the perfect space to entertain. The apartment also has a media room, 4 bedrooms, and 4 full bathrooms. This home is located in The Volney building which has a 24-hour doorman and shared planted rooftop."
152,23000000.00,"720 Park Ave # 13A, New York, NY 10021",-73.965099,40.770171,10021,0,1,203490,1928,3,4,Upper East Side,https://www.zillow.com:443/homedetails/720-Park-Ave-13A-New-York-NY-10021/244709581_zpid/,"For sale: $23,000,000. Extremely rare and glamourous 12 room apartment perched high atop a most distinguished white-glove prewar cooperative. Impeccably appointed by the renowned design team of Aman Meeks, the residence was extensively featured in the firms recent coffee table tome, The New Formal.


Distinguished by a 95 foot long planted terrace that charmingly meanders along the entire eastern flank of the apartment, the stunning aerie is most fortunate to have four rooms overlooking Park Avenue and to feature pretty, sunny and open views throughout. Boasting divine entertaining spaces that exude elegance and restrained grandeur, this exceptional apartment is a one of a kind, having been built to the exacting specifications of philanthropist, bibliophile, and Macys heir, Jesse Isidor Strauss.


In particular, the fabulous corner Master Bedroom Suite with its massive marble bathroom and huge dressing room is the best of its kind, while the large and pristine Chefs Kitchen, Pantry and Breakfast Room also conveniently allow for gracious and informal dining. Other notable features include a Living Room with the most lovely bay window, a grand Dining Room, a cozy Library and two perfect guest bedrooms with en-suite baths. There are also four wood burning fireplaces, French doors throughout, abundant southern exposures and lots of original moldings. Plus stunning examples of valuable and exceedingly beautiful period boiserie and accompanying marble fireplace surrounds.
Designed by the great Rosario Candela in the golden era of apartment house building, this sophisticated and chic residence, on the corner of ?70th Street? and Park Ave, is truly a trophy property and also simply the most delightful abode. 


Furthermore, having once comprised the upper floor of an extraordinary home, the acquisition of this listing affords a unique opportunity for a buyer looking to reassemble the celebrated Strauss Duplex. As it is now possible to acquire the lower floor as well, and to restore the baronial scale and layout of one of Park Avenues most historically important prewar coop residences."
153,2245000.00,"150 E 69th St APT 8C, New York, NY 10021",-73.962896,40.768027,10021,0,1,914921,1959,2,2,Upper East Side,https://www.zillow.com:443/homedetails/150-E-69th-St-APT-8C-New-York-NY-10021/244762387_zpid/,"For sale: $2,245,000. Spacious 2 Bedroom with City Views



This 2 bedroom, 2 bath southwest corner apartment has lovely city views from all rooms. Upon entering, a large gallery opens to a large south facing living room and adjacent dining room with south and west exposures. The dining room connects to a wonderful enclosed terrace divided only by sliding glass doors. These rooms with double exposures south and west are brilliantly illuminated by natural light throughout the day. A sizable window kitchen has great counter space, plentiful cabinets and storage, a west facing window, and a vented washer dryer. There are two generous bedrooms also with western exposures and light. The master has a large dressing area and walk-in closet and en suite bath. The second full bath is located just outside the second bedroom which also functions as a powder room for guests. The apartment is large with generous scale and comfortable layout. Its open-style floor plan allows for easy, contemporary living. The apartment has great bones but requires a renovation.



Minutes away from the subway, Imperial House is conveniently located on 69th Street spanning the entire south side of the block between Lexington and Third Avenues. Known for its attentive staff, the building offers residents first rate services which include the following amenities: 24-hour doorman and elevator men, a concierge desk, on-site manager's office, Japanese viewing gardens, a newly completed state-of-the-art physical fitness center, garage, storage, and an on premise tailor/dressmaker. Low monthly maintenance makes this a compelling opportunity!"
154,1295000.00,"55 E 76th St # 6, New York, NY 10021",-73.962604,40.774219,10021,0,1,36694,1883,2,1,Upper East Side,https://www.zillow.com:443/homedetails/55-E-76th-St-6-New-York-NY-10021/244785987_zpid/,"For sale: $1,295,000. Come create a masterpiece. Currently configured as a spacious two bedroom, this apartment offers a flexible layout that can easily accommodate a third bedroom and one or two bathrooms. The grand entertaining space includes an over 30' long living room plus a separate dining room. Original details have been maintained throughout the apartment, from the intricate inlaid wood floors to the wood burning fireplace and mantel. The high ceilings and large windows, with all four exposures, give the apartment a light and airy feel. Washer/dryer allowed in the unit and storage available with the unit. Pet friendly and pied-a-terres welcome. 



The Imperial, a landmarked pre-war elevator building, is a well preserved architectural gem that was completed in 1883. There is a doorman on duty daily between 8AM and Midnight. Ideally located next to the Carlyle Hotel, between Madison and Park Avenues."
155,570000.00,"173 E 74th St APT 3C, New York, NY 10021",-73.960016,40.771469,10021,0,1,600,1915,1,1,Upper East Side,https://www.zillow.com:443/homedetails/173-E-74th-St-APT-3C-New-York-NY-10021/119913035_zpid/,"For sale: $570,000. Located in a charming prewar townhouse with elevator and laundry, steps off Lexington Ave in the Mid 70s this Junior 4 features living room and dining alcove, windowed kitchen complete with full size appliances and dishwasher.
W/D is allowed in unit.
There are 10 ft ceilings and the closet space is incredible with plenty of built in bookshelves. Faces north and very quiet.

173 East 74th Street is a prewar elevator cooperative building that was converted in 1979. Central Park and the 6 train subway station are both close by and the building is surrounded by outstanding restaurants, boutiques and grocers. Pied-a-terres are allowed but no pets please. Easy to show by appt."
156,NaN,NaN,-73.966499,40.7719,NaN,NaN,NaN,--,1929,NaN,NaN,Upper East Side,https://www.zillow.com:443/homedetails/4-E-72nd-St-12TH-FLOOR-New-York-NY-10021/2091542950_zpid/,NaN
157,15995000.00,"15 E 69th St # 16B, New York, NY 10021",-73.966839,40.770244,10021,0,1,4167,1926,4,6,Upper East Side,https://www.zillow.com:443/homedetails/15-E-69th-St-16B-New-York-NY-10021/55502497_zpid/,"For sale: $15,995,000. Prewar Perfection

The Westbury Condominium located at 15 East 69th Street has long been considered one of New York City's most sought after residences.

This sprawling turnkey 16th floor aerie encompasses 4,167 square feet and was meticulously renovated with custom finishes throughout. The home currently features 4 oversized sun-drenched bedrooms and 5 and one half bathrooms clad in marble, but can easily be converted back to its original layout of 5 bedrooms. No expense has been spared in this renovation with custom millwork, paneled doors, audio/visual systems, coffered ceilings, and herringbone floors.

The gracious flow of space off of the large gallery and foyer greet you as you step inside the home. The enormous top of the line chefs kitchen with separate dining area, staff bedroom and full bathroom, and laundry room overlook planting gardens towards Madison Avenue, all with unobstructed eastern exposure. 

The formal living room overlooks more planting terraces capturing all of midtown's skyscrapers. The formal dining room spacious enough to accommodate the largest of dinner parties overlooks planting terraces to the East with beautiful landscape design and illumination.

Steps away is your library with rarely seen 360 degree panoramic views of the city and park. This amazing room is flanked by two additional planting terraces with stunning views of midtown's skyscrapers and Central Park. 

The master bedroom suite with Central Park views consists of two large marble bathrooms, two large closets (one can be converted back to a 5th bedroom) with custom cabinetry, and a dressing room with vanity that also overlooks the park.

There are two additional bedrooms with en suite bathrooms. Each bedroom has park and city views! Truly a one of a kind Upper East Side home. 

Storage unit and wine cellar are included with this residence.

This distinguished prewar white glove building with Concierge, fitness center and wine cellar is adjacent to Central Park, the city's finest boutiques and restaurants. Pets and pied-a-terres are welcome."
158,5900000.00,"145 E 76th St # 16, New York, NY 10021",-73.959957,40.773101,10021,0,1,1961,1999,2,3,Upper East Side,https://www.zillow.com:443/homedetails/145-E-76th-St-16-New-York-NY-10021/55502667_zpid/,"For sale: $5,900,000. Developed in 1986 in the spirit of the 1920s, 145 East 76th Streets design of the grand residential addresses on Fifth Avenue, Park Avenue and Central Park West. The 20 residences of 145 East 76th Street are gracious with high ceilings, elegant details and oversized windows. 

410 sq. ft. storage unit included. 

The apartment has entertainment space with a catering kitchen that opens into a formal garden courtyard accessed through a set of French doors. 
Modern in every sense, 145 East 76th Street has 24/7 white glove service, fitness room, childrens room, bike room and is pet friendly.
Convenient to Central Park, transportation, museums and fabulous restaurants in the center of the Upper East Side. 

Rarely available.

The private, one per floor Penthouse oasis presents a flood of natural light through oversized double-paned windows with magnificent city and skyline views from every room. Enhanced by 10 to 12-foot-high ceilings, gracious flow of a floor plan. Affording superb formal entertaining, intimate gathering and casual living. 
Al Fresco dining on an enormous set back wrap around terrace with south/west exposures with dramatic sunset views. 
Direct elevator access into a gracious entryway that incorporates a unique one -of-a-kind artist installation. 
The residence comprises of a large two bedrooms, 12.1 x 23.5 Living Room with formal dining room and 2.5 marble bathrooms. Chefs modern eat-in-kitchen with beautiful views and laundry room. Maintenance-free, custom porcelain walls and floors, sound wiring and a security system. Individually controlled HVAC completes this very special find. 


 View a 3D Virtual Tour of this home at the following link: goo.gl/QV9yUg


You cannot be disappointed viewing this rarely available, one-of-a-kind home for those who love terraces.


There is an assessment of $450.32 per month until 12/31/19."
159,499000.00,"310 E 70th St APT 1C, New York, NY 10021",-73.958821,40.767038,10021,0,1,500,1959,0,1,Upper East Side,https://www.zillow.com:443/homedetails/310-E-70th-St-APT-1C-New-York-NY-10021/72529348_zpid/,"For sale: $499,000. New to the market. Enjoy your very own huge and private back yard, gardening and relaxing in the hammock! Spacious and south facing this studio offers a renovated kitchen with new appliances and a dining island, brand new floors and lots of closets with a separate dressing area.

This luxury cooperative has a brand new elegant lobby, a planted roof top terrace, laundry room, a bike room and garage. Pets are permitted. Sorry pied-a-terre's are not allowed.
Conveniently located next to the ""Q"" train all major transportation ,fine dining and shops."
160,425000.00,"225 E 76th St APT 5-D, New York, NY 10021",-73.957338,40.772,10021,0,1,--,1962,0,1,Upper East Side,https://www.zillow.com:443/homedetails/225-E-76th-St-APT-5-D-New-York-NY-10021/123111991_zpid/,"For sale: $425,000. 225 East 76th St., Apt. 5D

LENOX HILL GLAMOUR: Upper East Side swanky and sunny studio in an elevator building, at an excellent price, in prime Lenox Hill.

THE APARTMENT:
 - South-facing Residence 5D is in move-in condition, freshly painted, renovated bathroom, new closet doors, and glistening hardwood floors.
 - Open kitchen with brand new oven, stainless steel appliances and a breakfast bar to accommodate bar stools.
 - Pin-drop quiet with two windows that bring in an abundance of sunlight and tranquil views of trees.
 - Air conditioning thru-wall.

THE LOCATION:
 - Central Upper East Side location is close to fabulous restaurants and cafes, supermarkets, an Equinox, the Carlyle Hotel and Central Park (76th St. entrance). 
 - Convenient to Lenox Hill Hospital, Weill Cornell Medical Center, and New York-Presbyterian Hospital.
 - Transportation includes the 6 train and the beautifully designed new Second Avenue Subway Q train. 

The CO-OPERATIVE:
 - 225 East 76th Street is a well-maintained cooperative building which offers an elevator, video intercom, live-in Superintendent, renovated lobby and central laundry room. 
 - The Co-op allows up to 80% financing; guarantors allowed; co-purchasing case-by-case; subletting allowed after 2 years for 1 year, and Board reserves the right to approve a renewal for an additional year.

PET POLIICY:
 - Cats are allowed."
161,3995000.00,"114 E 72nd St # 19/20A, New York, NY 10021",-73.963203,40.7705,10021,0,1,2833,1963,3,3,Upper East Side,https://www.zillow.com:443/homedetails/114-E-72nd-St-19-20A-New-York-NY-10021/2086531155_zpid/,"For sale: $3,995,000. Beautiful 3 bedroom 2.5 bathroom apartment located in the heart of the Upper East Side in a boutique Co-Op building. White glove amenities include a full-time doorman, canopied entrance, fitness facility, bike room, roof deck and garden, and storage. Total square footage is 2,833 which includes 682 square feet of outdoor space. Pets and Pied-a-Terre's are allowed."
162,10750000.00,"800 Park Ave # 10, New York, NY 10021",-73.962997,40.7728,10021,0,1,4150,1925,4,6,Upper East Side,https://www.zillow.com:443/homedetails/800-Park-Ave-10-New-York-NY-10021/2091313397_zpid/,"For sale: $10,750,000. This elegant and refined, light-filled, full tenth-floor apartment at 800 Park Avenue offers eleven architecturally beautiful rooms.  The apartment's private landing opens to a sun-filled gallery with a wall of windows facing west over townhouses towards Central Park.  The apartment stretches (110 feet) along Park Avenue with wide entertaining rooms.  A stunning 18-by-27-foot oak-paneled living room with wood-burning fireplace, library with a subtle gilded ceiling and square formal dining room set the tone.  These rooms flow gracefully from one to the other.

 

As configured, this apartment has three corner bedrooms each with oversized tilt & turn windows and large ensuite baths.  Two of the rooms view west, offering glimpses of Central Park. The master bedroom connects to the library by way of a windowed study.  On the far side of the apartment is another larger office complete with a full bath.

 

The west-facing, sun-filled kitchen has a huge window with an open view.  Additionally, there is a large butler's pantry, staff bedroom with a bath, and windowed laundry room.  For more storage, the apartment transfers with a storage room located in the basement. 

 

800 Park is located on the northeast corner of 74th Street and Park Avenue.  The building was erected as a cooperative in 1924.  The building is 14 stories tall with 15 units.  There is a renovated gym, with a bath, on the second floor for tenants' use.  The cooperative has a 24-hour doorman and live-in superintendent. 



The renderings were provided by The Renovated Home, on premise materials available.

 

-110' feet on Park Avenue

-approx. 4,100 square feet

-25 unusually large windows

-2% flip tax to be paid by the purchaser

-no summer work rules

-40% financing permitted

-the cooperative does not have a mortgage

-Local Law 11 repointing of the faade occurred in 2016"
163,1495000.00,"210 E 73rd St # 7C, New York, NY 10021",-73.959346,40.769858,10021,0,1,1250,1929,2,2,Upper East Side,https://www.zillow.com:443/homedetails/210-E-73rd-St-7C-New-York-NY-10021/114346420_zpid/,"For sale: $1,495,000. Welcome to this elegant, sunny, and beautifully renovated two bedroom, two bathroom prewar home located in the coveted Eastgate Cooperatives. One enters into a proper foyer which leads to the grand living/dining room with wood burning fireplace. The windowed chef's kitchen is designed with black Corian counter tops, and Miele, Subzero, and Wolf appliances. Both bedrooms have gorgeous designer marble bathrooms en suite, each with polished nickel Barber Wilson fixtures. Beamed ceilings, recessed lighting, custom mill-work, thru-wall air-conditioning, several closets (two of which are walk-in) and classic prewar moldings, complete this gorgeous first offering. Designed by Emory Roth and built in 1929 by developers Bing & Bing, the Eastgate cooperatives are well known on the Upper East Side for being located on one of the loveliest tree-lined blocks and in one of the most charming neighborhoods. This full-service luxury building offers exceptional 24hr doormen, full-time Super, a beautifully landscaped courtyard garden with gas barbecue grill, a new gym, bike storage, and private storage is available. Electricity is included in the maintenance, the apartment is wired for FIOS, and pets are permitted as are pied a terres and washer/dryers (with engineer and Board approval). At night, the lights along 73rd Street create a romantic and tranquil air, and its proximity to the best restaurants, shopping, as well as being one block from the Q train, make this street one of the best places to call home."
