,price,address,logitude,latitude,zipcode,rent,sale,size,year built,bed,bath,Neighborhood,page_url,description
69,5895000.00,"433 E 74th St # 4THFLOOR, New York, NY 10021",-73.953551,40.768723,10021,0,1,--,2008,5,6,Upper East Side,https://www.zillow.com:443/homedetails/433-E-74th-St-4THFLOOR-New-York-NY-10021/2086065939_zpid/,"For sale: $5,895,000. Welcome to the ""LUX 74"". This all glass boutique ""lifestyle"" condominium building faces south- saturated with natural light. Located on East 74th Street between First Avenue & York Avenue on a tranquil tree-lined block. This full-service, white glove post war building was built in 2007 and designed by ADG Architects & Design PC. It's the only building of its kind on the Upper East Side and remains a ""unicorn"" in Manhattan. Consider this extraordinary property Downtown living but Uptown!   The ""Lux 74"" is a remarkable property featuring first class amenities, cutting edge design, privacy and intimacy. Some features include additional storage in the basement, gym, landscaped furnished roof-deck, an outdoor kitchen with BBQ grill, full-time concierge, and doorman.  Indulge in this 3,212 sq ft full-floor 5-bedroom, 5.5-bathroom residence located on the fourth floor. With a thoughtful modern layout, polished finishes, and massive ceiling heights spanning throughout the subject property at approximately 9 feet 2 inches.   Upon entering the front door, from a large entryway foyer with custom cabinetry and an immense amount of storage space, you're surrounded by a trio of closets! The home flows into a cavernous, open-concept living room with remote operated gasfireplace, dining room, and kitchen. You're greeted by custom finished hardwood floors and a wall of floor-to-ceiling windows along the entire southern wall boasting vast sun-light and view with colorful and charming buildings.  Rooms were designed by Penny Drue Baird, named to the Architectural Digest's List of the Top 100 Architects and Designers world-wide for the past 20 years, and is an internationally renowned interior designer, celebrated for her top tier interior design and architectural detailing. This spectacular home has significant upgrades and features worth mentioning. The Apple Homekit enabled Lutron QS system with Lutron Connect allows you to automate and customize lighting and shades throughout while Homekit enabled Ecobee thermostats control temperature and humidity customized humidifiers for the drier colder months. All windows are appointed with solar shades and or black out shades and the home features all LED custom lighting. As you gaze at the ceiling you'll find yourself observing high fidelity speakers in every room powered by custom amplification and controlled by SONOS. The Living room alone features a Dolby Atmos 9.1 Theater Surround system offering pristine 3D sound and a Sony 65"" 4k Tv for visual effects built into custom Cabinetry.  The home comes with a custom installed Ruckus Wi-Fi system, is prewired and centrally racked in the A/V closet.  If you enjoy entertaining the kitchen is the heart of this phenomenal home. The kitchen is equipped with an eat-in island with marvelous onyx counter-tops and a mosaic backsplash; two ""deep sinks"" and one disposal; a four burner ""Viking"" stove; two ""Miele"" dishwashers; two ""Thermador"" ovens; a ""Viking"" microwave; a ""Sub Zero"" refrigerator; and plenty of storage throughout. Not to mention you have a fully customized double layer pantry suitable for all your needs!    The master suite occupies the entire northern wing of the home. It has access to the property's private 20 foot balcony and boasts an astonishing four closets. Additionally in the master suite there is beautifully custom appointed walk-in closet with full en-suite bath. Exhibit your finest collections of bags, accessories, and shoes. This sensational dressing-room is a fantasy for any Manhattanite. Separately, the master bath is the perfect sanctuary and hideaway with spa-like and luxurious features including dual-sinks, top of the line hardware, jacuzzi tub and an additional makeup area and desk. Appreciate and experience the glass enclosed shower that is roomy and spacious in this windowed master bath!    The laundry room is one of the greatest features of this stellar home. Outfitted with three ""Whirlpool"" machines, over-sized deep sink, an additional ""Fisher & Paykel"" fridge, automatic shades to open up to your glorious northern view with exceptional ventilation, and plenty of counter space for your convenience! It's truly amazing! One of the grandest rooms in the house is the children playroom which highlights a Keith Haring mural! This outstanding space is also well-appointed with an en-suite bath and walk-in closet. This space can easily make for another master bedroom!   The owners also spared no expense when it comes to safety. Relax knowing the home features a state of the art security alarm system with battery back-up and communication redundancies. It benefits from many life safety features such as carbon monoxide sensors, fire sensors, gas sensors, automatic HVAC wet switches, motion and entry sensors on all doors and windows.  The ""LUX 74"" is accessible for all your desires and day-to-day business. If you enjoy outdoor living Carl Schurz Park, John Jay Park and Central park are all close by. If you relish in eating healthy ""Matter of Health"", ""Agata & Valentina"" and ""Fairway"" are all in the neighborhood. If you take going to the gym seriously, New York Sports, Crunch, Equinox, Soul Cycle and Rumble are within minutes of your home. If you enjoy getting Downtown quickly you are 2 blocks from, the new ""Q"" train. The location of this home offers incredible possibilities! Nightlife, shopping, cafes are all within walking distance. Welcome home!  There is additional storage for sale in the building."
70,12250000.00,"132 E 70th St, New York, NY 10021",-73.9635,40.7691,10021,0,1,7103,1910,6,5,Upper East Side,https://www.zillow.com:443/homedetails/132-E-70th-St-New-York-NY-10021/2098670603_zpid/,"For sale: $12,250,000. This five-story Neo-Georgian home was built in 1914 by architect Herbert M. Baer for Julius Goldman, a prominent corporation lawyer and son of Marcus Goldman, founder of Goldman Sachs. Born in Philadelphia, Julius was educated at Heidelberg and Columbia Universities and one of the founders of the the Federation for the Support of Philanthropic Societies.

The brick facade is set above a rusticated stone ground floor with a broad round-arched central entry, a bracket acting as a keystone, and a supporting balcony in front of the second story windows. Plaques with garlands are set above the side fenestration of the ground floor. There are large round-headed windows with stone sills and keystones on the third and fourth floors as well as cornice on blocks with handsome carved moldings, and a set back fifth story mansard roof.

Set in one of Manhattan's most desirable townhouse blocks, the lot spans 20 ft. x 100 ft. Comprising approximately 7,100 sq. ft., the building is built almost full except for the courtyard/garden area located in the southwestern portion of the lot. 10,000 sq. ft. of buildable square footage is available, subject to what is allowable in a Landmark District.

The first two floors are commercially zoned, offering a rare opportunity to create an art gallery, office or corporate headquarters with residence/residential units above. Alternatively, all can simply be reconfigured back to a splendid single-family home. 

The double-gated front vestibule of the ground floor allows for additional security. Its entry gallery is currently used as a reception area that can easily be transformed to a charming foyer of a home. Next are rooms that are currently being utilized as a conference room and a huge rear office with access to the garden/courtyard. 

The second floor consists of a front living room with arched windows, a wood burning fireplace with a beautiful marble mantle, and detailed moldings. The cavernous rear room can easily be a formal dining room with butler's pantry. Still, ceilings measuring nearly 12 feet could also work splendidly for those requiring commercial gallery space. 

The spacious third floor rear room enjoys a balcony, while the front office features coffered ceilings and a wood burning fireplace with original mantle. The extension in the fourth floor rear provides a fascinatingly different perspective to the west through to its bay window. On the Fifth Floor, a large terrace is located off the wood-paneled library. 

The cellar--housing multiple storage rooms, mechanicals and a kitchenette--is built full and enjoys rare 8'3"" ceilings. It also has a window and has direct access to the courtyard/garden. 

The elevator services all floors except the cellar.

(For those who may be interested in financing a portion of their purchase, there is a $6.5 million mortgage that can be assigned at 4.25% interest until 2026.)"
71,850000.00,"245 E 72nd St APT 20E, New York, NY 10021",-73.958739,40.769273,10021,0,1,--,1930,1,1,Upper East Side,https://www.zillow.com:443/homedetails/245-E-72nd-St-APT-20E-New-York-NY-10021/72528700_zpid/,"For sale: $850,000. SPRING IS FOR TERRACES!  Jewel of an apartment on the 20th floor of a lovely full service prewar building. Open views and great light in every room, and French doors opening onto a planting terrace with dramatic views of the city. Original details throughout. Outfitted with stainless appliances, the windowed kitchen has expansive views and direct exposure to the terrace. A private hall leads to the bedroom with open city views and custom built-ins. 



This prewar cooperative is pet friendly and includes an exercise facility, bike room (wait list), storage (wait list), patio garden, and laundry. Extremely convenient location less than a block from great shopping, a wide array of restaurants, the 72nd Street crosstown bus, the Second and Third Avenue buses, and - best of all - the new Q train."
72,1300000.00,"111 E 75th St # 3CD, New York, NY 10021",-73.961402,40.772899,10021,0,1,--,1925,3,3,Upper East Side,https://www.zillow.com:443/homedetails/111-E-75th-St-3CD-New-York-NY-10021/2086491587_zpid/,"For sale: $1,300,000. Bring your architect for the perfect opportunity to combine units 3C and 3D into a true 3-bedroom in this beautiful prewar coop.

Retreat to your fabulous and ultra-private residence just off Park Ave! This pre-war beauty is located in one of the Upper East Side's most coveted addresses, conveniently positioned next to the Central Park as well as an indoor parking garage and the boutiques of Lexington Avenue. This home features wood floors, custom closets, 2 wood burning fireplaces and new updated windows. The windowed kitchen has a dishwasher and a breakfast bar; and washers/dryers are allowed in the apartment. 

 The building features: Live-in super, Laundry and storage. D'Agostino's and Citarella's markets nearby as well as all the fabulous cafes, restaurants and shopping. 77th Street Lexington Subway, Express and Local buses all right here. 

This coop allows 50% financing, pied-a-terres and subletting for 2 years out of every 4. There is currently a capital assessment of $294.30 expiring. The assessment is not included in the maintenance advertised."
73,1415000.00,"215 E 73rd St # 7A, New York, NY 10021",-73.958986,40.770208,10021,0,1,74726,1930,3,3,Upper East Side,https://www.zillow.com:443/homedetails/215-E-73rd-St-7A-New-York-NY-10021/244733393_zpid/,"For sale: $1,415,000. 7A

215 East 73rd.



An Emory Roth Classic this elegant  residence with 3 bedrooms, 3 baths,3 exposures, and one wood burning fireplace provides so many possibilities for you and your architect to explore.  This is the first time 7A has ever been offered for sale, this sponsor sale needs no board approval, it is being sold in as is condition.  The gracious entrance leads to a lovely sized south facing living room, the master suite also has southern sun shine.  The kitchen and all the baths have windows. Please make an appointment to see this space and let your imagination roam.



This well-appointed full service building, has a garden, gym and oversized laundry room. Around the corner from the new Q train, aka the Second Avenue Subway.



Open House By Appointment Only"
74,429000.00,"520 E 72nd St APT 14E, New York, NY 10021",-73.952827,40.765977,10021,0,1,491,1964,0,1,Upper East Side,https://www.zillow.com:443/homedetails/520-E-72nd-St-APT-14E-New-York-NY-10021/72530333_zpid/,"For sale: $429,000. Sunny Sizeable Studio with LOW Maintenance



Be the first to see this modern, mint condition, South-facing studio with high-ceilings.  Featuring a sleek, custom and moveable L-shaped cabinet separating the living and sleeping areas, refinished hardwood floors, a separate kitchen with plenty of counter space and storage, and a pass-through to the dining area, a beautiful, freshly updated sparkling white bathroom, new lighting, new doors, two large custom closets, plus a dressing area with shelving to store it all. Open exposures and pin-drop quiet, too.

  

Nestled on a quiet, tree-lined cul-de-sac overlooking the East River and with easy access to two pocket parks and the East River Promenade, 520 East 72nd Street is a Full-service upper east side co-op offering top-of-the-line amenities including 24-hour doorman/concierge, a live-in resident manager, a garage, laundry facility, a bike room, building link, a library and a Zen-garden. New Lobby and Hallway carpeting. Non-smoking building. Co-purchasers, guarantors, pied-a-terres, gifting and subletting (after two years, for two years out of ten) are all allowed. Pets welcome! 242 Units. Built in 1963. Co-op permits financing of up to 70%. Convenient to the Second Avenue Subway, two bus routes on the corner (72nd Street Cross-town and the M31 to 57th Street and the Westside), shopping and recreational facilities. Citi Bikes on corner."
75,779000.00,"305 E 72nd St APT 4CS, New York, NY 10021",-73.957801,40.769001,10021,0,1,826,1957,1,1,Upper East Side,https://www.zillow.com:443/homedetails/305-E-72nd-St-APT-4CS-New-York-NY-10021/2089034594_zpid/,"For sale: $779,000. This sunny and spacious renovated one bedroom overlooking tree-lined and double-wide East 72nd Street is amongst one of the largest one bedroom units offered at Charing Cross House, an impeccable full service doorman building located in the prime and desirable Lenox Hill neighborhood of the Upper East Side.



The spacious layout of this turn-key apartment flows nicely and features a large dining area at the entry, which leads to a very generously sized living area with an oversized southern exposure window. The walls and ceilings in the living/dining area have all been freshly skim-coated and feature refurbished crown and baseboard moldings throughout, a new custom radiator/air-conditioning cover for the through-the-wall air conditioner and refinished hardwood floors. 



The double-sided, windowed galley kitchen off the dining area is one of the largest kitchens available in the building and has been renovated with new granite countertops and subway tile backsplashes, an under-counter mounted stainless sink, recessed under-counter lighting, updated cabinetry and stainless Energy Star appliances. 



The oversized bedroom, which can easily accommodate a king-sized bed, features generously sized closets and an over-sized southern exposure window. The ceilings and walls in the bedroom have also been freshly skim-coated, and outfitted with new baseboard moldings, a new custom radiator/air-conditioning cover for the through-the-wall air conditioner and refinished hardwood floors. The bathroom has been freshly updated as well. 



Charing Cross House is a full-service luxury co-op building offering 24-hour doorman service, a stately marble lobby, state-of-the-art 24-hour fitness center, on-site laundry room, bike and storage rooms, and a live-in super. The new state-of-the-art, eco-conscious roof deck garden is outfitted with vertical green walls and multiple seating areas creating a lush oasis for residents. The roof also provides solar panels and a rainwater retention system. The building permits pets and pied-a-terres. Ideally located on East 72nd Street, one of the premier double-wide residential blocks in the city, a number of world-class boutiques, restaurants, nightlife and cultural destinations sit within easy reach. Enjoy nearby Grace's Marketplace and Citarella for high-quality food shopping, or head to the East River promenade or Central Park for superb sight-seeing and recreation. The new Second Avenue express subway stops right across the street, providing quick and easy access to all points in Manhattan. The M72 crosstown bus stop is just across the street as well. The 6 train on Lexington Avenue is also easily accessible. Low monthlies. Minimum of 25% cash down; max of 75% financing."
76,NaN,NaN,-73.967073,40.77181,NaN,NaN,NaN,170106,1960,NaN,NaN,Upper East Side,https://www.zillow.com:443/homedetails/900-5th-Ave-APT-2B-New-York-NY-10021/244703880_zpid/,NaN
77,1450000.00,"190 E 72nd St APT 10A, New York, NY 10021",-73.961047,40.76978,10021,0,1,1600,1962,3,3,Upper East Side,https://www.zillow.com:443/homedetails/190-E-72nd-St-APT-10A-New-York-NY-10021/72528073_zpid/,"For sale: $1,450,000. Prime Upper East Side corner three bedroom three full bath apartment with North West exposures. Located on the tenth floor with great natural light, high ceilings, and city views. This apartment has been recently renovated offering brand new finishes throughout. Each room is filled with custom millwork including built in bookshelves, closets, and oak wood floors. Spacious windowed kitchen with an inviting open layout to entertain. Endless amount of Carrera marble counter tops with high end stainless steel appliances from Betolucci, Bosch, and GE. Tower East is a premier white glove full service building conveniently located between Lexington Avenue and Third Avenue. The building offers a state of the art health club, garage access directly from the building, bike room, storage space, and a children's playroom. 50% financing permitted, pieds-a-terre, parents buying with children, gifting are permitted, and amenable to foreign purchasers. Please note there is an assessment of $355 per month."
78,695000.00,"157 E 72nd St APT 1J, New York, NY 10021",-73.961097,40.770198,10021,0,1,--,1924,1,1,Upper East Side,https://www.zillow.com:443/homedetails/157-E-72nd-St-APT-1J-New-York-NY-10021/2084991233_zpid/,"For sale: $695,000. Welcome to this beautiful and spacious one bedroom condominium. This lovely renovated home has high beamed ceilings, hardwood floors and is move in ready! The kitchen has been opened and has a comfortable counter for seating, custom wood cabinetry and stainless steel appliances. The bedroom has an ensuite renovated bathroom. There is plenty of storage and closet space. Perfectly located on 72nd Street between Third Avenue and Lexington Avenue, one of the most desired blocks in Lenox Hill!La Bourgogne is a luxury condominium with 24 hour doormen, resident super and is pet and pied a terre friendly. The building has a wonderful landscaped roofdeck with panoramic views, a bike room and a newly renovated laundry room. Perfectly located in a highly sought after neighborhood, just a short stroll to Central Park, fine and casual dining options, fine galleries and convenient transportation. Call for a private showing."
79,NaN,NaN,-73.964797,40.7718,NaN,NaN,NaN,5258,1920,NaN,NaN,Upper East Side,https://www.zillow.com:443/homedetails/39-E-72nd-St-MAIS-New-York-NY-10021/2087052050_zpid/,NaN
80,750000.00,"399 E 72nd St APT 3D, New York, NY 10021",-73.955427,40.76772,10021,0,1,750,1961,1,1,Upper East Side,https://www.zillow.com:443/homedetails/399-E-72nd-St-APT-3D-New-York-NY-10021/72655172_zpid/,"For sale: $750,000. Let the sun shine into this bright XL 1 bedroom home with a LOW MONTHLY MAINTENANCE at the Eastview House. Located just one short block from the Q train, this South and East-facing home offers an efficient layout with no wasted space. The 21'7 Living Room/Dining Area is great for entertaining and the generously-proportioned bedroom features custom built-ins that allow for extra storage. Altogether, this home has 5 closets. The Eastview House is a well-run full service cooperative with a Full Time Doorman, Laundry Room, and a recently renovated lobby. Enjoy the best that the Upper East Side has to offer including parks, restaurants, groceries, and cafes. Sorry, no dogs."
81,428000.00,"1420 York Ave APT 5K, New York, NY 10021",-73.951759,40.769026,10021,0,1,439,1956,0,1,Upper East Side,https://www.zillow.com:443/homedetails/1420-York-Ave-APT-5K-New-York-NY-10021/31539788_zpid/,"For sale: $428,000. This is a good size studio apartment in quiet and beautiful area, Located at 75th st and York Ave. Close to Q,R Train .Sunny and Bright Eastern exposure . Amenities include :Laundry room ,wonderful roof deck, on- site parking ."
82,2990000.00,"57 E 73rd St, New York, NY 10021",-73.9657,40.7729,10021,0,1,1350,1926,2,2,Upper East Side,https://www.zillow.com:443/homedetails/57-E-73rd-St-New-York-NY-10021/2116004546_zpid/,"For sale: $2,990,000. BACK ON THE MARKET! DEAL FELL THROUGH.BRING OFFERS!

This Elegant and well maintained 6 story Condominium has a most unique Penthouse.

The elevator will take you all the way up to your private landing on the fifth floor.

The fifth floor has 2 split bedrooms with 2 full bathrooms, a terrace and a Wood Burning Fireplace in the master Bedroom. (2nd WBF is possible off the 5fl living area)

There is an interior stair case that will take you to the 6th floor where you have a large room for entertainment adjoint to a large additional terrace.

Both the smaller terrace on the fifth floor and the larger terrace off the 6th floor has retractible patio awnings for shade and a lovely City view towards Central Park.

In addition,the Elevator goes all the way down to the basemen where you will find private storage bins for each unit and a room in the basement with gym equipment including a thread mill and a flat screen TV for use by the occupants.

Laundry,washer and dryer can be found in the basement as well.



Super is in the bldg. weekdays 9-1pm for packages or deliveries amongst other things.

This bldg is Pet friendly and there is no Board Approval Required for this sale."
83,16750000.00,"180 E 73rd St, New York, NY 10021",-73.9608,40.770599,10021,0,1,--,1910,4,4,Upper East Side,https://www.zillow.com:443/homedetails/180-E-73rd-St-New-York-NY-10021/2102526998_zpid/,"For sale: $16,750,000. 180 East 73rd Street presents an extraordinary opportunity to own a rare, three story carriage house with a curb cut located on the landmarked block of East 73rd Street between Lexington and Third Avenues. This block, which has been noted by the New York Times as one of the most distinctive in New York, is replete with low rise carriage houses that were originally used by the most wealthy residents of the Upper East Side.180 East 73rd Street was built in 1890 by the renowned architectural firm William Schickel & Co. The facade of this home boasts a Romanesque revival style limestone block base and brick upper stories. This home features two entrances, a side entrance and a center entry that is accompanied by a show window once used for commercial purposes. A curb cut remains in front of the property allowing a purchaser to potentially turn the center entry into a private garage. With 25 of width and a deep build, the interior of this house is extremely spacious offering approx. 8,750 sq. ft. of space (including below grade) with additional air rights available. The combination of the buildings grand ceiling heights, multiple outdoor spaces, full basement and available air rights would allow a purchaser to create an expansive, exceptional single family residence."
84,6850000.00,"1301 3rd Ave, New York, NY 10021",-73.959098,40.771301,10021,0,1,--,1910,8,8,Upper East Side,https://www.zillow.com:443/homedetails/1301-3rd-Ave-New-York-NY-10021/2087194807_zpid/,"For sale: $6,850,000. This property is located on Third Avenue between 74th  and 75th Streets on the Upper East Side.  The five-story, walk-up building consists of eight apartments and a commercial space. The building has been managed and owned by the same family for three generations.



The subject property is located in the Lenox Hill section of the Upper East Side. The building sits three blocks from two subway lines (Lexington Avenue and Second Avenue) and many of the city's top museums, hospitals, schools and stores."
