,price,address,logitude,latitude,zipcode,rent,sale,size,year built,bed,bath,Neighborhood,page_url,description
16,1150000.00,"100 Riverside Blvd APT 15A, New York, NY 10069",-73.989482,40.775704,10069,0,1,914,2006,1,1,Upper West Side,https://www.zillow.com:443/homedetails/100-Riverside-Blvd-APT-15A-New-York-NY-10069/89329838_zpid/,"For sale: $1,150,000. Immaculate & Elegant High-floor 1 Bedroom with large private storage! 

This immaculate, wonderfully spacious one-bedroom home introduces 914sqf of open space, luxurious finishes, over-sized windows, and eastern open city views from every room. Extra-large living room and dining area, open kitchen with stone counter tops and top-of-the-line Sub-Zero and Miele appliances, and elegant bathroom with a large soaking tub, separate glass-enclosed shower and natural stone tile. The master bedroom suite offers complete privacy, additional storage solutions, and a romantic city skyline views. There is an abundance of closets and hardwood floors throughout. As an extra bonus, you get your own washer/dryer. 

Majestically rising along on the Hudson River-The Avery Condominium is a full service white glove building featuring 24-hour doorman/concierge, state-of-the-art fitness center, playroom, private screening room, billiards room, landscaped courtyard garden, party room, lounge, and a business conference center. There is also parking on premises for an additional fee. 

Convenient to Lincoln Center, Riverside Park, Time Warner Center, and the finest of the Upper West Side, along with Midtown's dining, shopping, and recreation."
17,1599000.00,"200 Riverside Blvd APT 304, New York, NY 10069",-73.987658,40.77899,10069,0,1,1203,No Data,2,2,Upper West Side,https://www.zillow.com:443/homedetails/200-Riverside-Blvd-APT-304-New-York-NY-10069/31523050_zpid/,"For sale: $1,599,000. Best 2br/2ba Condo Value on the Upper West Side!

Come see this bright, spacious and beautifully renovated corner unit with a great layout and a washer/dryer in a full-service building on Riverside Park! The two bedrooms are split, enhancing the privacy of each room, and open into a gracious foyer (as opposed to opening directly to the living room like so many cookie-cutter apartments), creating a bedroom wing distinctly separate from the units living space. The sizable master bedroom, with en-suite bathroom, easily accommodates a king-sized bed and more. The pass-through kitchen, featuring upgraded cabinetry, fixtures and new appliances, opens to the large corner living space with oversized windows, providing for abundant natural light all day long. Other features of this home include gorgeous refinished hard wood floors, high ceilings, new HVAC units and a new large vented washer/dryer.

200 Riverside Boulevard is a full-service white glove condominium that has recently undergone a stunning multi-million dollar interior renovation and upgrade of the lobby, hallways and amenities (with no assessment!). Residents enjoy a 24-hour doorman, concierge, valet service, a state of the art health club, with steam, sauna, hot tub and a 50 foot indoor swimming pool, childrens playroom, storage units, bike storage and on-site parking. The location is stellar on Riverside Park with easy access to Pier I and the Hudson River bike/running path, across the street from the M72 bus stop, within two blocks of 3 Citi Bike stations, a 5-minute walk to the 1/2/3 express train station, and in close proximity to Trader Joes, Fairway, Citarella, Lincoln Center, and all the other amazing markets, shops, restaurants, bars and boutiques of the Upper West Side.

Advertised taxes of $1,048/mo are with the co-op/condo abatement applicable to owners who occupy the unit as their primary residence. Current taxes without the abatement are $1,270/mo."
18,2850000.00,"200 Riverside Blvd APT 34A, New York, NY 10069",-73.987658,40.77899,10069,0,1,1773,1997,3,3,Upper West Side,https://www.zillow.com:443/homedetails/200-Riverside-Blvd-APT-34A-New-York-NY-10069/31523098_zpid/,"For sale: $2,850,000. New Price -- Beautifully updated 3BED/3BATH home occupies the coveted southwest & southeast corners, offering SWEEPING VIEWS OF THE HUDSON RIVER & CITY! Mesmerizing sunsets and night views of NY City. Gracious entry foyer, separate living and dining areas, open remodeled kitchen with window, generous sized bedrooms, ample closets and in-house W/D. 200 Riverside Blvd. features luxury amenities, including: 24-hour concierge, doorman, resident manager, bike room, garage, private fitness center with indoor lap pool, sauna and children's playroom. Pet-friendly building with easy access to the best Upper West Side features: Riverside Park and the Hudson River Promenade and Pier with Caf, Lincoln Center, revered restaurants along Broadway and Natural History Museum. Nearby 1/2/3 trains for easy transportation. SHOWN BY APPOINTMENT ONLY."
19,3449000.00,"100 Riverside Blvd APT 3A, New York, NY 10069",-73.989482,40.775704,10069,0,1,1720,2006,3,4,Upper West Side,https://www.zillow.com:443/homedetails/100-Riverside-Blvd-APT-3A-New-York-NY-10069/83942329_zpid/,"For sale: $3,449,000. Come home everyday to your own private oasis - a 1300SF true entertaining terrace, your own backyard, your own terrace hot tub, 3 bedroom, 3-and-half bathroom condominium in the Avery on Riverside Boulevard. This rare outdoor space is accessible through both the family room and master bedroom - including abundant seating for a cocktail area, dining area, space for parties, lounging and outdoor living at its best. Beautifully landscaped with mature trees, gorgeous flowers and an automatic watering system. The interiors have been customized with extensive millwork including intricate crown moldings, customized closets and entertainment center with shelving and storage. All bedrooms have excellent closet space, two very substantial walk in closets, en suite baths and fantastic light. High ceilings throughout the residence create airy bright spaces. The interior features a Sub-Zero refrigerator, Miele cooktop, oven and dishwasher, designer cabinetry with granite counters and vented W/D. Limestone baths feature Waterworks fixtures and a selection of rare, imported stones from around the world. Enjoy the luxury of house-like living without leaving Manhattan. The Avery on Riverside South is a 32-story condominium at Riverside Boulevard & 65th Street, located two blocks from Lincoln Center with excellent access to the Upper West Side shopping and amenities, Time Warner Center and Midtown Manhattan. Services and amenities include full-time doorman, on-site parking garage, fitness center, children's playroom, gaming room, massive screening room, club suite and residents' library with Wifi access."
20,NaN,NaN,-73.991282,40.773993,NaN,NaN,NaN,1411,2013,NaN,NaN,Upper West Side,https://www.zillow.com:443/homedetails/50-Riverside-Blvd-APT-9N-New-York-NY-10069/219667064_zpid/,NaN
21,8995000.00,"220 Riverside Blvd APT 20N, New York, NY 10069",-73.987602,40.7798,10069,0,1,3842,2000,5,4,Upper West Side,https://www.zillow.com:443/homedetails/220-Riverside-Blvd-APT-20N-New-York-NY-10069/2099318285_zpid/,"For sale: $8,995,000. Everything in this extraordinary five-bedroom, four-bathroom apartment speaks to luxurious living. 
 
 High above the Hudson River on the Upper West Side, the newly renovated apartment with more than 3800 square feet of light-filled living space and 11-foot ceilings features stunning views from practically every room. 
 
 A breathtaking 55-foot living/dining/entertaining space forms the heart of the apartment, with 6-inch oak floors, a sleek EcoSmart fireplace, built-in 85-inch plasma television and a mahogany wine bar complete with a Gaggenau wine refrigeration for 300 bottles, Sub-Zero refrigeration drawers and a dishwasher. The exquisite new kitchen at the northwest corner includes Concetto white Ceasarstone countertops, a five-burner Wolf range with vented hood, premium Miele appliances, a Franke sink and two wall ovens. A large island with seating provides a perfect spot to sit and enjoy incredible views and dramatic sunsets. 
 
 The five bedrooms in this sprawling corner apartment are divided between two separate wings. Facing the Hudson River are the grand master bedroom with huge windows and spacious custom closets as well as a large second bedroom now fitted out as a custom designed office and murphy bed. The master bathroom has imported mosaic glass tiles, a double Krion sink, a Wenge vanity as well as a walk-in shower, full-size bathtub and radiant heat floor. 
 
 The northeast corner contains a separate bedroom wing with a second master suite that has beautiful open city views all the way to Central Park. In addition to the second master, this wing has two generously sized bedrooms, a laundry room, two baths and capacious closets. Throughout the apartment are high-end details such as remote-controlled Hunter Douglas black out and solar shades, a Crestron audio-visual system, spacious closets and custom millwork. A storage unit is included in the sale. 
 
 Impeccable service and unsurpassed amenities are the cornerstone of 220 Riverside Boulevard. These include concierge, doorman, valet, live-in manager, swimming pool, a state-of-the-art fitness center with steam, sauna, private massage rooms, events rooms, a billiard room and a children's playroom. In addition, there is an on-site parking garage and a beautifully landscaped garden to enjoy during the warmer months."
22,NaN,NaN,-73.987701,40.778999,NaN,NaN,NaN,2370,1997,NaN,NaN,Upper West Side,https://www.zillow.com:443/homedetails/200-Riverside-Blvd-6AB-New-York-NY-10069/2086873678_zpid/,NaN
23,10975000.00,"240 Riverside Blvd # 23AC, New York, NY 10069",-73.986926,40.780306,10069,0,1,4456,2004,4,4.5,Upper West Side,https://www.zillow.com:443/homedetails/240-Riverside-Blvd-23AC-New-York-NY-10069/69524488_zpid/,"For sale: $10,975,000. Four Bedroom Condo with Panoramic Views



Quite possibly the most expansive and stunning views in New York City. Perched on the 23rd floor of The Heritage Condominium, enjoy unobstructed views of the Hudson River, Riverside Park and the New York City skyline. 



The grand living / dining room, with corner widows facing west and north, allows for a large dining table in addition to spacious entertaining that flows into the west facing library. Complete with top of the line appliances, the kitchen spans 28 feet with a wall of windows, eating area, and an oversized den, which is great for screenings, less formal gatherings, and more. The oversized master bedroom boasts yet another corner exposure and walls of windows, fantastic views and a very large ensuite bathroom with double sinks, shower, and separate tub with a spectacular view of the Hudson. There are three additional bedrooms, each with their own bathroom. 



Expect White Glove service at The Heritage Condominium. Amenities include 24-hour doorman/concierge, swimming pool, gym, entertaining and meeting rooms, and a children's playroom. This property offers truly unparalleled space and views, and is a must-see. 24-hour notice is required for appointments. Showing hours are after 12:30 pm."
24,1699000.00,"240 Riverside Blvd APT 15O, New York, NY 10069",-73.9869,40.7803,10069,0,1,1151,2004,2,2,Upper West Side,https://www.zillow.com:443/homedetails/240-Riverside-Blvd-APT-15O-New-York-NY-10069/2090542457_zpid/,"For sale: $1,699,000. Fantastic opportunity to purchase a stunning 2 Bedroom CONDO at the Heritage! 

Currently rented at $6,000/month, the apartment can be delivered vacant or with the same tenants in place! 

This spacious 2BEDS/2BTHS apartment is the only in the ""O"" line at the Heritage to clear the neighboring building and have direct sunlight coming in. A large terrace is perfect for enjoying your breakfast outside. Generously proportioned rooms, huge windows, marble bathrooms, large closets, top of the line appliances, washer and dryer in the apartment. 
The apartment is in the excellent condition and comes with a storage unit in the basement.

After the recent rezoning, the Heritage is zoned for PS199! 

The building and the location offer a unique combination of privacy, convenience, and luxury: under 150 units in the building with many combinations and large apartments, steps from the express 2/3 trains, a short walk to the most desirable UWS shops and restaurants, Riverside Park and the embankment at your doorsteps. The Heritage is known for its excellent service and ample amenities: 2 swimming pools, gym, residents lounge, library and garden, a beautiful playroom with natural light and a function room, which opens into the garden, and garage in the building."
25,2480000.00,"50 Riverside Blvd APT 14G, New York, NY 10069",-73.991282,40.773993,10069,0,1,1446,2013,2,2,Upper West Side,https://www.zillow.com:443/homedetails/50-Riverside-Blvd-APT-14G-New-York-NY-10069/219667004_zpid/,"For sale: $2,480,000. Welcome Home. A spacious and sunny 1,446 sqft, 2-Bed, 2-Bath residence with amazing Eastern Exposure and direct morning light in both bedrooms. One Riverside Park is one of the most sought after buildings on Riverside Boulevard and features incredible amenities and a tax abatement until 2037.

The home features warm, modern and elegant interiors by Shamir Shah Design including a gourmet kitchen with breakfast bar and wide plank oak flooring with a custom dark stain. 14G offers a desirable split bedroom plan, each bedroom gracious in size with customized California closets and a walk-in closet in the master. The designer kitchen is outfitted with dark stained oak millwork paired with dark grey lacquer wall cabinetry, honed Balsatina stone slab countertops and nickel tile backsplash. Top-of-the-line appliances include Miele stainless steel gas cooktop and oven with fully vented range hood, Miele refrigerator and freezer, Miele dishwasher and GE microwave. The Master bathroom is luxurious and modern with a dark oak vanity with double sinks, marble countertops and walls, Zuma deep soaking tub, glass enclosed shower with rainfall showerhead and Dornbracht polished chrome fixtures. The second bathroom is bright and classic with glossy white wall tile and white polished lacquer vanity. Also included in this spacious home, a Miele washer and fully vented dryer.

One Riverside Park at 50 Riverside Boulevard is New York's most distinguished new address, introducing a new level of luxury to waterfront living on Manhattan's Upper West Side. One Riverside Park provides a convenient, all-inclusive way of life for its residents with over 50,000 square feet of amenities offering programs and personalized services that promote wellness and a balanced lifestyle. Neighboring Riverside Park South offers 21 acres of open space, sports fields, playgrounds, plazas, piers and intimate gardens easily accessed by residents. Additionally, soon to be open to public Waterline Square Park will provide 2.6 acres of sculptural fountains, manicured lawns, meandering paths, cascading water features, and a fully equipped playground. Cipriani's first food hall will be opening this summer just around the corner, and a brand new Morton Williams is coming to the neighborhood in a few months."
26,899000.00,"120 Riverside Blvd APT 4M, New York, NY 10069",-73.989149,40.776333,10069,0,1,835,2004,1,1,Upper West Side,https://www.zillow.com:443/homedetails/120-Riverside-Blvd-APT-4M-New-York-NY-10069/69511103_zpid/,"For sale: $899,000. WELCOME TO 120 RIVERSIDE BLVD! Extra large and Bright 1 bedroom residence with eat- in- kitchen, extra large living room with corner windows, ample closet space, well maintained hardwood floors, washer/ dryer and entry foyer. Special building features: Doorman and concierge service, 24 hour maintenance staff and security, health club and spa with indoor pool, hot tub, poolside sauna, media room, large children's playroom, private sky lounge, landscaped rooftop with panoramic Hudson River views! Residents may enjoy wonderful Riverside Park South, Riverside Park Pier, and Hudson River Greenway with bicycle and jogging paths, dog run, ball fields just to mention a few. Near the 79th Street Boat Basin which hosts a 110-slip public marina, Pier 1 Café, local restaurants and groceries.
"
27,NaN,NaN,-73.989149,40.776333,NaN,NaN,NaN,874,2004,NaN,NaN,Upper West Side,https://www.zillow.com:443/homedetails/120-Riverside-Blvd-APT-5W-New-York-NY-10069/80009352_zpid/,NaN
28,5390000.00,"200 Riverside Blvd APT 21D, New York, NY 10069",-73.987701,40.778999,10069,0,1,2800,1997,4,4,Upper West Side,https://www.zillow.com:443/homedetails/200-Riverside-Blvd-APT-21D-New-York-NY-10069/2088651317_zpid/,"For sale: $5,390,000. Enjoy the pinnacle of New York luxury living in this fabulous 2800 sqft 4 bedroom, 3.5 bathroom home, which includes an additional 1,350 sqft of out door space. Garnished with tasteful design accents and embellishments throughout, this home boasts stylish coffered ceilings, custom lighting, hardwood flooring in the living, dining, and library rooms, and elegant Italian tiling in the apartment's grand eat-in kitchen. Separate living and dining rooms provide the perfect space for hosting guests, while the home's cozy library room acts as the ideal study nook, featuring built-in bookcases and custom design finishes. The windowed eat-in kitchen is equipped with state-of-the-art stainless steel appliances, marble countertops, and plenty of cupboard storage. The home also contains a separate laundry room. Each bedroom contains custom closets, providing the home with ample storage space, while the master bedroom features both a walk-in closet and en-suite master bath. The master bathroom contains both a bathtub and walk-in shower as well as plush marble countertops and well-lit vanity. Perhaps the best amenity this apartment has to offer is its spacious and completely private grand terrace garden, perfect for entertaining large groups of guests or just enjoying iconic views of the city. In addition there is a wisteria arbor, watering system, lights and gas for great out door cooking and dining. Of course, residents of 200 Riverside are treated to the finest luxury building amenities New York can offer, including 24-hour concierge and doorman service, private fitness center and 50 x 12 indoor pool, billiards/game room, parking garage, and children's playroom."
29,3299000.00,"60 Riverside Blvd APT 1112, New York, NY 10069",-73.990979,40.774574,10069,0,1,2075,2008,3,4,Upper West Side,https://www.zillow.com:443/homedetails/60-Riverside-Blvd-APT-1112-New-York-NY-10069/117505359_zpid/,"For sale: $3,299,000. Make yourself right at home in this Graciously designed 3-bedroom, 3.5 bathroom corner residence boasting a massive 2,075 Square Feet, Captivating South Eastern views of the New York City skyline, and an expansive living/dining room with stunning exposed brick. The recently upgraded Country style kitchen includes a Stainless steel Wolf oven, Miele Refrigerator, and custom cabinetry along with a separate bar area. The North Eastern facing corner master bedroom includes an upgraded walk-in closet and an en-suite windowed bathroom with natural stone, double sinks, a deep Zuma soaking tub with a separate large glass stall shower. Additionally, there are two very spacious Bedrooms with ensuite white marble baths. Other notable features of the unit are: a Powder Room, Storage Closet, custom Lutron System with concealed motorized shades and Laundry room with Bosch washer and dryer. This home also has multiple zones of temperature controlled central A/C, and beautiful cherry hardwood floors. The Aldyn Condominium offers spectacular amenities including a 24-hour doorman, concierge, on-site parking garage, landscaped courtyard, and La Palestra Managed fitness center with: Full sized Basketball Court, 75' indoor pool, Squash Court, Pilates, Bowling, PGA Golf Simulator, 30 Rock climbing wall, billiards and two lounges. This white glove building is strategically located on the vibrant Upper West Side, a short stroll from Starbucks, Riverside Park, Central Park, Whole Foods Market, local and express subways, shopping and plenty of restaurants"
30,4495000.00,"80 Riverside Blvd APT 4L, New York, NY 10069",-73.989946,40.775053,10069,0,1,2513,2006,4,4,Upper West Side,https://www.zillow.com:443/homedetails/80-Riverside-Blvd-APT-4L-New-York-NY-10069/89329416_zpid/,"For sale: $4,495,000. Enjoy sweeping River views from this bright and airy 4 bedroom 3.5 bathroom highly desirable L-line residence. This fantastic apt presents a nice flow with a gracious entry foyer, dramatic open corner double living room with a separate dining area, perfect for entertaining, a spacious master bedroom with a dressing area boasting 2 walk-in closets and an en suite 5 fixture master bath with separate tub and glass enclosed shower. Bathrooms offer a range of marble and limestone with Waterworks fixtures. The chef's kitchen features a Viking stove, Subzero wine cooler and fridge, granite countertops, glass tile back splash and wood cabinetry. Apartment comes with large storage space. Custom mill work, electronic shades and wood floors complete this fantastic residence. The RUSHMORE is a full service 24 hour doorman and concierge luxury condominium with the best amenities one can desire including a swimming pool, spa services, steam room, children's playroom, party room, billiards, screening room, sundeck, garage and a daily morning and evening shuttle service. Steps to Riverside Park."
31,7500000.00,"60 Riverside Blvd APT 2902, New York, NY 10069",-73.990979,40.774574,10069,0,1,3047,2008,4,4.5,Upper West Side,https://www.zillow.com:443/homedetails/60-Riverside-Blvd-APT-2902-New-York-NY-10069/117458223_zpid/,"For sale: $7,500,000. This is combination apartment that has been masterfully reconfigured into a 4 Bedroom with a Home Office and 4.5 Baths. The living room has floor to ceiling windows with expansive city views facing north and east. There is an open kitchen with a tasteful marble island; sleek custom cabinetry; Viking, Subzero and Miele appliances; and marble countertops. The unique Master Suite is an oasis to unto itself: it has floor to ceiling windows with gorgeous and expansive views of the Hudson river; an ensuite sitting room, home office, private balcony; 2 walk in closets; and marble bathroom with built in marble desk, double sinks and glass enclosed, 6 fixture shower. The other three bedrooms feature gorgeous city or river views and ensuite bathrooms with Waterworks fixtures. The windowed powder room is exceptionally modern with a freestanding round sink. In wall fixtures, and gorgeous marble tile flooring. There is also a true utility room, with a Miele Washer and Dryer. The 3,000+SF apartment also has hardwood flooring, central air conditioning and in-wall surround sound speakers throughout. A 421-A tax abatement is in effect. The Aldyn Condominum is a full service building with on-site parking, childrens playroom, private storage, shuttle service to Columbus Circle, and the LaPalestra athletic club and spa. It has 40,000sf of amenities, including a swimming pool, full basketball court, bowling alley, rock climbing wall, spinning and yoga."
32,NaN,NaN,-73.989946,40.775053,NaN,NaN,NaN,951,2006,NaN,NaN,Upper West Side,https://www.zillow.com:443/homedetails/80-Riverside-Blvd-4A-New-York-NY-10069/89330792_zpid/,NaN
33,6995000.00,"240 Riverside Blvd APT 26A, New York, NY 10069",-73.9869,40.7803,10069,0,1,2901,2004,4,4,Upper West Side,https://www.zillow.com:443/homedetails/240-Riverside-Blvd-APT-26A-New-York-NY-10069/2086128490_zpid/,"For sale: $6,995,000. You can see forever! Truly some of the best views in the city. This sprawling four bedroom home offers sweeping River, Park and City views from every room. There is a grand living room, a spacious dining room, a windowed eat-in kitchen, three and a half marble bathrooms, and a washer/dryer. The elegant master suite also offers panoramic views from two exposures, a huge walk-in closet and an en-suite master bath with a separate glass-enclosed shower, soaking tub and two sinks. PLEASE NOTE 26B is also avail for sale to create a 5000 sq ft 4/5 combo. The Heritage is a white-glove condominium that offers a doorman, concierge, two pools, a state-of-the-art gym, as well as party, meeting and children's playrooms. You will have the peace of living on the river, yet only be a couple of blocks away from the most convenient transportation, shopping (Trader Joe's and Fairway) and Riverside Park (and it's a dog park) are right across the street."
