,price,address,logitude,latitude,zipcode,rent,sale,size,year built,bed,bath,Neighborhood,page_url,description
0,419000.00,"50 Park Ter W APT 6B, New York, NY 10034",-73.917931,40.870611,10034,0,1,825,1925,1,1,Inwood and Washington Heights,https://www.zillow.com:443/homedetails/50-Park-Ter-W-APT-6B-New-York-NY-10034/82784680_zpid/,"For sale: $419,000. ALL THAT AND THEN SOME! This is the ultimate 1BR/1BA that literally checks off each box on a discerning home buyer's list: top floor, generous layout, beautiful light, open views, exquisite period details, and lovely renovations. If it's perfection you're after, you've just found it!



There's an immediate sense of space when you walk in with the foyer opening to an expansive sunken living room, complete with lovely wrought iron railings and intricate woodwork around the deco arch. The kitchen with a large eat-in area has been tastefully renovated with warm cherry wood cabinetry and open shelving, and features stainless appliances. The bathroom is a charming throwback where the beautifully maintained original features have been matched with period appropriate upgrades. The huge bedroom with enchanting morning light through a corner window has two exposures and two closets. Other deco details include stunning herringbone/hardwood floors with inlays, a unique full-size built-in bookshelf, and picture moldings throughout - folks, this is simply pure charm!



The location of this art deco jewel is in one word ideal, being surrounded by parks on one of the quietest blocks of NYC, yet close to all the amenities and transportation - pretty and convenient, all in one package. Never again be bothered by noisy upstairs neighbors, so get ready to enjoy morning sunrises and quiet evenings in your new home....



NB: There is a capital assessment of $158.32/mo until 3/2021.



This fantastic nabe has great outdoor opportunities, providing easy access to tennis, basketball, and handball courts, baseball and soccer fields, hiking/biking trails, and kayaking. It boasts the best dog run of the city (according to many) and is a nature-loving city-dweller's fantasy fulfilled. The local services include a year-round farmer's market, cafes and restaurants, banks, florists, and hardware stores; River Plaza shopping center with Target, Marshall's, etc. is within a quick walking distance. Inwood is serviced by A express and 1 local subway lines, Metro North (Marble Hill), and the east-side express bus to lower Manhattan, and is easily accessible by most major highways.



EXCLUSIVE AGENT: ACCESS PROPERTY GROUP"
1,249000.00,"90 Park Ter E APT 7H, New York, NY 10034",-73.91554,40.870891,10034,0,1,400,1949,0,1,Inwood and Washington Heights,https://www.zillow.com:443/homedetails/90-Park-Ter-E-APT-7H-New-York-NY-10034/99374316_zpid/,"For sale: $249,000. VIEWS 'TIL TOMORROW! Wake up with the first rays of the rising sun with open, urban views over the eastern horizon and even a distant peek of lower Manhattan - all at a price that's unheard of in today's day and age. If you've been looking for an opportunity to get your foot in the door with home buying, you just hit a jackpot!



This darling top-floor Studio/1BA is in perfect move-in condition, having been gut-renovated a few years ago. The compact, yet highly functional kitchen has all the features that an aspiring home chef might desire: lovely wood cabinetry offering great storage, sleek black granite counters, and all stainless steel appliances, including a dishwasher and a microwave. You can enjoy long and relaxing baths in the earthtone-tiled bathroom that will surely calm your nerves and take you to a zen place far away from the craziness of the city. This home has skim-coated walls and newly refinished original parquet floors throughout, and three closets offer plenty of storage for your belongings.



In addition to being the ideal first purchase, this home also makes a fabulous pied-a-terre because of its extra low maintenance resulting in VERY attractive monthly payments. Come and see this gem now, and be prepared to fall in love....



This fantastic nabe has great outdoor opportunities, providing easy access to tennis, basketball, and handball courts, baseball and soccer fields, hiking/biking trails, and kayaking. It boasts the best dog run of the city (according to many) and is a nature-loving city-dweller's fantasy fulfilled. The local services include a year-round farmer's market, cafes and restaurants, banks, florists, and hardware stores; River Plaza shopping center with Target, Marshall's, etc. is within a quick walking distance. Inwood is serviced by A express and 1 local subway lines, Metro North (Marble Hill), and the east-side express bus to lower Manhattan, and is easily accessible by most major highways.



EXCLUSIVE AGENT: ACCESS PROPERTY GROUP"
2,425000.00,"65 Park Ter E APT C58, New York, NY 10034",-73.916575,40.870708,10034,0,1,800,1939,1,1,Inwood and Washington Heights,https://www.zillow.com:443/homedetails/65-Park-Ter-E-APT-C58-New-York-NY-10034/72536623_zpid/,"For sale: $425,000. Gorgeous garden views from EVERY ROOM!! Yes, even the bathroom.

This 1 Bedroom with thoughtful layout, available on a high floor, in a well cared for Pre War elevator building is calling to you. Original oak hardwood floors in a herringbone pattern flow seamlessly throughout the apartment. All of the doors and knobs are original and filled with charm and history.

As you enter the foyer with large coat closet, its clear youve entered into a special space. The draw to the windows is unmistakable; its that view, the quiet and the flood of sunshine that makes you feel at home. A gracious sunken living room with the original wrought iron handrails is a great spot to gather with friends and family.

The kitchen offers granite countertops with custom stone backsplash and lots of working space. A wine rack, dishwasher and black slate floors should not be overlooked. The king size Bedroom offers 2 closets and a beautiful bay window to watch the snowfall stick to the trees in the garden. Charming, inviting and spacious, this apartment has to be seen to be fully appreciated.

Park Terrace Gardens features include: roof deck, free high-speed internet, concierge services, bike storage, laundry and so much more. 

The neighborhood features two parks with over 200 acres of woodland. Transportation couldn't be better. Two subway lines (the A and #1 trains), express bus and Metro North station are all conveniently located. Great parks, terrific transportation, convenient shopping, restaurants, Saturday's farmer's market and so much more - Come see what home feels like in Inwood!"
3,399999.00,"95 Park Ter E APT 4F, New York, NY 10034",-73.915755,40.871316,10034,0,1,767,1925,1,1,Inwood and Washington Heights,https://www.zillow.com:443/homedetails/95-Park-Ter-E-APT-4F-New-York-NY-10034/72536687_zpid/,"For sale: $399,999. Spacious, sunny, corner, Art Deco one bedroom at 95 PTE.  This unit has has the best layout you'll find in this price range.  When you enter the large foyer, which could easily double as a dining area, you're greeted by a beautiful imported French Art Deco cut-glass, hanging light and built-in shelves.In front of you, a lovely decorative arch and scrolling banisters lead you into a big, light-filled, sunken living room.



Two windows with southern exposure overlook quiet, tree-lined 217th street.The windowed eat-in kitchen, also off the foyer, has more lovely pre-war details, like a chair rail, as well as an installed water filter. Have your meals in the eat-in area while looking through another archway to a beautiful tree right outside.At the foyer's end, pass through another arch to the hallway, leading to the bathroom and bedroom.



The windowed bathroom has a new pedestal sink and newly tiled shower body as well as the original over-sized soaking tub.The generous bedroom has both eastern and southern exposures.

This apartment has lots of character with its red oak hardwood floors inlaid with walnut marquetry, crown and picture moldings, high ceilings and curved walls.



It also has 4 closets, one of which is a walk-in and updated electric. And it's steps from Inwood's renowned parks and nature trails, both the 1 and A trains, a Saturday Green Market as well as Inwood's community activities and concerts.



Sorry no dogs."
4,NaN,NaN,-73.9169,40.8712,NaN,NaN,NaN,700,1939,NaN,NaN,Inwood and Washington Heights,https://www.zillow.com:443/homedetails/72-Park-Ter-W-APT-E35-New-York-NY-10034/2090783006_zpid/,NaN
5,269000.00,"77 Park Ter E APT D19, New York, NY 10034",-73.916133,40.87095,10034,0,1,475,1939,0,1,Inwood and Washington Heights,https://www.zillow.com:443/homedetails/77-Park-Ter-E-APT-D19-New-York-NY-10034/123978448_zpid/,"For sale: $269,000. Feels like a one bedroom at a price that cant be beat! Apartments like this rarely come on the market. Park Terrace Gardens, Inwoods most sought after cooperative, only has 4 studios in the entire 400 unit complex. Great opportunity for you to purchase in this most desirable complex at an affordable entry-level.

Very large and living area with a full size open kitchen. The living area has been divided with a wonderful storage solution giving you privacy, separation and still plenty of room. The apartment looks out over the front gardens and across the way are beautiful Tudor style homes built in the 1920s. This is one of the prettiest blocks in all of Manhattan.
There is a very large entry foyer and a separate dressing are. Tons of storage.
The building offers: free high speed internet access, concierge services, roof deck, on-site management, laundry room, and so much more."
6,NaN,NaN,-73.930304,40.866824,NaN,NaN,NaN,66456,1926,NaN,NaN,Inwood and Washington Heights,https://www.zillow.com:443/homedetails/1793-Riverside-Dr-APT-6J-New-York-NY-10034/244845230_zpid/,NaN
7,629000.00,"75 Park Ter E # D70, Manhattan, NY 10034",-73.916397,40.871101,10034,0,1,950,1939,2,1,Inwood and Washington Heights,https://www.zillow.com:443/homedetails/75-Park-Ter-E-D70-Manhattan-NY-10034/2090186935_zpid/,"For sale: $629,000. Inwood Two-Bedroom with Spectacular View

This sunny, open and professionally renovated 2 bedroom, one bath co-op on the 7th floor is the best the neighborhood has to offer! The skyline goes on forever from this elegant Pre-War two-bedroom in Inwoods coveted Park Terrace Gardens Coop. This apartment has been gorgeously renovated from floor to ceiling with modern kitchen and bathroom, while maintaining its natural charm.

The luxury kitchen has been updated to include every detail including new cabinetry, hardwood flooring, under cabinet storage drawers and top of the line integrated appliances. Features include a full-sized Sub Zero refrigerator/freezer with built-in ice-maker, integrated Viking Designer series cooktop with Viking Professional range hood, Viking oven, ultra quiet Bosch dishwasher, Water chef premium water filtration system, Grohe faucet, Waveline mosaic pure silk glass tile backsplash, 2 thick White Carrara honed marble countertops, under-cabinet lighting, above-cabinet lighting and installed microwave. Other wonderful details include an extended breakfast bar adding nearly two additional feet of cooking/ dining space in the kitchen, integrated shelving with drawers for storage and a spice pantry.

The impeccably renovated bathroom boasts clean, modern lines and is simply luxurious. The 2017 gut renovation includes 1/2"" thick herringbone marble tile floors, gleaming porcelain floor to ceiling wall tiles, Rejuvenation Tolson thermostatic shower set with hand-shower in aged brass, Rejuvenation Tolson faucet and handles, Kohler Santa Rosa toilet, Kohler double mirrored vanity/medicine cabinet, and Ronbow vanity with soft-close doors.

The open living space features a sunken living room, dining foyer, George Kovacs ceiling fan/light fixture and expansive views, from miles of open sky to a charming, tree-lined street showcasing Inwood's row of Tudor-style homes. Other amazing Art Deco features include wrought iron railings and built-in recessed bookshelves, highlighted by herringbone hardwood floors and beamed ceilings.

The welcoming master bedroom and second bedroom are full-sized rooms that get amazing morning sunlight. The master room updates include a George Kovacs light and fan and 10.5 feet of floor to ceiling wardrobe added for additional closet space. This wardrobe also features glass doors that serve as a very convenient whiteboard.

Park Terrace Gardens has an on-site management office, 24-hour laundry room, concierge service, free Internet and rooftop common areas for BBQs and entertaining. This unit is in an amazing and friendly neighborhood with the majestic 196-acre Inwood Hill Park within walking distance. Come see the perfect place to call home!"
8,399000.00,"579 W 215th St APT 4B, New York, NY 10034",-73.918951,40.872024,10034,0,1,800,1966,1,1,Inwood and Washington Heights,https://www.zillow.com:443/homedetails/579-W-215th-St-APT-4B-New-York-NY-10034/244849685_zpid/,"For sale: $399,000. Very Spacious One Bedroom at a Great Price

Spacious sunny one bedroom with brand new kitchen and bathroom. Lots of closets, entry foyer, trees by the windows, hardwood floors throughout the apartment. Elevator, laundry, super in the building and roof access.

Also available for rent - $2100/mo."
9,NaN,NaN,NaN,NaN,NaN,NaN,NaN,NaN,NaN,NaN,NaN,Inwood and Washington Heights,https://www.zillow.com:443/homedetail/AuthRequired.htm?r=pfc&zpid=248060078,NaN
10,NaN,NaN,NaN,NaN,NaN,NaN,NaN,NaN,NaN,NaN,NaN,Inwood and Washington Heights,https://www.zillow.com:443/homedetail/AuthRequired.htm?r=pfc&zpid=247904138,NaN
11,NaN,NaN,NaN,NaN,NaN,NaN,NaN,NaN,NaN,NaN,NaN,Inwood and Washington Heights,https://www.zillow.com:443/homedetail/AuthRequired.htm?r=pfc&zpid=154074894,NaN
12,NaN,NaN,-73.932278,40.853983,NaN,NaN,NaN,1914,1901,NaN,NaN,Inwood and Washington Heights,https://www.zillow.com:443/homedetails/286-Wadsworth-Ave-New-York-NY-10040/31553872_zpid/,NaN
13,1100000.00,"100 Overlook Ter # 36/37, New York, NY 10040",-73.934799,40.8563,10040,0,1,--,1963,4,2,Inwood and Washington Heights,https://www.zillow.com:443/homedetails/100-Overlook-Ter-36-37-New-York-NY-10040/2087839217_zpid/,"For sale: $1,100,000. LOSE YOURSELF IN THIS UNIT!!!
(ALL OFFERS WILL BE CONSIDERED) If it is space, you are looking for, look no further! This massive apartment is a combination of a one-bedroom and a two-bedroom that can give you the option to create your own oasis. Currently configured as a four-bedroom two-bathroom with your own private office or whatever you desire. 
The apartment offers a lager renovated windowed eat-in kitchen, nine of closets, extremely large rooms, hardwood floors throughout, great light, and two bathrooms.
The building features include a live-in super, 24-hour full-time lobby attendant, laundry facilities in-building (two), a garage (waiting list), storage (waiting list), and a bike room (waiting list).
100 Overlook Terrace is conveniently located with easy accessible to both the A and 1 trains as well as local MTA buses. The building is close to several parks including Gorman Park and Fort Tryon Park, Bennett Park, and all shopping and restaurants. Sorry no dogs. Cats are okay. Special Assessment of $193.09 till 06/2020."
14,899000.00,"730 Fort Washington Ave APT 3H, New York, NY 10040",-73.934209,40.858215,10040,0,1,1150,1939,2,2,Inwood and Washington Heights,https://www.zillow.com:443/homedetails/730-Fort-Washington-Ave-APT-3H-New-York-NY-10040/72653209_zpid/,"For sale: $899,000. Perfection is the key!
Sprawling renovated Two Bedrooms/ Two Bath apartment in one of Hudson Heights most sought-after buildings. As soon as you step into this home you will be amazed at the size of the rooms. A large dining Foyer flows into the huge sunken Living room with Eastern-facing windows and wide open city views. Wonderful hardwood floors, loads of closet space and 8.9 foot ceilings.
The renovated eat-in kitchen with a breakfast counter has a stainless steel appliances and tons of cabinet storage and counter space for meal prepping. It is large enough for festive gatherings. The spacious master bedroom is beautifully accented with a large corner window opening to dramatic panoramas of Fort George Hill. The second bedroom has two large closets and can easy fit a queen size bed. The second windowed bathroom is also renovated with a nice sink and medicine cabinet.
The amenities in the building include fitness club ($240/yr), storage facilities(WL), two laundry rooms, private courtyard garden, two bicycle rooms and a security guard(PT).Situated only a few steps from majestic Fort Tryon Park with famous vistas of the George Washington Bridge spanning the Hudson River, three seasonal gardens, wooded promenades, terraces, eight miles of pedestrian paths and the world famous Cloisters Museum (part of the Metropolitan Museum of Art).
This terrific property is nearby playgrounds, parks, restaurants, shops, schools and parking garages. The A train is steps away to take you to Midtown in 20 minutes. 
Pets are welcome"
15,565000.00,"245 Bennett Ave APT 4B, New York, NY 10040",-73.93273,40.85822,10040,0,1,900,No Data,2,1,Inwood and Washington Heights,https://www.zillow.com:443/homedetails/245-Bennett-Ave-APT-4B-New-York-NY-10040/125791441_zpid/,"For sale: $565,000. *SUN-DRENCHED 2 Bedroom! 10% Down Allowed!*
Located on the corner of 192nd & Bennett Ave, a cozy tree-lined side street away from Broadway where the beautifully preserved big old trees surrounds this home along with the Majestic Cliff. This true 2 Bedroom home has south and East exposure, with over-sized windows in every single room makes this home extremely bright though out the day. There are 3 different 2BR layouts in this well-established 350 Unit Co-op, and this is the BIGGEST of all. 

This lofty and airy layout allow you to convert this 2 Bedroom into a 3 bedroom by installing windowed French doors dividing at the living room, which could be perfect for the guest room(will hold the full size bed) or office. 

Absolutely move-in condition, this property was completely renovated with skilled craftsmanship only a few years ago. The hardwood floors are in superior condition, walls are all skim-coated and both ceiling and flooring have elegant wood crown molding throughout. The windowed Kitchen has a gorgeous one-slab granite counter top. This kitchen is equipped with all stainless steel appliances, including a full size fridge, a full size dishwasher and the faucet has pull-down sprayer feature for quick sink wash. There are plenty of cabinetry and counter surfaces. This unit offers fabulous closet space. Both of the bedrooms are large and almost equal in sizes; there will be plenty of room left after placing your complete set of bedroom furniture!
 
There are two major subway lines very close by (Express A line is on the same block, 1 line is one block away). This financially sold coop is offering affordable low maintenance, 24/7 laundry facility, bike room, manicured flower garden, resident super and porters. The coop allows both dogs and cats-with no weight restriction and 90% financing allowed! 245 Bennett Avenue is situated in the heart of Hudson heights, next to the breath-taking Fort Tryon Park with Hudson River views!"
16,NaN,NaN,-73.935447,40.855302,NaN,NaN,NaN,--,1959,NaN,NaN,Inwood and Washington Heights,https://www.zillow.com:443/homedetails/66-Overlook-Ter-APT-3-O-New-York-NY-10040/72536468_zpid/,NaN
17,NaN,NaN,NaN,NaN,NaN,NaN,NaN,NaN,NaN,NaN,NaN,Inwood and Washington Heights,https://www.zillow.com:443/homedetails/14-Bogardus-Pl-APT-4R-New-York-NY-10040/83894809_zpid/,NaN
18,1050000.00,"730 Fort Washington Ave APT 5B, New York, NY 10040",-73.934209,40.858215,10040,0,1,--,1939,3,2,Inwood and Washington Heights,https://www.zillow.com:443/homedetails/730-Fort-Washington-Ave-APT-5B-New-York-NY-10040/72536549_zpid/,"For sale: $1,050,000. Live Large!
The moment you enter apartment 5B in 730 Fort Washington Avenue, you will understand what makes this Art Deco home so enticing. The amazing views, splashed with blue skies, will deepen your relationship with the Hudson River, the Palisades and Fort Tryon park,
The sweeping sunken living room lets you delight in the change of seasons with its treetop views of the Palisades and Fort Tryon park. The large corner master bedroom affords views to the west and south. It has an en-suite bathroom fitted with a stall shower. The second and third bedroom(currently used as home offices and den), very spacious, are flooded with light from its Eastern and southern exposure. There is a galley windowed kitchen and a generous dining room for large gatherings. There are also 7 large closets, original hardwood floors and 9 ft ceilings throughout the apartment. 

Museum quality classic 1939 Art Deco building, wonderfully maintained and friendly coop. The amenities in the building include fitness club ($240/yr), storage facilities(WL), two laundry rooms, private courtyard garden, two bicycle rooms and a security guard(PT). Situated only a few steps from majestic Fort Tryon Park with famous vistas of the George Washington Bridge spanning the Hudson River, three seasonal gardens, wooded promenades, terraces, eight miles of pedestrian paths and the world famous Cloisters Museum (part of the Metropolitan Museum of Art). This terrific property is nearby playgrounds, parks, restaurants, shops, schools and parking garages. The A train is steps away to take you to Midtown in 20 minutes.
 Pets are welcome!"
19,NaN,NaN,-73.934425,40.857787,NaN,NaN,NaN,1250,1939,NaN,NaN,Inwood and Washington Heights,https://www.zillow.com:443/homedetails/720-Fort-Washington-Ave-APT-2B-New-York-NY-10040/244730518_zpid/,NaN
20,NaN,NaN,-73.937272,40.857044,NaN,NaN,NaN,117678,1942,NaN,NaN,Inwood and Washington Heights,https://www.zillow.com:443/homedetails/360-Cabrini-Blvd-APT-7G-New-York-NY-10040/244779555_zpid/,NaN
21,400000.00,"689 Fort Washington Ave APT 4L, New York, NY 10040",-73.93594,40.857458,10040,0,1,--,1928,1,1,Inwood and Washington Heights,https://www.zillow.com:443/homedetails/689-Fort-Washington-Ave-APT-4L-New-York-NY-10040/124205913_zpid/,"For sale: $400,000. Fantastic Sun-Drenched Bi-Level Unit!
This unique duplex home offers a sun filled living room on the main level with high ceilings and a northern treetop sky view. The living room is nicely divided from the kitchen and dining area. The upper level offers a modern kitchen with granite countertops and stainless steel appliances with a separate dining area off the kitchen. The spacious bedroom offers a large closet and with western views of the Palisades. Ample closets and hardwood flooring throughout. The building has new windows that were just installed in 2014 and through the wall A/C sleeves. This immaculately maintained and financially sound coop offers a laundry room, resident superintendent, and is close to the A train, M4, M98 express bus, cafs, restaurants, nightlife, The Cloisters, Ft. Tryon Park, Bennett Park and so much more. PETS OK, PIED A TERRE OK, PARENTS CO-PURCHASING OK"
22,NaN,NaN,-73.936357,40.856899,NaN,NaN,NaN,825,1954,NaN,NaN,Inwood and Washington Heights,https://www.zillow.com:443/homedetails/900-W-190th-St-APT-11A-New-York-NY-10040/92344948_zpid/,NaN
23,NaN,NaN,-73.937539,40.856709,NaN,NaN,NaN,--,1935,NaN,NaN,Inwood and Washington Heights,https://www.zillow.com:443/homedetails/350-Cabrini-Blvd-APT-3F-New-York-NY-10040/79508371_zpid/,NaN
24,475000.00,"66 Overlook Ter # 1P, New York, NY 10040",-73.935447,40.855302,10040,0,1,--,1959,1,1,Inwood and Washington Heights,https://www.zillow.com:443/homedetails/66-Overlook-Ter-1P-New-York-NY-10040/119913967_zpid/,"For sale: $475,000. MAGNiFICENT JUNIOR 4 (3.5 ROOMS) FOR UNDER $500,000. This is a raised first floor apartment, that faces East that has wonderful morning light. It has a large living room with dining area, high 9' foot ceilings, beautifully renovated galley kitchen with granite countertops, subway tile backsplash and marble flooring, stainless steel appliances, including the dishwasher. It has a large bedroom, plenty of closet space and beautiful hardwood flooring throughout. The unit has a pass-thru sleeve for the A/C. Also, this co-op building is ""cat friendly"" only. The co-op has an in-house gym, bike room (wait-list), storage (wait-list), garage (wait-list), common laundry room and there is a large outdoor playground area bordered by large mature trees. The West 187 Street lobby entrance has a part-time attendant and allows 80% maximum financing. The building is located in Hudson Heights, near local restaurants/bars, supermarkets, banks, dry cleaners, upscale spa, wine/liquor stores as well as Bennett Park, Riverside Park, Fort Tryon Park, with its lovely Heather Garden, the Cloisters and so much more."
25,NaN,NaN,-73.934225,40.855142,NaN,NaN,NaN,760,1951,NaN,NaN,Inwood and Washington Heights,https://www.zillow.com:443/homedetails/153-Bennett-Ave-APT-1A-New-York-NY-10040/244727257_zpid/,NaN
