,price,address,logitude,latitude,zipcode,rent,sale,size,year built,bed,bath,Neighborhood,page_url,description
26,438000.00,"225 Bennett Ave APT 2D, New York, NY 10040",-73.932899,40.8577,10040,0,1,725,1940,1,1,Inwood and Washington Heights,https://www.zillow.com:443/homedetails/225-Bennett-Ave-APT-2D-New-York-NY-10040/2086889038_zpid/,"For sale: $438,000. Corner One Bedroom

When you first enter this corner, comfortably-scaled pre-war home with 9 ft ceiling, that is a stone's throw from Fort Tryon Park and all the best of Hudson Heights- you'll smile.

The corner one bedroom overlooks the cliffs and tree lined street. A spacious windowed eat-in kitchen, has new subway tile back-splash, quartz counter-top, tile floor, ample cabinetry, and stainless steel appliances including a dishwasher. A well proportioned living room enjoys sky and tree-top view. The bedroom enjoys a northern and western view with a large walk-in closet. The windowed bathroom has a new vanity. A nice foyer creates a soulful vibe. 

Pieds, co-purchases, and subletting are permitted in this well maintained coop building. Resident super, central laundry with new washers & dryers. You'll love being in close proximity to The Met Cloisters, Inwood Hill Park, Isham Park, Henry Hudson Parkway. Transportation includes A, 1 trains, M4 bus.

Parking garage is right next door (operated separately). Pieds, Parents Co-Purchasing, Subletting are allowed.

Pets are welcomed. Meow Meow Woof Woof (up to 60 lbs)

Some Lenders Are Providing Funds to Cover Closing Costs."
27,NaN,NaN,-73.929992,40.859051,NaN,NaN,NaN,750,1920,NaN,NaN,Inwood and Washington Heights,https://www.zillow.com:443/homedetails/4-Bogardus-Pl-APT-6F-New-York-NY-10040/72535991_zpid/,NaN
28,362999.00,"720 Fort Washington Ave APT 5A, New York, NY 10040",-73.934425,40.857787,10040,0,1,179130,1939,0,1,Inwood and Washington Heights,https://www.zillow.com:443/homedetails/720-Fort-Washington-Ave-APT-5A-New-York-NY-10040/244845488_zpid/,"For sale: $362,999. Your First Home!
Renovated, Mint Condition Studio! Located in an elegant Art Deco co-op in Hudson Heights,This 5th floor studio has a beautifully renovated kitchen with new stainless steel appliances, abundant cabinet space, and quartz counter tops. The bathroom is also newly renovated, with a new vanity, fixtures, medicine cabinet, bathtub and has the original hamper striped to the original metal. The apartment has high ceilings, hardwood floors, brand new window A/C, and has western exposures overlooking at Ft. Washington Avenue and the Palisades.
Museum quality classic 1939 Art Deco building, wonderfully maintained. Right next to the entrance to Fort Tryon Park and The world famous Cloisters Museum (part of the Metropolitan Museum of Art), the building is also pet-friendly so the pups are steps away from one of the best dog runs in the city. This terrific property is nearby playgrounds, parks, restaurants, shops, schools and parking garages. Take the express A train to 190th Street (20 min) and discover Hudson Heights"
29,399000.00,"4489 Broadway APT 5C, New York, NY 10040",-73.932171,40.858055,10040,0,1,--,No Data,1,1,Inwood and Washington Heights,https://www.zillow.com:443/homedetails/4489-Broadway-APT-5C-New-York-NY-10040/123514400_zpid/,"For sale: $399,000. *MINT CONDITION ONE BEDROOM NEAR FORT TRYON PARK* 
This pristine high floor home has been newly refreshed to absolute perfection. Simply move in and start making memories. Filled with glorious light and pretty leafy views, this gem offers an ideal layout for ease of living and entertaining. The tastefully renovated kitchen has plentiful cabinet space, granite counters with subway tile back splash, stainless full-sized appliances and a large open breakfast bar. The living room is also quite generous, accommodating both conversation area plus dining or home office. The bedroom boasts 2 exposures and plenty of space for a king bed and more. The bathroom is done in marble tile with travertine inlay, pedestal sink and a triple medicine cabinet for all your storage needs. Throughout you'll find great closets, crown moldings, beautiful hardwood floors, upgraded electric and custom cellular shades. The super LOW MAINTENANCE is an added bonus! 

Situated in Fort Tryon Gardens, a large, well-run Co-operative with central laundry, bike storage, private storage, resident super and community gardens. 

This pet-friendly building is located at the foothills of glorious Fort Tryon Park, where a short hike up a wooded pathway brings you to a scenic overlook with panoramic views of the Hudson River and Palisades. Just a few minutes from the Cloisters Museum. Within a few-block radius of the apartment are more than a dozen restaurants and bars in addition to a wide variety of groceries, banks, drugstores and services including a gym. The 1 train and A express train are both just across the street. If you long for a greener quality of life without leaving Manhattan, this is your sweet-spot; it's THE destination neighborhood for savvy buyers seeking more space, more serenity and more value."
30,569000.00,"153 Bennett Ave APT 5F, New York, NY 10040",-73.934225,40.855142,10040,0,1,101108,1951,2,1,Inwood and Washington Heights,https://www.zillow.com:443/homedetails/153-Bennett-Ave-APT-5F-New-York-NY-10040/244744799_zpid/,"For sale: $569,000. TWO BEDROOM SANCTUARY!
BACK ON THE MARKET! This stunning unit features both western and eastern views. The home is spacious, adorned with beautiful hardwood floors, the entrance ways flows into an open and tastefully renovated kitchen. The kitchen is equipped with stainless steal appliances and granite counter tops with dishwasher and microwave. The living room and master bedroom face a beautiful and quiet tree lined street. Building amenities include: A furnished patio deck. With a BBQ grill, storage and bike room, a new gym, parking garage (wait list) and a live in super. You are just minutes away from the A train,1 train,M4, M98, M100 buses, shopping, restaurants and Fort Tryon Park. So don't let this opportunity pass you by. Sorry no pets are allowed."
31,399000.00,"245 Bennett Ave APT 4A, New York, NY 10040",-73.93273,40.85822,10040,0,1,316007,1951,1,1,Inwood and Washington Heights,https://www.zillow.com:443/homedetails/245-Bennett-Ave-APT-4A-New-York-NY-10040/244739111_zpid/,"For sale: $399,000. Surrounded by trees and the majestic bedrock of Hudson Heights, you can bask in the sun drenched southern and western exposures of this classic Ft. Tryon Gardens apartment. This unit features an updated kitchen, renovated bathroom and restored original hardwood floors. The windowed kitchen boasts of white subway tiles, dark countertops and GE/Summit appliances, including a dishwasher. The bathroom highlights wraparound porcelain slate tile, new vanity, hardware and fixtures. Excellent closet space, restored original hardwood floors throughout and PET FRIENDLY!! 10% down accepted. 



Lenders available to cover bank closing costs



Ft. Tryon Gardens sits on beautifully manicured grounds nestled right at the foot of Ft. Tryon Park. It is perfectly located across the street from the 190th Street A train and steps away from one of the greatest parks in NYC. The building amenities include laundry, live-in super, bike room, elevator, storage and garage parking."
32,850000.00,"730 Fort Washington Ave APT 4N, New York, NY 10040",-73.934209,40.858215,10040,0,1,102150,1939,2,2,Inwood and Washington Heights,https://www.zillow.com:443/homedetails/730-Fort-Washington-Ave-APT-4N-New-York-NY-10040/244739673_zpid/,"For sale: $850,000. This FANTASTIC corner, 4.5 room apartment is yours for the taking. The ""N"" line is rarely available and offers 2 large bedrooms, (with the master having an ensuite), 2 full windowed bathrooms, as well as a large windowed eat-in kitchen, spacious dining foyer, sunken living room and all the Art Deco details you could ever ask for. Many, many large closets, high ceilings, beautiful hardwood flooring throughout and bright southwestern exposures. Pets OK. This wonderful 1939 Art Deco Co-op building offers a gym ($240/yr), storage facilities (Waitlist), two laundry rooms, private courtyard garden, two bicycle rooms and a part-time security guard. Situated by the Cloisters, Fort Tryon and Bennett Parks, the A Train, M4 and M98 express buses, shopping, local restaurants and so much more. THIS IS AN ESTATE SALE."
33,419000.00,"100 Overlook Ter APT 59, New York, NY 10040",-73.934798,40.856284,10040,0,1,--,1963,1,1,Inwood and Washington Heights,https://www.zillow.com:443/homedetails/100-Overlook-Ter-APT-59-New-York-NY-10040/72657954_zpid/,"For sale: $419,000. SUN-DRENCHED ONE BEDROOM APARTMENT!
( OFFER ACCEPTED) This modern/industrial one bedroom apartment has a beautiful kitchen with an island and tons of counter space. Perfect for hosting dinner parties or preparing a simple home cooked meal. With plenty of storage and shelf space everything has its own place, but is easily accessible. The apartment faces east and gets ton of natural sunlight. The living room is nicely divided from the kitchen area and has plenty of space for a nice entertainment system.The bedroom features two large closets and with eastern views of the neighborhood waking up in the morning will be a true delightBuilding amenities include: 24 hour security,storage and bike room, parking garage,(wait list) porter, live-in super and two laundry rooms. You are close to the A train, 1 train. M4, M98, M100 buses,shopping, trendy restaurants, cafes and Fort Tryon Park. So don't let this opportunity pass you by. Sorry no dogs allowed. Special assesstment of $65.68 till 06/2020."
34,NaN,NaN,-73.929011,40.859411,NaN,NaN,NaN,725,1941,NaN,NaN,Inwood and Washington Heights,https://www.zillow.com:443/homedetails/30-Bogardus-Pl-APT-4D-New-York-NY-10040/72535977_zpid/,NaN
35,595000.00,"360 Cabrini Blvd APT 3D, New York, NY 10040",-73.937272,40.857044,10040,0,1,750,1942,1,1,Inwood and Washington Heights,https://www.zillow.com:443/homedetails/360-Cabrini-Blvd-APT-3D-New-York-NY-10040/114414636_zpid/,"For sale: $595,000. This Junior-4 is the one you've been waiting for! With a 2nd bedroom already created, this inviting corner apartment flaunts a spacious sunken living room, a sizable dining foyer for elegant entertaining, a large master bedroom with dual exposures, inlaid hardwood floors, a windowed bathroom, new high-performance windows (thermal double-pane, double-hung aluminum windows with easy-lift balances), 9-foot ceilings, excellent storage space, an incredibly reasonable monthly maintenance that includes gas, and a beautifully renovated kitchen with gleaming granite countertops, attractive custom cabinetry, and high-end stainless steel appliances including a Bosch dishwasher, oven, microwave, and French door refrigerator. To top it all off, you are just a 20-minute subway commute from Columbus Circle!



Situated in a tranquil residential oasis on the banks of the Hudson River, 360 Cabrini Boulevard is well-maintained, elevator-serviced co-op with excellent financials, a live-in super, and a part-time doorman (4pm-midnight, 7 days a week). Both pets and up to 80% financing are permitted. Residents enjoy a lovely Art Deco lobby, landscaped and furnished common courtyard, storage room, separate air conditioner storage room, bicycle room, newly renovated laundry room, and $55.60 per month bulk rate package that includes cable, Showtime, and high speed internet! 360 Cabrini Boulevard is a green building that participates in every recycling program that NYC has to offer including but not limited to EcycleNYC (electronics recycling), composting, and ReFashion NYC (clothing and accessory recycling). 



Transportation is a breeze with the A train nearly at your doorstep, the 1 train not much further, as well as the express M98 and M4 bus lines. Best of all is having Fort Tyron Park as your backyard! Enjoy its 8 miles of pathways, multiple lawns, Manhattan's largest garden (Heather Garden, which boasts over 500 varieties of plants, trees, and shrubs), the Cloisters, a branch of the Metropolitan Museum of Art that houses nearly 5,000 medieval works, the lauded New Leaf Restaurant & Bar, Manhattan's largest dog run, two playgrounds, volleyball courts, built-in ping pong tables, and unparalleled views of the sparkling Hudson River!"
36,435000.00,"295 Bennett Ave APT 5G, New York, NY 10040",-73.932531,40.858601,10040,0,1,--,No Data,1,1,Inwood and Washington Heights,https://www.zillow.com:443/homedetails/295-Bennett-Ave-APT-5G-New-York-NY-10040/112746343_zpid/,"For sale: $435,000. PHOTOS ON THE WAY! 

*ABSOLUTE PRIVACY-FACING AMAZING CLIFF & OLD ELM TREES* 
Located on the Bennett Ave, cozy tree-lined side street away from Broadway where the beautifully preserved big old trees surrounds this home along with a view of the Majestic Cliff. Facing North and West this rare bright home will remind you of being in the forest! 

Absolutely move-in condition, this property was completely renovated with skilled craftsmanship only several years ago. The hardwood floors in superior condition, walls are all skim-coated and both ceiling and flooring have elegant wood crown molding throughout. The windowed Kitchen has gorgeous one-slab granite counter top. This kitchen is equipped with all stainless steel appliances, including a full size fridge, a dishwasher and the faucet has pull-down sprayer feature for quick sink wash. There are plenty of cabinetry and counter surfaces. This unit offers fabulous closet space. Both of The master bedroom is has two windows looking into the Fort Tryon Park and the silvery cliff. 

There are two major subway lines very close by (Express A line is on the same block, 1 line is one block away). This financially sold coop is offering affordable low maintenance, 24/7 laundry facility, bike room, manicured flower garden, resident super and porters. The coop allows both dogs and cats-with no weight restriction and 90% financing allowed! 295 Bennett Avenue is situated in the heart of Hudson heights, next to the breath-taking Fort Tryon Park with Hudson River views!"
37,NaN,NaN,-73.929489,40.8597,NaN,NaN,NaN,675,1951,NaN,NaN,Inwood and Washington Heights,https://www.zillow.com:443/homedetails/37-Nagle-Ave-APT-5A-New-York-NY-10040/79508235_zpid/,NaN
38,558000.00,"360 Cabrini Blvd APT 6F, New York, NY 10040",-73.937272,40.857044,10040,0,1,--,1942,1,1,Inwood and Washington Heights,https://www.zillow.com:443/homedetails/360-Cabrini-Blvd-APT-6F-New-York-NY-10040/72536371_zpid/,"For sale: $558,000. Welcome home to this exquisite, beautifully maintained Pre-War one-bedroom co-op apartment in Hudson Heights. Upon entering the corner home, you will be greeted by an astonishing, open dining foyer that leads to the renovated kitchen with tasteful shaker wood cabinets, stainless steel appliances, and stone counters. There is even a large alcove for a desk! This airy and welcoming apartment faces north and west with beautiful light throughout the day. The elegant and spacious sunken living room has ample room for gatherings and relaxation. The windowed, eat-in kitchen overlooks the verdant boundary of Fort Tryon Park with an abundance of nature and quiet. The corner bedroom is large and cheerful with two exposures and two closets-with seasonal river views in the cooler months and lovely park views during the warmer months, you will have the best of both. There are 4 closets in total. The restored, windowed bathroom is in excellent condition. This exceptional home is one not to miss! There is a $96.88/month assessment for boiler conversion. 

360 Cabrini Boulevard, built in 1939 with 110 units, is one of the finest examples of Art Deco style architecture located in Hudson Heights. This impeccably maintained co-op is adjacent to Fort Tryon Park with vistas of the Palisades and the George Washington Bridge, and is a short distance to The Met Cloisters Museum. The building amenities include: storage room (wait list and extra fee), new state-of-the-art laundry room, interior garden and seating areas, bicycle room (extra fee), part-time doorman (4PM to 11PM, 7 days per week), live-in super, porter, and a handyman. The building recently installed new, energy efficient windows (2018). The co-op is pet friendly. The A-subway line is minutes away, as are the M-4 and the M-98 bus lines, which are one block away. The 1-line is located on St. Nicholas Avenue. Nearby are shops, restaurants, cafe's, banks, supermarkets, pharmacy, cleaners, spas, hardware store, and other essential services. A great building in a friendly neighborhood with all the amenities that you will need is just minutes away. 80% financing permitted."
39,599000.00,"360 Cabrini Blvd APT 5A, New York, NY 10040",-73.937272,40.857044,10040,0,1,--,1942,1,1,Inwood and Washington Heights,https://www.zillow.com:443/homedetails/360-Cabrini-Blvd-APT-5A-New-York-NY-10040/122197458_zpid/,"For sale: $599,000. Pristine 1 Bdrm + Hm Office + 6 Closets
Fully renovated pre-war, 1 bedroom with home office. Brand new kitchen and stainless steel appliances, granite countertops, beautiful hardwood floors throughout, new walls and molding. Nothing has been overlooked in this renovation! Brand new bathroom with 3 way shower faucet, frameless shower door and beautiful tiling. 6 closets to store all of your belongings. Don't miss out on this large and sunny apartment! $99.38 assessment in place through Dec. 2019."
40,NaN,NaN,NaN,NaN,NaN,NaN,NaN,NaN,NaN,NaN,NaN,Inwood and Washington Heights,https://www.zillow.com:443/homedetail/AuthRequired.htm?r=pfc&zpid=247401493,NaN
