,price,address,logitude,latitude,zipcode,rent,sale,size,year built,bed,bath,Neighborhood,page_url,description
47,890000.00,"3119 37th Ave # 3B, Long Island City, NY 11101",-73.930297,40.754798,11101,0,1,826,2018,2,2,Long Island City,https://www.zillow.com:443/homedetails/3119-37th-Ave-3B-Long-Island-City-NY-11101/2085545816_zpid/,"For sale: $890,000. NOW SELLING! 

 Boutique Condominium in Long Island City One and Two Bedrooms for Sale 

 421-A Tax Abatement ; IMMEDIATE OCCUPANCY! Casual charm blends with a modern sensibility at 31-19 37thAvenue. This stylish 10-unit boutique condominium residence provides unparalleled comfort and quality above the lively yet quintessentially Long Island City streets below. 

 The exterior red brick faade is warm and inviting, setting the tone for the inspired design inside. Shopping, dining and recreation are in close proximity with convenient transportation nearby. 

 Ready to enrich the lives of those call it home, the building features well-proportioned living spaces and carefully curated amenities. The mix of spacious one and two-bedroom units are thoughtfully designed with warm finishes, clean lines and a seamless flow. 

 This intimate collection of apartments represents a commitment to meticulous craftsmanship, smart innovative styling and thorough attention to detail. 

 Each units inviting layout is impeccably designed with the most in-demand finishes, such as red oak wood flooring. Generously-sized private balconies complete most units. The sleek, highly functional kitchens are outfitted with a full array of the most desirable modern conveniences, including Bosch refrigerators, Frigidaire ranges and microwaves, along with Whirlpool dishwashers. 

 The selection of residences also includes a distinctive first floor duplex with a private outdoor living space. Amenities include a spacious roof deck with panoramic views of Manhattan, along with ample storage space. The building has 421-A Tax Abatement. 

 31-19 37thAvenue is ideally situated near Dutch Kills, within easy access to Manhattan via the E, M, R, N and W subway lines. The best of LICs vibrant lifestyle is within reach; surrounded by arts and culture on all sides. With renowned museums including MoMA PS1, Museum of the Moving Image, the Fisher Landau Center for Art, and the Noguchi Museum, along with dozens of art galleries, music venues, restaurants, nightclubs and flea markets, creative energy thrives all around. Queensborough Park is nearby, as is Dutch Kills playground. 

 Its all right here waiting for you to live your life to the fullest in comfortable style."
48,690000.00,"2218 Jackson Ave # 604, Long Island City, NY 11101",-73.946899,40.7448,11101,0,1,466,2018,0,1,Long Island City,https://www.zillow.com:443/homedetails/2218-Jackson-Ave-604-Long-Island-City-NY-11101/2091187525_zpid/,"For sale: $690,000. Open studio unit with walk in closet
Open House hours available daily by appointment. 
This Eastern-facing studio home offers a thoughtful and efficient kitchen layout separate from the living space with ample closet spaces and in-unit full sized washer/dryer. The interior design of the residence is seamlessly modern, with the clean lines of the custom oak flooring and a neutral palette that nevertheless contains a variety of sophisticated details. GALERIE offers distinct living experiences that feature three unique architectural glazing styles- punched windows, window walls, and curtain walls. The workmanship is superior, with materials and finishes that are modern and sublime. Airy and open, the interiors anticipate owners who appreciate a space that can be easily decorated to reflect their personal point-of-view. Seamlessly integrated with the living space, high design and precision woodwork express the quality of the kitchens. Sophisticated matte white oak millwork is complemented with bright white lacquer cabinets. A suite of stainless steel Bosch appliances and LED lighting completes the package. The master bath is an artistic sanctuary with custom lacquer cabinetry and distinctive Zebra-Mink marble wall tiles and accents. All bathrooms include polished 

Directly across the street from MoMA PS1, GALERIE is a place where art, artists and residences share the same address. The architects of ODA New York and interior designers of Paris Forino Design have infused GALERIE with a unique artistic sensibility. GALERIE will feature a curated art program for residents and the community through its ArtBox, a permanent street-level rotating art exhibit at the building's entrance displaying a curated series of art works by New York and LIC artists. The Sculpture Garden at GALERIE provides the rare luxury of accessing the outdoors whenever you desire and hosts a bespoke sculpture by Brooklyn-based artist Allen Glatter. Both relaxing and engaging, the courtyard anchors the expensive amenity spaces that surround it. 

GALERIE is located in the heart of Long Island City, the fastest growing neighborhood in New York. It's vibrant and central location in the arts district affords it enviable access to numerous places to shop, dine and be entertained. 

More than 13,000 square feet of additional amenities include a private off-street porte-cochere entrance leading to enclosed parking; a spacious, art-filled lobby attended 24/7; full-size indoor pool (39x13 feet) which opens to the courtyard; fitness center with state-of-the-art cardio and weight-training equipment and amble space for stretching and personal training sessions; library with books selected from the MoMA PS1 bookstore; lounge; party room; pet spa; stroller storage; and children's playroom. GALERIE will also feature secure bike storage; full-time live-in resident manager; an expansive landscaped rooftop replete with grilling stations, dining areas, and comfortable seating against a postcard-view backdrop of the Manhattan skyline. Rooftop cabanas will be available for purchase. 

The complete offering terms are in an offering plan available from sponsor File NO. CD-170072."
49,1420000.00,"2218 Jackson Ave # 716, Long Island City, NY 11101",-73.946899,40.7448,11101,0,1,1059,2018,2,2,Long Island City,https://www.zillow.com:443/homedetails/2218-Jackson-Ave-716-Long-Island-City-NY-11101/2084910194_zpid/,"For sale: $1,420,000. Stunning courtyard facing 2 bedroom home
This welcoming home delivers two spacious bedrooms including a master suite with walk-in closet and spa-like master bath. Six windows frame the sunny southwestern view to the curated courtyard. The interior design of the residence is seamlessly modern, with the clean lines of the custom oak flooring and a neutral palette that nevertheless contains a variety of sophisticated details. GALERIE offers distinct living experiences that feature three unique architectural glazing styles- punched windows, window walls, and curtain walls. The workmanship is superior, with materials and finishes that are modern and sublime. Airy and open, the interiors anticipate owners who appreciate a space that can be easily decorated to reflect their personal point-of-view. A selection of residences also include private outdoor space. Seamlessly integrated with the living space, high design and precision woodwork express the quality of the kitchens. The dining island features a Caesarstone countertop and waterfall edge detail. Sophisticated matte white oak millwork is complemented with bright white lacquer cabinets. A suite of stainless steel Bosch appliances and LED lighting completes the package. The master bath is an artistic sanctuary with custom dual-sink lacquer cabinetry and distinctive Zebra-Mink marble wall tiles and accents. Glazed ceramic tiled walls with Maku Light in a herringbone pattern make the secondary bath an unexpected luxury. All bathrooms include polished Waterworks fixtures.

Directly across the street from MoMA PS1, GALERIE is a place where art, artists and residences share the same address. The architects of ODA New York and interior designers of Paris Forino Design have infused GALERIE with a unique artistic sensibility. GALERIE will feature a curated art program for residents and the community through its ArtBox, a permanent street-level rotating art exhibit at the building's entrance displaying a curated series of art works by New York and LIC artists. The Sculpture Garden at GALERIE provides the rare luxury of accessing the outdoors whenever you desire and hosts a bespoke sculpture by Brooklyn-based artist Allen Glatter. Both relaxing and engaging, the courtyard anchors the expensive amenity spaces that surround it. 

GALERIE is located one stop from Manhattan in the heart of Long Island City, the fastest growing neighborhood in New York. It's vibrant and central location in the arts district affords it enviable access to numerous places to shop, dine and be entertained. 

More than 13,000 square feet of additional amenities include a private off-street porte-cochere entrance leading to enclosed parking; a spacious, art-filled lobby attended 24/7; full-size indoor pool (39x13 feet) which opens to the courtyard; fitness center with state-of-the-art cardio and weight-training equipment and amble space for stretching and personal training sessions; library with books selected from the MoMA PS1 bookstore; lounge; party room; pet spa; stroller storage; and children's playroom. GALERIE will also feature secure bike storage; full-time live-in resident manager; an expansive landscaped rooftop replete with grilling stations, dining areas, and comfortable seating against a postcard-view backdrop of the Manhattan skyline. Rooftop cabanas will be available for purchase. 

The complete offering terms are in an offering plan available from sponsor File NO. CD-170072."
50,745000.00,"2124 45th Rd # 1, Long Island City, NY 11101",-73.946899,40.746299,11101,0,1,784,2019,0,1,Long Island City,https://www.zillow.com:443/homedetails/2124-45th-Rd-1-Long-Island-City-NY-11101/2085170009_zpid/,"For sale: $745,000. Home is where the heart is and its all here at The Craftsmen. This exciting development brings a new approach to luxury living in Long Island City. 

 These impeccably designed townhomes on 45th Road, 46th Avenue and 47th Road are unlike anything else in the neighborhood. Each unit within the eight 4-story townhomes offers the appeal of being in your own home within the city. Its sure to be a coveted new address at the heart of one of New York Citys most alluring and vibrant communities. 

 The handsome, inviting exterior faade sets the tone for the inspired design of these finely crafted residences. Generously proportioned, these airy units range from studios to 3 bedrooms, accommodating everyones needs while enhancing the definition of home. The result is a private sanctuary that is both separate from and connected to this thriving, dynamic neighborhood. 

 All homes feature high ceilings, solid white oak floors throughout and oversized windows. Ranging from 647 to 1,296 square feet, each unit comes with an individual outdoor space to unwind in and relax. Smartly styled layouts have been meticulously crafted with the most in-demand finishes, all carefully considered to ensure an elegant, refined simplicity that is ready for you to make your own. 

 Thoughtfully crafted gourmet kitchens integrate Bosch refrigerators and dishwashers with Bertazzoni ranges and Bosh microwaves, along with a mosaic tile backsplash and Caesarstone countertops. Stylish bathrooms are outfitted with Grohe faucets and showers, Kohler sinks and toilets. Every home includes a washer-dryer hookup. 

 The Craftsmen Townhomes are ideally situated at the intersection of both Hunters Point and Court Square, an appealing waterfront neighborhood with close proximity to many transit options. Manhattan is easily accessible via the 7, G, E, M and W subway lines. The creative energy of LICs arts and cultural scene is all within reach, along with restaurants, shopping, the John F. Murray Playground, and so much more. 

 Express yourself in a home that feels like it was designed especially for you. Its urban living redefined, resulting in an intimate private retreat that is a combination of comfort and convenience expressed through outstanding craftsmanship."
51,2795000.00,"543 48th Ave APT 8B, Long Island City, NY 11101",-73.927574,40.740389,11101,0,1,2287,2010,3,3,Long Island City,https://www.zillow.com:443/homedetails/543-48th-Ave-APT-8B-Long-Island-City-NY-11101/112510371_zpid/,"For sale: $2,795,000. THIS SALE INCLUDES a STORAGE BIN (#19) and 2 parking spaces (#17&18).
8B is a half of floor penthouse unit facing south and north, both exposures leading to beautiful panoramic views of East River, Queens and Manhattan. This massive unit (convertible 4) features a sprawling 34'8'' x 20'10"" living room with automated solar shades, large windowed kitchen offering top of the line stainless steel appliances, Caesarstone countertop, Italian tiles and ample cabinet space, 3 full bathrooms, king size master bedroom 29'3"" x 14'0"" & bathroom with dual sink, Bosch washer & dryer combo unit, beautiful & Eco-friendly Bamboo floors throughout and in-wall surround sound system.
The solarium is the first LEED-certified GREEN building in Long Island City and offers doorman, video intercom system, elevator, gym, kids playroom, storage space, indoor parking garage and a beautiful fully landscaped (bi-level) 7,000 Sq. Ft. roof deck with panoramic Manhattan views along with projection screen for fun movie nights and It is located only steps away to Gantry State Park, playgrounds, Vernon Jackson subway station and Vernon Boulevard where you can find premium bars, restaurants, and supermarkets? There are 15 years 421A tax abatement in place expiring in June of 2027."
52,NaN,NaN,-73.941703,40.7485,NaN,NaN,NaN,1046,2017,NaN,NaN,Long Island City,https://www.zillow.com:443/homedetails/2519-43rd-Ave-708-Long-Island-City-NY-11101/2093945042_zpid/,NaN
53,1725000.00,"1102 49th Ave APT 7C, Long Island City, NY 11101",-73.95094,40.742468,11101,0,1,1389,2008,2,3,Long Island City,https://www.zillow.com:443/homedetails/1102-49th-Ave-APT-7C-Long-Island-City-NY-11101/94721461_zpid/,"For sale: $1,725,000. "
54,1593550.00,"2717 42nd Rd # 12A, Long Island City, NY 11101",-73.940184,40.74941,11101,0,1,--,2019,2,2,Long Island City,https://www.zillow.com:443/homedetails/2717-42nd-Rd-12A-Long-Island-City-NY-11101/2085394767_zpid/,"For sale: $1,593,550. Beautiful new development in the heart of Long Island City, including many stunning amenities. The elevator building's amenities included: concierge,roof deck, Gym, media room, lounge,outdoor play ground, roof deck, automatic parking, Close to all transportation E,G,M,N,R, W and 7 trains. Just one stop and few minutes from Midtown Manhattan. Easy access to LIRR NYC Ferry, highways and the Midtown tunnel. Must see!"
55,855000.00,"2120 45th Rd # 4, Long Island City, NY 11101",-73.947097,40.746299,11101,0,1,673,2019,1,1,Long Island City,https://www.zillow.com:443/homedetails/2120-45th-Rd-4-Long-Island-City-NY-11101/2086381448_zpid/,"For sale: $855,000. Home is where the heart is and its all here at The Craftsmen. This exciting development brings a new approach to luxury living in Long Island City. 

 These impeccably designed townhomes on 45th Road, 46th Avenue and 47th Road are unlike anything else in the neighborhood. Each unit within the eight 4-story townhomes offers the appeal of being in your own home within the city. Its sure to be a coveted new address at the heart of one of New York Citys most alluring and vibrant communities. 

 The handsome, inviting exterior faade sets the tone for the inspired design of these finely crafted residences. Generously proportioned, these airy units range from studios to 3 bedrooms, accommodating everyones needs while enhancing the definition of home. The result is a private sanctuary that is both separate from and connected to this thriving, dynamic neighborhood. 

 All homes feature high ceilings, solid white oak floors throughout and oversized windows. Ranging from 647 to 1,296 square feet, each unit comes with an individual outdoor space to unwind in and relax. Smartly styled layouts have been meticulously crafted with the most in-demand finishes, all carefully considered to ensure an elegant, refined simplicity that is ready for you to make your own. 

 Thoughtfully crafted gourmet kitchens integrate Bosch refrigerators and dishwashers with Bertazzoni ranges and Bosh microwaves, along with a mosaic tile backsplash and Caesarstone countertops. Stylish bathrooms are outfitted with Grohe faucets and showers, Kohler sinks and toilets. Every home includes a washer-dryer hookup. 

 The Craftsmen Townhomes are ideally situated at the intersection of both Hunters Point and Court Square, an appealing waterfront neighborhood with close proximity to many transit options. Manhattan is easily accessible via the 7, G, E, M and W subway lines. The creative energy of LICs arts and cultural scene is all within reach, along with restaurants, shopping, the John F. Murray Playground, and so much more. 

 Express yourself in a home that feels like it was designed especially for you. Its urban living redefined, resulting in an intimate private retreat that is a combination of comfort and convenience expressed through outstanding craftsmanship."
56,1290000.00,"2626 Jackson Ave APT 602, Long Island City, NY 11101",-73.941135,40.747279,11101,0,1,1048,2007,2,2,Long Island City,https://www.zillow.com:443/homedetails/2626-Jackson-Ave-APT-602-Long-Island-City-NY-11101/93392757_zpid/,"For sale: $1,290,000. Photos coming soon!

 Rare opportunity to own one of the few two bedrooms units at the Vere Condominium in Court Square LIC, and one of the most efficient layouts you could ask for.

 Unit is in impeccable condition. Ample light all throughout the day - South / West / North exposure.

 9'6"" floor to ceiling windows, triple exposure, Juliet balcony, separate dining area, hardwood floors, central heating/cooling, washer dryer, custom Hunter Douglass window shades. Common charges include water, gas, heat, ac, amenities.

 Building amenities include a penthouse gym, outdoor kitchen w/ grill / landscaped roofdeck / storage & cold storage.

 Located 2 blocks away from all major transportation : 7, E, M, G, R, Q, N trains.

 Building Amenities include Penthouse Gym with amazing Manhattan views, a wrap- around terrace and floor to ceiling windows; Roof Terrace, Outdoor Kitchen, Storage, Cold Storage, Video Doorman.

 Easy showings and board approval."
57,965000.00,"217 51st Ave APT 904, Long Island City, NY 11101",-73.957901,40.7429,11101,0,1,808,2008,1,1,Long Island City,https://www.zillow.com:443/homedetails/217-51st-Ave-APT-904-Long-Island-City-NY-11101/2089589328_zpid/,"For sale: $965,000. Unique south-facing studio alcove features incredible views of downtown Manhattan skyline and Williamsburg bridge from its 9th-floor height and oversized windows at the perfectly situated Powerhouse Condominium. Apt 904'sloft layout spans out to an efficient 808 SF giving way to an attractiveliving area while providing an ample bedroom corner nook with a sizable walk-in closet as well as the duo access bathroom. The modern bathroom offers a deep soaking tub, Lacava sink, Kohler fixtures and a marble & wood combo vanity.Additional ample closet upon entry. Rich American walnut hardwood floors.Bosch washer/dryer included in apt. 

 The pristine chef's kitchen gleams with its white lacquer cabinetry accented by dark wood, slick glass backsplash and stainless steel Viking and Miele appliances. All are surrounded by quartzite counter tops and a wenge-wood wraparound bar that invites casual dining with bar height seating. Dishwasher and microwave included. 

 POWERHOUSE: The turn-of-the-century Pennsylvanian Railroad power station transformed into a luxury residence on Long Island City. A masterful collaboration of the world-renowned architect, Karl Fisher and distinguished interior designer, Andres Escobar. 

 THE AMENITIES: 24/7 Concierge Live-in superintendent Free WiFi State-of-the-art fitness center -Massage room Lounge area equipped with pool table and wet bar Media room Business center Childrens playroom Bicycle storage Communal cold storage Common roof terrace with cityscape views, sunbathing deck, BBQ grills and picnic tables on-site Parking rentals available nearby 

 THE LOCATION:Location is ideal, being only one block to the Gantry riverside walkways & parks, the 7 train direct by one stop into Grand Central and quick East River ferry access so close by. Popular food markets, banks & Duane Reade are all accessible within a short distance, while Vernon Blvd with all its charming restos, cafes and unique shops is a mere block and a half away.With its perfect location, the Powerhouse brings tranquility, convenience and is one of the most desirable developments in LIC. It is renowned for its sizable apartments, characteristic charm and fantastic amenities. 

 Tax abatement until 2024."
58,NaN,NaN,-73.941101,40.749,NaN,NaN,NaN,631,2017,NaN,NaN,Long Island City,https://www.zillow.com:443/homedetails/4250-27th-St-APT-6A-Long-Island-City-NY-11101/2086466361_zpid/,NaN
59,1067940.00,"2717 42nd Rd # 17B, Long Island City, NY 11101",-73.940184,40.74941,11101,0,1,709,2019,1,1,Long Island City,https://www.zillow.com:443/homedetails/2717-42nd-Rd-17B-Long-Island-City-NY-11101/2085370849_zpid/,"For sale: $1,067,940. Beautiful new development in the heart of Long Island City, including many stunning amenities. The elevator building's amenities included: concierge,roof deck, Gym, media room, lounge,outdoor play ground, roof deck, automatic parking, Close to all transportation E,G,M,N,R, W and 7 trains. Just one stop and few minutes from Midtown Manhattan. Easy access to LIRR NYC Ferry, highways and the Midtown tunnel. Must see!"
60,1365000.00,"4251 Hunter St APT 3C, Long Island City, NY 11101",-73.939738,40.748683,11101,0,1,1293,2007,2,2,Long Island City,https://www.zillow.com:443/homedetails/4251-Hunter-St-APT-3C-Long-Island-City-NY-11101/83052291_zpid/,"For sale: $1,365,000. THE LARGEST 2BR/2BA IN A DOORMAN BUILDING ON THE MARKET IN LIC



LONG ISLAND CITY DESIGNER-OWNED CONDO ; 1,293 SQUARE 2BR/2BA ; ELEVEN FOOT CEILINGS ; FLOOR-TO-CEILING WINDOWS 





42-51 Hunter Street, Apt 3C is an impressive 1,293 square feet, with a great room measuring a sprawling 28 ft x 15 ft. Owned by a critically acclaimed interior designer who enhanced the aesthetics and functionality of the apartment with a luxurious touch. The living room features 28 linear feet (15 inches deep) of solid wood cabinetry concealed behind custom white matte lacquered doors and custom ambience lighting. Custom shelving, drawers and a media cabinet lie within these beautiful built-ins. In the dining area, an large ebonized ash cabinet has been added for dinnerware, glassware and additional storage. 



The spacious separate kitchen features a custom 29-inch wide countertop, adding 4 inches over the standard width.  Upgraded kitchen cabinetry also compliments the abundance of storage space throughout the apartment, and the top-of-the-line appliances include a Viking Stove, a 36"" Subzero Refrigerator, Built-In Viking Microwave and Viking Dishwasher. The master bedroom suite includes a generous dressing area with three large closets, an enormous en-suite master bathroom with double vanity, and an oversized walk-in shower with Kohler DTV shower system, employing four individual body sprays and rain shower head. 



Additional details of this gorgeous custom home include:



* Wide plank Brazilian cherry wood floors 

* Solid Sapele wood doors

* In-wall speaker system

* Custom window treatments with full height matchstick roller shades, black out shades and sheer curtains

* Custom designed ebonized ash wood HVAC covers (All Rooms) 

* Custom designed ebonized ash wood drop down hideaway desk (Master Bedroom)





BUILDING FEATURES: Boutique condo building with only 24 residences, part time doorman, elevator, cold storage for grocery deliveries, laundry room on every floor, a furnished 4,500 square foot roof deck with picturesque Manhattan views, and a built-in Viking grill and wet bar area. Pets are welcome! 



NEIGHBORHOOD: Excellent Long Island City location. Enjoy the wealth of transportation options - you are blocks to seven subway lines: E, M, R, N, W, G, 7.  The commute to Midtown is 15 - 20 minutes door-to-door. Excellent restaurants, shopping, nightlife and more! 



*NOTE - 15 year 421A tax abatement . Expiring June 30th 2023*"
61,2800000.00,"4304 34th Ave, Long Island City, NY 11101",-73.918455,40.755255,11101,0,1,2448,1928,4,4,Long Island City,https://www.zillow.com:443/homedetails/4304-34th-Ave-Long-Island-City-NY-11101/31941726_zpid/,"For sale: $2,800,000. Prime Lic/Astoria Location. Legal 4 Family Plus Store. 5 Minute Walk To Steinway Street, Subway Station (M & R). Vacant Store Plus Four 1 Bedroom Apartments (That Can Be Delivered Vacant). 1 Block Off Of Broadway And 1 Block Off Northern Blvd. 1,800 Sq Ft Of Retail Plus 2400 Sq Ft Of Residential It Is A Rare Find! Sprinkler System In The Building. Great Income Producer. Call Now, Won't Last!"
62,4975000.00,"3426 44th St # 12, Long Island City, NY 11101",-73.918502,40.7546,11101,0,1,--,1928,22,12,Long Island City,https://www.zillow.com:443/homedetails/3426-44th-St-12-Long-Island-City-NY-11101/2086592730_zpid/,"For sale: $4,975,000. "
