,price,address,logitude,latitude,zipcode,rent,sale,size,year built,bed,bath,Neighborhood,page_url,description
27,NaN,NaN,-73.950798,40.745998,NaN,NaN,NaN,1409,2019,NaN,NaN,Long Island City,https://www.zillow.com:443/homedetails/4620-11th-St-6F-Long-Island-City-NY-11101/2084981727_zpid/,NaN
28,630000.00,"226 50th Ave APT 3J, Long Island City, NY 11101",-73.95838,40.74355,11101,0,1,439,2011,0,1,Long Island City,https://www.zillow.com:443/homedetails/226-50th-Ave-APT-3J-Long-Island-City-NY-11101/117616158_zpid/,"For sale: $630,000. The best value in waterfront Long Island City. One of a kind cozy studio with very low common charges and taxes that can be used for primary residence and an investment. Absolutely no wasted space, this studio comes with your own Bosch washer and dryer and real hardwood flooring throughout the whole apartment. The kitchen features Italian Caesarstone countertops and backsplash, as well as high-end stainless-steel appliances from Fisher & Paykel and Kitchen Aid. The Yard offers, doorman, bike storage, fitness room, residents lounge with access to common terrace and roof deck with barbecue grills and a 7 day a week doorman services nicely round out the amenity features of this boutique luxury building. The is bike storage and parking available per rent in the building. There is a 15 years 421-A tax abatement in place until June 30th of 2027. In between everything you are two blocks away from the East River waterfront and ferry, and one block from the Vernon-Jackson 7 subway stop."
29,1288800.00,"3622 37th St, Long Island City, NY 11101",-73.925657,40.753883,11101,0,1,1540,1920,4,2,Long Island City,https://www.zillow.com:443/homedetails/3622-37th-St-Long-Island-City-NY-11101/31939951_zpid/,"For sale: $1,288,800. This Fully Detached Brick 2 family home is located in Long Island City. It has an M1-1 zoning. The property is located a few blocks from Northern Blvd as well as Steinway Street. This property has tons of potential as there is a lot of development being done in the area. This property is located close to shopping and transportation just a few short stops to Midtown Manhattan. Showings by appointment only. Don't let this wonderful opportunity pass you by. Call today."
30,1250000.00,"3420 Bradley Ave # 4-FAMILY, Long Island City, NY 11101",-73.935501,40.736198,11101,0,1,2688,1931,5,4,Long Island City,https://www.zillow.com:443/homedetails/3420-Bradley-Ave-4-FAMILY-Long-Island-City-NY-11101/2087428873_zpid/,"For sale: $1,250,000. Excellent Location. 4 Family detached corner property in Long Island City with 4/5 car parking.

Bsmt/Subfl: Full, Utility Room

1st Floor:2 Bedroom Apt. + 1 Bedroom Apt.

2nd Floor:1 Bedroom Apt. + 1 Bedroom Apt................."
31,1150000.00,"4126 27th St APT 5D, Long Island City, NY 11101",-73.939122,40.751342,11101,0,1,1120,2006,2,2,Long Island City,https://www.zillow.com:443/homedetails/4126-27th-St-APT-5D-Long-Island-City-NY-11101/79733241_zpid/,"For sale: $1,150,000. A true two-bedroom residence in a great condo building located half a block from Queensborough Plaza station, which sits only one subway stop east of Manhattan. This beautiful unit offers soaring ceilings approaching heights of almost 10 and the chefs kitchen complete with stainless steel appliances and sleek custom cabinetry. A super spacious master bedroom features a nice private master bathroom and a large walk-in closet. Private balcony that can be accessed through living room.



The washer and dryer in unit.



The building has a gym, storage rooms, bike rack, laundry room, and great common roof deck with spectacular city views.



Residents can choose from a variety of subway options only a half block away, including the 7, N, W, F, E, M and R trains. With quick service to all parts of Manhattan, the convenience of this location cannot be overstated.



Parking and storage are included."
32,1195000.00,"1042 47th Rd # 4, Long Island City, NY 11101",-73.951896,40.7443,11101,0,1,993,2019,2,2,Long Island City,https://www.zillow.com:443/homedetails/1042-47th-Rd-4-Long-Island-City-NY-11101/2086278617_zpid/,"For sale: $1,195,000. Home is where the heart is and its all here at The Craftsmen. This exciting development brings a new approach to luxury living in Long Island City. 

 These impeccably designed townhomes on 45th Road, 46th Avenue and 47th Road are unlike anything else in the neighborhood. Each unit within the eight 4-story townhomes offers the appeal of being in your own home within the city. Its sure to be a coveted new address at the heart of one of New York Citys most alluring and vibrant communities. 

 The handsome, inviting exterior faade sets the tone for the inspired design of these finely crafted residences. Generously proportioned, these airy units range from studios to 3 bedrooms, accommodating everyones needs while enhancing the definition of home. The result is a private sanctuary that is both separate from and connected to this thriving, dynamic neighborhood. 

 All homes feature high ceilings, solid white oak floors throughout and oversized windows. Ranging from 647 to 1,296 square feet, each unit comes with an individual outdoor space to unwind in and relax. Smartly styled layouts have been meticulously crafted with the most in-demand finishes, all carefully considered to ensure an elegant, refined simplicity that is ready for you to make your own. 

 Thoughtfully crafted gourmet kitchens integrate Bosch refrigerators and dishwashers with Bertazzoni ranges and Bosh microwaves, along with a mosaic tile backsplash and Caesarstone countertops. Stylish bathrooms are outfitted with Grohe faucets and showers, Kohler sinks and toilets. Every home includes a washer-dryer hookup. 

 The Craftsmen Townhomes are ideally situated at the intersection of both Hunters Point and Court Square, an appealing waterfront neighborhood with close proximity to many transit options. Manhattan is easily accessible via the 7, G, E, M and W subway lines. The creative energy of LICs arts and cultural scene is all within reach, along with restaurants, shopping, the John F. Murray Playground, and so much more. 

 Express yourself in a home that feels like it was designed especially for you. Its urban living redefined, resulting in an intimate private retreat that is a combination of comfort and convenience expressed through outstanding craftsmanship."
33,NaN,NaN,-73.950743,40.743058,NaN,NaN,NaN,1250,2007,NaN,NaN,Long Island City,https://www.zillow.com:443/homedetails/4815-11th-St-APT-5D-Long-Island-City-NY-11101/89070155_zpid/,NaN
34,885000.00,"528 47th Ave # 2A, Long Island City, NY 11101",-73.954498,40.745601,11101,0,1,651,2018,1,1,Long Island City,https://www.zillow.com:443/homedetails/528-47th-Ave-2A-Long-Island-City-NY-11101/2085255580_zpid/,"For sale: $885,000. Open House By Appointment Only - Located at 47-37 Vernon Blvd - ****Please Email To Schedule****

We are pleased to release Vernon 2 Condominiums located at 5-28 47th Avenue in the heart of bustling Long Island City waterfront. The reclaimed brick exterior and oversized factory inspired windows pay homage to Long Island City's Industrial past while the top of the line finishes speak to Long Islands City's future. The Vernon's stand out as one of the very rare boutique style developments, offering spacious loft-like living with a true sense of intimacy. The building's interior hallways draw you in utilizing warm earthy elements such as reclaimed wood, natural stone, and Edison lighting, which guide you into your home. The smart technology utilized for each and every home provides conveniences like wireless Sonos sound systems, Wi-Fi enabled thermostats, recessed lighting throughout, video intercom systems, key-less thumbprint door access, Central Heating and Cooling by Daikin as well as vented stackable washer & dryers in every home.

The building is located on a quiet tree-lined street just one block from the waterfront with its breathtaking views of the Manhattan skyline, along with its sprawling Gantry State park. You really can't ask for a better location. Additionally, you are only minutes from the 7 line's Vernon-Jackson stop which is just one stop into Manhattan.

This contemporary 651 SF one bedroom one bathroom with home office is a uniquely laid out floorplan boasting generous space, ceiling heights exceeding 10ft, and real hardwood wide plank oak flooring. The layout has been thoughtfully designed with an open Scavolini kitchen finished with stainless steel appliances by Blomberg, Bosch and a ducted hood. The spa-like bathroom is finished with imported Spanish & Italian radiant heated tiles, unique imported vanities, Grohe fixtures and a rain shower head. This smart home also features in-wall Sonos speakers for your listening pleasure as well."
35,1100000.00,"2721 44th Dr APT 404, Long Island City, NY 11101",-73.941596,40.746601,11101,0,1,799,2017,2,1,Long Island City,https://www.zillow.com:443/homedetails/2721-44th-Dr-APT-404-Long-Island-City-NY-11101/2085022288_zpid/,"For sale: $1,100,000. First resale in the building! Thoughtfully designed 2 bedroom layout with split bedrooms. The open kitchen has white shaker cabinets, quartz countertops, and a combination of Bosch & Liebherr appliances and custom open shelving installed. King size master bedroom. The serene bathroom comes equipped with Signature fixtures and is lined with floor to ceiling marble tiles. Custom built-ins in all closets. Oversized windows and white oak flooring throughout. W/D in unit. Google Nest thermostats installed in all 3 rooms, Google Nest smoke detectors, Hunter Douglas blinds installed.

The Harrison is the only constructed high rise condominium in Long Island City. Amenities include a full time concierge, a fitness center, a children's playroom, and a resident's lounge that leads out to a furnished roof deck with panoramic views of LIC, Brooklyn, and Manhattan. 15 year 421a tax abatement in place.

Transit: E and M trains at Court Square along with the G train and the R train at Queens Plaza."
36,NaN,NaN,-73.95782,40.744671,NaN,NaN,NaN,1587,2008,NaN,NaN,Long Island City,https://www.zillow.com:443/homedetails/509-48th-Ave-APT-7F-Long-Island-City-NY-11101/83050664_zpid/,NaN
37,1985000.00,"2130 44th Dr # 7I, Long Island City, NY 11101",-73.946296,40.7476,11101,0,1,1428,2019,3,3,Long Island City,https://www.zillow.com:443/homedetails/2130-44th-Dr-7I-Long-Island-City-NY-11101/2085140822_zpid/,"For sale: $1,985,000. CORTE represents the next step in the remarkable evolution of Long Island City. Located on 44th Drive, the building offers a modern aesthetic with precise, yet warm finishes. Every aspect of the building is composed to make urban living more simple, sophisticated, and inspiring. 

 Designed by Argentinian architects Dieguez Fridman and New York based Beyer Blinder Belle, CORTE is a bold new building with clean lines, rich architectural details, and a refined material palette. Wrapped in a tinted glass curtain wall, the contemporary facade appears as a collection of stacked boxes to create a visually stunning experience. 

 Surrounded by landscaped gardens and an extensive amenities package, CORTE is a break from city living. The roof deck provides plenty of room to breathe, sit back, relax, and soak up the sun, gaze at the stars or host some friends for a barbecue. The interior residents lounge is an extension of your home. Entertain friends, get some work done or cuddle up on the plush couch with a glass of wine and a book. CORTE's amenities package also includes a 24-hour doorman, fitness center, kids playroom, and for sale parking."
38,1185000.00,"1042 47th Rd # 3, Long Island City, NY 11101",-73.951896,40.7443,11101,0,1,987,2019,2,2,Long Island City,https://www.zillow.com:443/homedetails/1042-47th-Rd-3-Long-Island-City-NY-11101/2086278616_zpid/,"For sale: $1,185,000. Home is where the heart is and its all here at The Craftsmen. This exciting development brings a new approach to luxury living in Long Island City. 

 These impeccably designed townhomes on 45th Road, 46th Avenue and 47th Road are unlike anything else in the neighborhood. Each unit within the eight 4-story townhomes offers the appeal of being in your own home within the city. Its sure to be a coveted new address at the heart of one of New York Citys most alluring and vibrant communities. 

 The handsome, inviting exterior faade sets the tone for the inspired design of these finely crafted residences. Generously proportioned, these airy units range from studios to 3 bedrooms, accommodating everyones needs while enhancing the definition of home. The result is a private sanctuary that is both separate from and connected to this thriving, dynamic neighborhood. 

 All homes feature high ceilings, solid white oak floors throughout and oversized windows. Ranging from 647 to 1,296 square feet, each unit comes with an individual outdoor space to unwind in and relax. Smartly styled layouts have been meticulously crafted with the most in-demand finishes, all carefully considered to ensure an elegant, refined simplicity that is ready for you to make your own. 

 Thoughtfully crafted gourmet kitchens integrate Bosch refrigerators and dishwashers with Bertazzoni ranges and Bosh microwaves, along with a mosaic tile backsplash and Caesarstone countertops. Stylish bathrooms are outfitted with Grohe faucets and showers, Kohler sinks and toilets. Every home includes a washer-dryer hookup. 

 The Craftsmen Townhomes are ideally situated at the intersection of both Hunters Point and Court Square, an appealing waterfront neighborhood with close proximity to many transit options. Manhattan is easily accessible via the 7, G, E, M and W subway lines. The creative energy of LICs arts and cultural scene is all within reach, along with restaurants, shopping, the John F. Murray Playground, and so much more. 

 Express yourself in a home that feels like it was designed especially for you. Its urban living redefined, resulting in an intimate private retreat that is a combination of comfort and convenience expressed through outstanding craftsmanship."
39,1230000.00,"4620 11th St # 2A, Long Island City, NY 11101",-73.950798,40.745998,11101,0,1,1025,2019,2,2,Long Island City,https://www.zillow.com:443/homedetails/4620-11th-St-2A-Long-Island-City-NY-11101/2087279900_zpid/,"For sale: $1,230,000. NOW SELLING 

 This stylish collection of residences at 46-20 11th Street reconceptualizes the neighborhoods industrial legacy. Where paper factories once stood, The Bond stands out, exuding LICs brash bold spirit of innovation. The result is delightfully chic residences that enliven the neighborhood a rare combination of design and distinguished functionality. 

 Infused with carefully considered elements that enhance the living experience, the 42-unit building is reflective of its commitment to the neighborhood aesthetic. Located close to the water and Gantry State Park, residents are within reach of all that LIC has to offer. 

 The striking brick and glass exterior sets the tone for the residences inside. Clean, modern lines blend with premium finishes and exclusive details in harmonious balance. 

 Apartments are imbued with premium finishes, including 5 wide plank oak flooring and generous ceiling heights. Oversized windows bring the outside in with an abundance of natural light, showcasing views of the neighborhood. These residences are enhanced by the seamless use of technological features for your convenience, including a state-of-the-art multi-functional Toshiba heating/cooling system and smart door locks. All are equipped with Bosch washer/dryer in-unit. 

 Chef-inspired kitchens are elegantly styled. Appointed with custom Egger cabinetry, quartz countertops and backsplashes, and paired with Bosch stainless steel appliances, along with plenty of cabinets and pantry space, these kitchens thoroughly integrate form and function. 

 Bathrooms are outfitted with a Kohler bathtub/toilet, porcelain tiling, and spacious walk-in showers. An Egger Grey Bardolino Oak vanity is complemented by brushed aluminum fixtures and industrial chic LED chrome lighting. The soothing warmth of radiant heated flooring adds a spa-like appeal. 

 When its time to unwind, choose from the entertaining lounge or the landscaped outdoor courtyard on the first floor. Other amenities include a part-time doorman and 24-hour virtual doorman, a fully equipped state-of-the-art fitness center, bike room, package room and garage parking. Pets Allowed."
40,891830.00,"2717 42nd Rd # 3D, Long Island City, NY 11101",-73.9399,40.7493,11101,0,1,712,2019,1,1,Long Island City,https://www.zillow.com:443/homedetails/2717-42nd-Rd-3D-Long-Island-City-NY-11101/2084958328_zpid/,"For sale: $891,830. Welcome to 3D at Star Tower! A Spacious One Bedroom offering 721 sq ft of living space! 



Star Tower, a tall modern glass and steel luxury condominium in Long Island City, is a beacon at the heart of this vibrant and exciting neighborhood, soaring 25 stories with amazing panoramic views of Manhattan.



Star Tower is just one subway stop from Midtown Manhattan and conveniently located with 7 different subway lines (N, W, R, 7, E, V, G) just 2 blocks away.



Star Tower offers LIC's largest Amenities Package - over 14,600 Square Feet - including its SkyDeck Cabanas with Landscaped Rooftop Sun Terrace and SkyLounge with Rooftop Billiards Lounge, all while enjoying the best Skyline Manhattan Views in the city including the Empire State Building, Chrysler Building and Freedom Tower. 



Star Tower also boasts the largest in-building residents-only private park; a sweeping Great Lawn two stories above the street with outdoor Children's Playground and Zen Garden. Other must-have amenities include a State-of-the-Art Fitness Center featuring a spectacular Indoor Waterfall, Attended Lobby, 24-hour Video Intercom and App, available Private On-Site Parking with Automatic Robotic Car Parking System, a Bike Room, Theater/Media Lounge, and available Private Storage. Of course the condo is Pet Friendly so your entire family is welcome at Star Tower! 



Star Tower offers expansive southern exposures that drench the homes in sunlight and offer unparalleled views of the Manhattan skyline. Star Tower also boasts the finest finish package in LIC with fully integrated Stainless Steel Kitchen appliances including Fisher Paykel Refrigerators and Bosch Ranges, Microwaves and Dishwashers, all topped off with gorgeous solid Quartz Countertops and glass backsplash. Bathrooms provide spa-like experiences with Kohler Oblo Fixtures, Italian Scarabeo Sinks, Oversized LED-Lighted Medicine Cabinets and Italian Limestone. The Living Room and Bedrooms include Oak Hardwood floors throughout and generous Walk-In Closets. Other special features include High Ceilings up to 11 feet, Floor-to-Ceiling Windows, Central Air Conditioning and Heat, in-unit Washer/Dryer hookups, 8-foot Tall Interior Doors and Building-Wide High Speed FiOS internet.



With 5-Star Hotel Style Amenities, a money-saving 15-Year Tax Abatement, and LOW common charges of approximately $0.89 CENTS per Square Foot - the lowest in LIC - it's easy to see why Star Tower is the smart choice for modern luxury living."
41,1985000.00,"525 47th Rd # 4B, Long Island City, NY 11101",-73.954696,40.745201,11101,0,1,1587,2019,3,2,Long Island City,https://www.zillow.com:443/homedetails/525-47th-Rd-4B-Long-Island-City-NY-11101/2085556386_zpid/,"For sale: $1,985,000. Open House by Appointment: located at 47-37 VERNON BLVD **Please Email to Schedule**

Bringing the industrial feel into inviting living spaces, this exquisite south facing 3-bedroom, 2-bath w/ private 146 sq ft terrace, span across a spacious 1,587 square feet space with 9 foot ceilings. The residence features brick interior walls, rustic wood floors, expansive windows and an in-unit washer and dryer, plus a 225 sq ft private roof deck. Adding old-fashioned character, prewar-inspired double-hung windows frame lofty views of Long Island City. Modern convenience is at the heart of Greystone's open kitchens, with fine rift-cut oak cabinets, white quartz countertops, stainless steel Viking package upgrade, apron-front sinks with spring coiled faucets and pot fillers, a tile backsplash, and stainless steel appliances with a fully vented range hood. Bathrooms feature Kohler tubs and Grohe faucets and are well-appointed and distinctive, combining the polish of Venetian bronze fixtures with uniquely distressed porcelain tiles in shower and floor. Additionally, the residence includes a private rooftop space. Evoking Long Island City's industrial past, Greystone reference's the area's manufacturing legacy with a sleek warehouse feel. This new boutique residence revives a level of historic architectural detail often lost in new construction. Inside this 4-story elevator building, sunlight floods through the airy lobby's floor-to-ceiling windows to illuminate rustic porcelain tile, red brick walls and sculptural steel beams. Greystone offers a full range of services and amenities including a landscaped communal roof garden w/ grill area, on-site parking garage, private storage rooms, bicycle storage, fitness center & virtual doorman. 

 The Greystone is located on a quiet tree-lined street just one block from the waterfront at Gantry State Park with its breathtaking views of the Manhattan skyline. One stop from Grand Central on the 7 train."
42,918090.00,"2717 42nd Rd # 5D, Long Island City, NY 11101",-73.940184,40.74941,11101,0,1,712,2019,1,1,Long Island City,https://www.zillow.com:443/homedetails/2717-42nd-Rd-5D-Long-Island-City-NY-11101/2085396665_zpid/,"For sale: $918,090. Beautiful new development in the heart of Long Island City, including many stunning amenities. The elevator building's amenities included: concierge,roof deck, Gym, media room, lounge,outdoor play ground, roof deck, automatic parking, Close to all transportation E,G,M,N,R, W and 7 trains. Just one stop and few minutes from Midtown Manhattan. Easy access to LIRR NYC Ferry, highways and the Midtown tunnel. Must see!"
43,1350000.00,"4821 5th St APT 2L, Long Island City, NY 11101",-73.955596,40.743999,11101,0,1,1068,2005,2,2,Long Island City,https://www.zillow.com:443/homedetails/4821-5th-St-APT-2L-Long-Island-City-NY-11101/2085463446_zpid/,"For sale: $1,350,000. Welcome home to The Gantry located at 48-21 5th Street, prime LIC. This gorgeous split 2 bed/2 bath, with its own private terrace, has been fully updated with all Samsung stainless steel appliances, beautiful white cabinets and white marble designed quartz countertops and a new LG w/d. The master bedroom is big enough for a king sized bed, has lots of closet space and the en suite bathroom has also been totally renovated with marble counters and a new vanity. The second bedroom is also spacious with good closet space!! Enjoy BBQs with your Weber Natural Gas Grill on your very own private 174 sq. ft. terrace!!! A brand new very quiet Daikan hvac split system has also been installed making this gorgeous apt. move in ready!! The Gantry is a boutique building consisting of 47 units with a live in Super, P/T Doorman, recently renovated gym, roof deck, residents lounge and parking garage. There is a 421A Tax Abatement in place thru 2023. Located in prime waterfront LIC, one block from Vernon Boulevard home of restaurants, cafes, wine bars and gourmet supermarkets, 3 blocks to the 7 train and 3 blocks to the ferry. This is a great opportunity!!"
44,773660.00,"2717 42nd Rd # 4H, Long Island City, NY 11101",-73.9399,40.7493,11101,0,1,604,2019,1,1,Long Island City,https://www.zillow.com:443/homedetails/2717-42nd-Rd-4H-Long-Island-City-NY-11101/2085416995_zpid/,"For sale: $773,660. Beautiful new development in the heart of Long Island City, including many stunning amenities. The elevator building's amenities included: Concierge, Roof Deck, Gym, Media Room, Lounge, Outdoor Play Ground, Automatic Parking, Close to all transportation E, G, M,N,R W and 7. Just one stop and few minutes from Midtown Manhattan. Easy access to LIRR NYC Ferry, highways and the Midtown tunnel. Must See!"
45,NaN,NaN,-73.950798,40.745998,NaN,NaN,NaN,1592,2019,NaN,NaN,Long Island City,https://www.zillow.com:443/homedetails/4620-11th-St-7A-Long-Island-City-NY-11101/2084981728_zpid/,NaN
46,NaN,NaN,-73.927579,40.74039,NaN,NaN,NaN,503,2008,NaN,NaN,Long Island City,https://www.zillow.com:443/homedetails/509-48th-Ave-APT-4J-Long-Island-City-NY-11101/83053646_zpid/,NaN
